;date;text;id;key
1048;2020-03-29 18:27:29+00:00;- det er da fantastisk flot Viggo når du åbenbart har smagssanserne i topform - her som altid kun iskold skummetmælk - men når det bli'r sommer er det umuligt at undgå med byens bedste fiskeforretning som underbo - rejer+Chablis - sild+Linje+Pils og fru Fisks deller til Merlin ;1244330355064258561;@karemolbak
1049;2020-03-29 18:17:06+00:00;Sådan forstod jeg det heller ikke! Men man har jo sine favoritter! Har både rød, hvid og rosé men holder pt. en pause!;1244327739211071488;@karemolbak
1050;2020-03-29 18:13:00+00:00;Jeg foragter ikke en øl, skriver bare, hvad jeg godt kan lide. Og.... jeg har drukket lidt mere vin end jeg plejer, hver aften 1 glas vin.;1244326710042124288;@karemolbak
1051;2020-03-29 18:10:10+00:00;En kold øl er aldrig at foragte Stella! Især fra et lokalt micro bryggerier! Lige nu kunne jeg godt nyde en GT eller en Bloody Mary - for ikke at sige en god Rom eller en god Cognac. Har ikke drukket spiritus den sidste md. ;1244325994716168192;@karemolbak
1052;2020-03-29 18:05:03+00:00;Det handlede om værnemidler Stella og @tv2newsdk roder som altid rundt i det... ;1244324706406338565;@karemolbak
1053;2020-03-29 18:01:50+00:00;Jeps, men der har lige været noget om, at vi drikker for meget i denne tid. Så jeg ændrer den ikke til mine smagsganer ;1244323898130411521;@karemolbak
1054;2020-03-29 18:00:37+00:00;"- slår ikke Linje og Pilsner Urquell - verdens bedste ""sæt"" ";1244323593175076866;@karemolbak
1055;2020-03-29 17:58:44+00:00;Det står dig frit for at ændre teksten! ;1244323117801132038;@karemolbak
1056;2020-03-29 17:54:44+00:00; Det skulle bare have været en Gin/Tonic eller Rosévin i stedet for øl ;1244322113684746240;@karemolbak
1057;2019-01-01 13:22:53+00:00;Not all of these wonderkids turned out to be 'the next superstar' ;1080091997111812097;@karemolbak
1058;2020-03-28 17:01:42+00:00;#Aprilsnar? Riget åbner spritny #COVita afdeling onsdag 1. april... og den er go' nok https://nyheder.tv2.dk/2020-03-27-se-billederne-saadan-ser-rigshospitalets-nye-corona-afdeling-ud @statsmin @SosseRossen @Heunicke @STPS_DK @KareMolbak @SSTbrostrom @LMSTSenderovitz #coronavirusdk #Covid19dk #COVID2019dk #dkpol #dkmedier @tv2newsdk @DR1TV;1243946377173966849;@karemolbak
1059;2020-03-28 16:37:40+00:00;Vil stadig holde fast i min udtalelse ... kræver også meget talent at finde og udvælge guld bunke sand ;1243940329163763712;@karemolbak
1060;2020-03-28 16:34:13+00:00;1000 tak Dennis - men det er ikke mig der laver de små opslag - hugger de bedste her fra og skriver lidt tekst https://www.instagram.com/andershemmingsendk/?utm_source=ig_embed ;1243939462205321216;@karemolbak
1061;2020-03-28 16:28:31+00:00; Pas godt på dig selv i denne svære tid kære Georgi du er et kreativt geni!;1243938025404596225;@karemolbak
1062;2020-03-28 15:34:55+00:00;1-0 til Brøndby @statsmin @SosseRossen @Heunicke @STPS_DK @KareMolbak @SSTbrostrom @LMSTSenderovitz #coronavirusdk #Covid19 #Covid19dk #COVIDー19 #COVID2019dk #DanmarkStårSammen #dkpol #dkmedier @tv2newsdk @DR1TV;1243924538188070916;@karemolbak
1063;2020-03-28 14:27:59+00:00;Skal vi satse på flokimmunitet eller “hurtigere diagnose, isolation og karantæne” som exitkriterie? Jeg tror på det sidste, der er meldt ud af Bruce Aylward fra WHO i Politiken. @KareMolbak forsvarer tilsyneladende det første. ;1243907695410806784;@karemolbak
1064;2020-03-28 11:07:28+00:00;Du skaber en falsk konflikt ved at spørge en WHO ansat om herd immunity uanset, at dette ikke er DK strategi. @KareMolbak forsøger at formidle sin viden om virus, som du sætter ind i din egen kontekst og konkluderer på. Et åbenlyst problem når journalister ikke forstår fagfolk.;1243857232577642497;@karemolbak
1065;2020-03-28 10:18:18+00:00;Det er det gode spørgsmål ;1243844860077060096;@karemolbak
1066;2020-03-28 09:57:49+00:00;"""Hans kritik af den strategi om at skabe flokimmunitet, som Kåre Mølbak, faglig direktør for infektionsberedskab hos Statens Serum Institut, fredag fortalte om i Politiken, er skarp og direkte.""";1243839704593727488;@karemolbak
1067;2020-03-28 09:47:32+00:00;Politiken har lavet et interview med @KareMolbak som forklarer om virus. Journalisten spørger en WHO ansat om herd immunity og konkluderer, at den danske strategi (ved SSI) er kritisabel. 1. Den danske strategi er ikke herd immunity 2. Det er ikke SSI der beslutter DK strategi;1243837116825600000;@karemolbak
1068;2020-03-28 08:34:01+00:00;@SSTbrostrom og @KareMolbak har aldrig ANBEFALET en strategi, som fremmer eksplosiv udvikling af #COVID2019dk og hurtig flokimmunitet. Du fordrejer myndighedernes udsagn! Ikke rosværdigt af dig! Tværtimod! #dkmedier #dkpol;1243818615889108997;@karemolbak
1069;2020-03-28 07:17:43+00:00;Brostrøm talte forleden om at I først betragtede det som en sars/mers-lignende sygdom, men at I senere skiftede til at opfatte det som noget der minder mere om pandemisk influenza . Hvornår skete det skift egentlig?;1243799414034104320;@karemolbak
1070;2020-03-28 06:56:41+00:00;#DagensArtikel1afX @TyraTgv (@SSI_dk) om det øjeblik det gik op for hende den var gal https://www.weekendavisen.dk/2020-13/ideer/vendepunkter @statsmin @SosseRossen @Heunicke @STPS_DK @KareMolbak @SSTbrostrom @LMSTSenderovitz #coronavirusdk #Covid19dk #COVIDー19 #COVID2019dk #dkpol #dkmedier @tv2newsdk @DR1TV;1243794121925500928;@karemolbak
1071;2020-03-28 06:55:42+00:00;@SSTSundhed har i snakket masker endnu? Hva er jeres holdning? Er der skaffet nok værnemidler til sundhedsvæsnet? @KareMolbak ;1243793871680790528;@karemolbak
1072;2018-11-15 11:49:50+00:00;They could have been so much more.;1063036348603527168;@karemolbak
1073;2020-03-27 23:40:46+00:00;12 danskere forsøgskaniner for #Covid19 medicin. PRO:https://www.dr.dk/nyheder/indland/danskere-skal-vaere-forsoegskaniner-coronamedicin?cid=newsletter_nb_5-vigtige-eftermiddag_20200327160413 CONTRA: https://www.statnews.com/pharmalot/2020/03/13/gilead-coronavirus-covid19-clinical-trials/ @statsmin @SosseRossen @Heunicke @STPS_DK @KareMolbak @SSTbrostrom @LMSTSenderovitz #coronavirusdk #Covid19dk #COVIDー19 #COVID2019dk #dkpol #dkmedier @tv2newsdk @DR1TV;1243684417048121345;@karemolbak
1074;2020-03-27 22:39:59+00:00;Jeg ved ikke, hvorfor du siger “I”. Manden bliver præsenteret for nogle af de ting, @KareMolbak siger - det er jo ikke noget Politiken finder på.;1243669120954097669;@karemolbak
1075;2020-03-27 20:50:15+00:00;Gad vide hvad det seneste R0 estimat fra @SSI_dk og @KareMolbak er i dag. Altså med alle de data vi har indtil nu? ;1243641504574431232;@karemolbak
1076;2020-03-27 20:14:05+00:00;@Heunicke @SSTbrostrom @KareMolbak - godt at der nu er enighed om teststrategierne - Er der kvalificerede bud på, om vi reelt har mistet andet end data undervejs? #COVID2019dk;1243632403274436614;@karemolbak
1077;2020-03-27 18:58:46+00:00;#DagensDansker igen, igen https://www.instagram.com/smilfonden/ http://smilfonden.dk/stoet/ @statsmin @SisseF @SosseRossen @Heunicke @STPS_DK @KareMolbak @SSTbrostrom @LMSTSenderovitz #coronavirusdk #Covid19 #Covid19dk #COVID2019dk #DanmarkStårSammen lørdag kl. 20 #dkpol #dkmedier @tv2newsdk;1243613450951163912;@karemolbak
1078;2020-03-27 15:19:58+00:00;Meldingerne har været lidt skiftende, men det er vist løst nu. Jeg tror man har kikket på Norge, som har testet 4,5 gange flere, og sagt hvis de kan så skal vi også.;1243558388342145029;@karemolbak
1079;2020-03-27 15:02:53+00:00;"I dag da alle var til sind at intet skulle ske da bragte WHO i Danmark ind et pressemøde i tv ""STOP VERDEN, jeg vil af""! @statsmin @SosseRossen @MFMorten @Heunicke @STPS_DK @KareMolbak @SSTbrostrom @LMSTSenderovitz #Covid19dk #COVID2019dk #dkpol #dkmedier @tv2newsdk @DR1TV";1243554088136126464;@karemolbak
1080;2020-03-27 14:26:42+00:00;@KareMolbak Er der lavet tilsvarende analyser i DK, og hvad er tallene for worst case I DK? ;1243544982465785857;@karemolbak
1081;2020-03-27 14:15:40+00:00;@DRNyheder @WHO @WHO_Europe @folketinget @Statsmin @SSTSundhed @SSI_dk @KareMolbak Hvorfor denne besættes med 'test'? Pandemien udeblev jo!! Stop de tests, det er meningsløst. Hvorfor løber DR WHO's ærinde hele tiden? Taiwan fulgte IKKE WHO = nul pandemi. ;1243542207212240899;@karemolbak
1082;2020-03-27 13:53:54+00:00;Er problemet ikke usikker forsyning til af materiale til at udføre tests? Hvis man skruer op nu, øger man sandsynligheden for mangel på test til meget syge patienter og sundhedspersonale i næste uge. (Ved ikke om det stadigt er et problem med forsyning).;1243536728029265920;@karemolbak
1083;2020-03-27 13:30:11+00:00;Well man kan konstatere at både myndighederne selv samt andre lande, er begyndt at satse massivt på tests. De mener nok ikke vi har råd til at lade være.;1243530759429898240;@karemolbak
1084;2020-03-27 13:27:57+00:00;Vigtig info!;1243530197305098246;@karemolbak
1085;2020-03-27 13:11:59+00:00;Helt enig. Kåre Mølbak har tidligere oplyst at der bliver foretaget prøve tests rundt omkring i landet for at indsamle data. Man behølver ikke test alle for at få præcis information. Det er vist en standard procedure, der også bruges til at overvåge influenza.;1243526179203801088;@karemolbak
1086;2020-03-27 13:04:04+00:00;Vi skal bruge det her til at lære. Og have et ordentligt beredskab til næste gang. Kunne kortlægge og læse data. This is not just about now.;1243524187320434688;@karemolbak
1087;2020-03-27 13:00:22+00:00;Ja. Test antistof bliver vigtig for genåbning, og for at vide om man risikerer at smitte bedstemor. Disse test er på vej. Pointen er, at det er spild at bruge kostbare ressourcer på at jagte alle smittekæder nu. Vi skal alligevel igennem det.;1243523257464127489;@karemolbak
1088;2020-03-27 12:18:44+00:00;Aldrig har så få offentligt ansatte gjort så meget for så mange. 1000 tak. Pas godt på jer selv og jeres kære @statsmin @SosseRossen @Heunicke @STPS_DK @KareMolbak @SSTbrostrom @LMSTSenderovitz et al God #Covid2019dk weekend fra Merlin #dkpol #dkmedier @tv2newsdk @DR1TV;1243512777198768139;@karemolbak
1089;2020-03-27 11:04:25+00:00;Hej @SSTSundhed og @SSI_dk, @KareMolbak og @SSTbrostrom m.fl. Jeg er sund, rask og de facto i isolation. Bør jeg opsøge corona, så I kan få vinget mig af i smittespredningslisten? #COVID19DK #coronavirusdk;1243494075942215681;@karemolbak
1090;2020-03-27 10:37:27+00:00;Jeg synes da bestemt, at den enkelte borger er med i synspunktet: Det handler om at styre, så der er behandlingskapacitet til alle syge. Helt reelt: Det er eneste mulighed. Alt andet får du i nakken bagefter. Det fokus ser jeg fraværende i bl.a. USA og desværre også i Sverige;1243487290128773121;@karemolbak
1091;2020-03-27 10:11:00+00:00;@KareMolbak Kåre Mølbak, manden der i 2003 vurderede at SARS ville dræbe 30-40 millioner mennesker. Samme mand vurderer nu, at de fleste af os skal smittes og mange af os vil dø, før vi er ovre det her. - Uacceptabelt! Nu rådgiver han officielt regeringen! #covid2019DK;1243480633122394112;@karemolbak
1092;2020-03-27 09:49:08+00:00;Gør ny evidens om, at #covid19 kan bekæmpes langt mere aggressivt og direkte end ved at skabe naturlig #flokimmunitet intet indtryk på Statens Serum institut @SSI_dk og @Karemolbak. Måske skulle han lytte mere til #WHO og #regeringen. #dkpol. @Politiken;1243475131441258497;@karemolbak
1093;2020-03-27 09:47:03+00:00;Præcis derfor det ikke giver nogen mening at teste alle danskere med et PCR assay - det er et øjebliksbillede. Giver kun mening hvis man vil bruge oplysningen til noget i næste sekund (test skal være konsekvensbærende);1243474604494073856;@karemolbak
1094;2020-03-27 09:28:07+00:00;Men for at kunne monitorere situationen og sikre at den ikke løber af hænde er testing vigtig, og især når immunoassays dukker op og man kan blive testet hos egen læge.;1243469841421434882;@karemolbak
1095;2020-03-27 09:25:21+00:00;Enten er @KareMolbak dårlig til at forklare sin pointe, eller journalisten er dårlig til at formidle den. Det optimale er at danskerne kommer igennem epidemien med et konstant antal nye tilfælde pr. uge. Så opnår vi gradvis flokimmunitet samtidig med hospitalerne ikke overvældes.;1243469147541045248;@karemolbak
1096;2020-03-27 09:20:30+00:00;Havde Kina fulgt @KareMolbak 's strategi om at skabe naturlig flokimmunitet, havde landet formentlig haft op mod 1 mio. døde på grund af #covid19. Godt at @Heunike nu lytter til WHO og lægger bekæmpelsesstrategi baseret på erfaringer. http://politiken.dk/7727704;1243467926168092672;@karemolbak
1097;2020-03-27 08:59:20+00:00;#DagensMand @KareMolbak, tør hvor #dkpol tier @statsmin @SosseRossen @Heunicke @STPS_DK @SSI_dk @SSTSundhed @SSTbrostrom @SSTProbst @LMSTdk @LMSTSenderovitz #coronavirusdk #Coronadk #Covid19 #Covid_19 #Covid19dk #COVIDー19 #COVID2019dk #Covid2019 #dkmedier @tv2newsdk @DR1TV;1243462596612820993;@karemolbak
1098;2020-03-27 08:59:05+00:00;Vidste ikke der var install. et hemmeligt cam hos mig! ;1243462533442408448;@karemolbak
1099;2018-11-15 11:49:50+00:00;They could have been so much more.;1063036348603527168;@karemolbak
1100;2020-03-27 08:52:23+00:00;@KareMolbak hvor mange % af befolkningen skal smittes og hvor længe regner du med det tager at opbygge flokimmunitet?;1243460849697730560;@karemolbak
1101;2020-03-27 08:50:10+00:00;Ja Sydkorea kan noget - men styreformen er jo et stykke væk fra vores og det giver nogle muligheder som vi ikke har. Glæder mig over at #dkpol har fået øje på deres teknologiske høje niveau :);1243460291196784640;@karemolbak
1102;2020-03-27 08:22:51+00:00;Det er jo det gode ved sygekasserne. Der er det patientrettigheder, man direkte har betalt til. I modsætning til skat der bare opkræves uden krav om modydelse.;1243453416837431297;@karemolbak
1103;2020-03-27 08:11:12+00:00;Så sandt. Det er velkendt fra Jobcentersystemet.;1243450486918963202;@karemolbak
1104;2020-03-27 07:56:28+00:00;Hvilke successer tænker du på her?;1243446776281038849;@karemolbak
1105;2020-03-27 07:56:21+00:00;Han har en god sammenhæng i sin argumentation.;1243446747998965760;@karemolbak
1106;2020-03-27 07:54:52+00:00;WHO taler jo til en målgruppe der dækker alt fra støvet landsby i et U-land til København og Verdens største metropoler - så nationale perpektiver skal ind over hver gang WHO udtaler sig Artiklen fra @politiken giver vel egentlig også det billede? #dkpol gør det godt denne gang!;1243446374110298113;@karemolbak
1107;2020-03-27 07:47:55+00:00;"Som jeg forstår @KareMolbak er det jo netop planen at få smittepresset delt op i ""bølger"" af en størrelse som I kan klare?";1243444627522433024;@karemolbak
1108;2020-03-27 07:45:17+00:00;Tak - jeg studsede bare over “i tilfælde af lyst”. Det lød meget dyrt og unødvendigt, hvis ikke det forudsatte en lægefaglig vurdering af, om det nytter noget (ud over alene tilfredsstillelse af patientens lyst). :);1243443960997130240;@karemolbak
1109;2020-03-27 07:42:24+00:00;Det er derfor folkesundhed og folkerepublik har lidt den samme klang i mine øren. Det er politisk styret det hele. Ikke patientorienteret.;1243443238662483968;@karemolbak
1110;2020-03-27 07:40:21+00:00;Jeg mener, det først og fremmest bør være mellem mig og lægen. Og ikke mellem mig og politikerne. Eller lægen og politikerne. Sådan virker de i CH og Tyskland. Hvis min læge og jeg er enige om en given test, skal den laves.;1243442720892497920;@karemolbak
1111;2020-03-27 07:35:45+00:00;Mener du også det når der ikke er tale om COVID-19? Hvis en læge feks. vurderer, at hvad end det har ramt mig er ufarligt og går over af sig selv, men jeg ønsker at blive testet for specifikke sygdomme, så bør det være min ret?;1243441564153757696;@karemolbak
1112;2020-03-27 07:27:10+00:00;Hmmm. Nej. Det er i Amerika en forfatningsgaranteret rettighed som oprindeligt handlede om, at man skulle kunne forsvare sig mod ydre fjender - læs englænderne;1243439405047611392;@karemolbak
1113;2020-03-27 07:26:27+00:00;Tænk jeg synes faktisk at artiklen viser at @KareMolbak har stor indsigt :) Omvendt finder jeg det håbløst naivt at tro på DK som en steril sæbeboble der svæver rundt i et inficeret univers. Se bare hvad der sker med udenlandsk arbejdskraft! WHO's målgruppe r U- OG I-lande;1243439224667484160;@karemolbak
1114;2020-03-27 07:23:05+00:00;Er det ikke det samme tankesæt der ligger bag den amerikanske holdning til våben, der videnskabeligt set er en trussel mod folkesundheden men den enkeltes ret til at skyde coronavirus & andre mennesker vejer tungere end fællesskabet?;1243438375325052929;@karemolbak
1115;2020-03-27 07:14:49+00:00;@KareMolbak Der er idag 41 døde Covid-19 i DK. A) Hvor lang tid fra indlæggelse til død? B) Hvor mange tilfælde var der da de blev syge? C) Hvad er CFR ift antal tilfælde ved indlæggelsen?;1243436294027587585;@karemolbak
1116;2020-03-27 06:59:50+00:00;Vi kunne give alle der har haft corona et stempel i passet så de kunne få lov at rejse og købe tøj. Det er som om du ikke rigtig forstår at der er en ret stor omkostning ved, at vi intet ved om hvem der har sygdommen.;1243432525286051841;@karemolbak
1117;2020-03-27 06:57:49+00:00;Jeg kan dog forstå, at SSI mener, en sådan test kan gøre en stor forskel...;1243432016806363136;@karemolbak
1118;2020-03-27 06:54:17+00:00;Mange af de post-Corona-Symptomer, som nogle patienter får, ligner ME-symptomer. Se forsker Amy Proals tråd, hvor også hun forudser en stigning i antallet af ME-patienter i kølvandet på #COVID19. @SSTProbst, @KareMolbak, @Heunicke, @Blixt22, @Susanne_Zimmer_ , @stinuslindgreen;1243431130377998336;@karemolbak
1119;2020-03-27 06:51:59+00:00;Det har ingen konsekvens. Spillereglerne er ikke ændret siden den spanske syge. Hvis du er syg skal du blive hjemme, hvis du er rigtig syg skal du kontakte læge og evt på sygehus. Hvis du er rask, så glæd dig over det og kom videre. Forklar lige hvad der er specielt nu?;1243430550406336512;@karemolbak
1120;2020-03-27 06:46:38+00:00;En forklaring fra @KareMolbak på hvorfor DK har valgt en mere restriktiv teststrategi. Det er ikke et mål at stoppe smitten i den danske strategi, det udskyder problemet til senere, fortæller han https://politiken.dk/forbrugogliv/sundhedogmotion/art7727704/K%C3%A5re-M%C3%B8lbak-er-uenig-med-WHO-Det-er-%C2%BBtotalt-pass%C3%A9%C2%AB-at-indd%C3%A6mme-smitten #dksund #covid19dk #coronadk;1243429203720142848;@karemolbak
1121;2020-03-27 06:43:01+00:00;Men hvis jeg har forstået det ret, er man immun en rum tid, hvis man har haft corona. Det har mange haft uden at vide det. Synes du ikke, de har ret til at blive gjort bekendt med det? At de er immune?;1243428294898278401;@karemolbak
1122;2020-03-27 06:37:54+00:00;Jeg har stadig 100% tillid til fagfolk som @KareMolbak og @SSTbrostrom helt sådan er det ikke længere med @Heunicke, og jeg er helt tryg ved at bo i Danmark i denne tid.;1243427003778269185;@karemolbak
1123;2020-03-27 06:37:26+00:00;#tagsamtalen er et koncept der er standard i det danske sundhedsvæsen - det er en rutine for sundhedsprofessionelle og det eneste rigtige @OveGaardboe;1243426886979432448;@karemolbak
1124;2020-03-27 06:30:49+00:00;Hvis @KareMolbak er vores fremmeste ekspert og internationalt anerkendt, hvorfor har regeringen så ikke mere tillid til ham end WHO ? #COVID19dk #COVID2019dk #coronadk #coronavirusdk #dkmedier #dkpol;1243425223279439877;@karemolbak
1125;2020-03-27 06:24:31+00:00;@KareMolbak skal også have en actionmand figur @politiken #COVID19;1243423637723418626;@karemolbak
1126;2020-03-27 06:19:53+00:00;Vel at mærke en “rigtig” rækkefølge, som den enkelte ingen indflydelse har på, fordi man ikke bliver testet og derved ikke kan styre sin risiko. Derved blir det i højere grad jer, der bestemme hvem der skal dø. Det synes jeg trods alt godt den enkelte (ældre) selv må være med til;1243422471065227264;@karemolbak
1127;2020-03-27 06:19:02+00:00;Synes at @KareMolbak er både klog og modig. Han siger hvad han mener ud fra et dybt fagligt perspektiv og lader politik være politik. Det skal han jo også - men presset må være stort i denne tid! https://politiken.dk/forbrugogliv/sundhedogmotion/art7727704/K%C3%A5re-M%C3%B8lbak-er-uenig-med-WHO-Det-er-%C2%BBtotalt-pass%C3%A9%C2%AB-at-indd%C3%A6mme-smitten;1243422256048398338;@karemolbak
1128;2020-03-27 06:12:56+00:00;Det er en systemholdning. Andre lande - Tyskland og CH - handler det om borgeren. Ikke klienten. Men vi to har jo diskuteret det mange gange og bliver ikke enige. Det er bare sigende, at nu handler det om at gøre folk syge i den rigtige rækkefølge i stedet for at holde dem raske;1243420720828272641;@karemolbak
1129;2020-03-27 06:10:20+00:00;Det hedder folkesundhed, der i modsætning til den enkeltes sundhed, varetager fællesskabets sundhed baseret på evidens og bedste faglige viden (hvilket vi må erkende ofte afvises af politikere), men fra det faglige udgangspunkt beskytter vi den enkelte bedst & mest ligeværdigt;1243420069398319104;@karemolbak
1130;2020-03-27 06:08:24+00:00;Ja, jeg dette tankesæt forekommer menneskefjernt, men hvis regeringen foretrækker en mere aggressiv strategi, teste fx, der lader dem sætte sundhedsfolk ind som soldater og vise handlekraft, er det ikke også kynisk. Nu da det ikke virker mere, som Mølbak hævder?;1243419583022682113;@karemolbak
1131;2020-03-27 06:07:54+00:00;Men du gør det jo netop personafhængigt. Af dig og jer... Og al respekt for det! Men jeg synes, borgeren har krav på det som en ret - at være subjekt og feks blive testet i t a symptomer - eller bare lyst! tak for indsats uanset.;1243419456191094785;@karemolbak
1132;2020-03-27 06:04:00+00:00;Pas - det sker ikke på min vagt, tværtimod;1243418474719768576;@karemolbak
1133;2020-03-27 06:02:49+00:00;At grisen ikke bliver lykkeligere af at blive vejet - det er sådan set et meget godt udtryk for holdningen til borgeren. Jeg tror, mange borgere ville være lykkeligere af jævnligt at kunne blive testet.;1243418176722886656;@karemolbak
1134;2018-11-15 11:49:50+00:00;They could have been so much more.;1063036348603527168;@karemolbak
1135;2020-03-27 06:01:22+00:00;Hvor er borgeren henne i synspunktet? Alt handler angiveligt om systemet. Ikke borgeren og hans servicering. I modsætning til feks Tysklands sygekassesystem. Det er ofte den kedelige konsekvens i velfærdsstatslige sundhedssystemer. Borgeren bliver et objekt.;1243417811109572608;@karemolbak
1136;2020-03-27 03:42:33+00:00;Meget interessant artikel. Grundig forklaring for synspunkter af @KareMolbak #COVID19 kan måske stoppes midlertidigt i velhavende østater og hvor man svejser folk inde i flere uger. På den lange bane er det noget vi skal igennem... helst uden at sundhedssystemet bryder sammen.;1243382878995484677;@karemolbak
1137;2020-03-26 22:57:46+00:00;Det lyder jo godt, men som hun nævner er det en uvant situation med denne virus, og hun ved det jo egentlig ikke. Derfor er det risikabelt at slippe den ind uden kamp.;1243311208184393733;@karemolbak
1138;2020-03-26 22:57:40+00:00;Hvorfor går resten af verden med masker, når vi får at vide de ikke virker? Hvad er det vi ved, som resten af verden ikke ved? @SSTSundhed @SSTbrostrom @KareMolbak @Heunicke;1243311185489022976;@karemolbak
1139;2020-03-26 22:38:02+00:00;Lone Simonsen mener, at når vaccinen er klar, er de fleste nok allerede imune;1243306240991793153;@karemolbak
1140;2020-03-26 21:33:41+00:00;10.000-34.000 døde i Danmark. Fyr den mand omgående.;1243290050294579200;@karemolbak
1141;2020-03-26 21:02:59+00:00;Adskillige asiatiske lande har med held fået undertrykket den. Mhp vaccine så er jeg imod tvang, men jeg tror ikke at der kommet til at mangle interesse.;1243282323740729349;@karemolbak
1142;2020-03-26 20:57:35+00:00;Tror du, vi kan holde samfundet lukket så længe? Og skal man i givet fald tvinge folk til vaccine?;1243280965620895760;@karemolbak
1143;2020-03-26 20:56:01+00:00;Man kunne vel overveje at undertrykke sygdommen indtil man har en vaccine. Det lader til at være WHO og Asiens plan. Mølbaks plan er Storbritanniens med lidt ekstra social distancing.;1243280569670262784;@karemolbak
1144;2020-03-26 20:38:42+00:00;Er der noget alternativ? ;1243276211708706816;@karemolbak
1145;2020-03-26 20:29:08+00:00;Det har vi gættet i på i lang tid @KareMolbak, men rart at det bliver sagt direkte. Jeg håber sandelig ikke at vores politikere accepterer det her. #covid19dk;1243273805361020933;@karemolbak
1146;2020-03-26 17:56:40+00:00;@nikolajstagis savner lederskab nu før DK bli'r kørt over af #COVID2019dk https://pov.international/lederskab-teststrategi-savnes/ @statsmin @SosseRossen @Heunicke @STPS_DK @SSI_dk @KareMolbak @SSTSundhed @SSTbrostrom @SSTProbst @LMSTdk @LMSTSenderovitz #Covid19dk #COVIDー19 #dkpol #dkmedier @tv2newsdk @DR1TV;1243235434328723456;@karemolbak
1147;2020-03-26 16:41:46+00:00;Blot lidt spøjst at man kan holde hånden under, noget man selv har unødigt forværret. Dette er dog det bedste indtil nu, det skaber efterspørgsel. De andre fastholder et udbud, som der med stor sandsynlighed ikke er brug for når støtter ordninger udløber. Spildte mia.;1243216585965424640;@karemolbak
1148;2020-03-26 15:37:22+00:00;DKs største lev. til sundhedssektoren har vist ikke stor fidus til @NWammen @statsmin @SosseRossen @Heunicke @STPS_DK @SSI_dk @KareMolbak @SSTSundhed @SSTbrostrom @SSTProbst @LMSTdk @LMSTSenderovitz #Covid19dk #COVID2019dk #Covid2019 #dkpol #dkmedier @tv2newsdk @DR1TV;1243200378830815239;@karemolbak
1149;2020-03-26 12:48:46+00:00;Retweet: Til ære for @pomaEB + mange andre @statsmin @SosseRossen @Heunicke @STPS_DK @SSI_dk @KareMolbak @SSTSundhed @SSTbrostrom @SSTProbst @LMSTdk @LMSTSenderovitz #coronavirusdk #Coronadk #Covid19dk #COVIDー19 #COVID2019dk #COVID2019dk #dkpol #dkmedier @tv2newsdk @DR1TV;1243157951105372161;@karemolbak
