;date;text;id;key
730;2020-04-20 15:04:53+00:00;@MichaelSvarer @ProfJLundgren @MereteKonnerup @DalgaardCarl @SSTbrostrom @KareMolbak @Leif_VP @OleToftSundhed der er et kæmpepotentiale i at få valideret og samtænkt både modeller, statistisk metode, strategi og datafortolkning mellem topsundhedsfolk og topøkonomer.;1252251902563307521;@karemolbak
731;2020-04-20 14:50:32+00:00;"@KareMolbak @SSI_dk @JakobEllemann @Statsmin @SSTbrostrom @folketinget Hvad sker der når Danmark opdager, at jeres beslutninger er baseret på forkert data? Det vil blive opklaret. Stanford U: Lethality &lt;0.12% &lt;flu";1252248287375228928;@karemolbak
732;2020-04-20 14:31:20+00:00;If. @BBCWorld advarer en japansk virusekspert nu om, at OL i Tokyo måske end ikke kan afholdes i 2021.;1252243458871496704;@karemolbak
733;2020-04-20 14:17:47+00:00;Så det ikke og skal ikke udlægge @KareMolbak's motiver, men det indtryk får man, og heldigvis for det: R på 1.2 med stor risiko opad er et farligt sted at være. +20% hver 10. dag – det løber hurtigt op. https://twitter.com/coronakamp/status/1251822222483828737?s=20;1252240045781716995;@karemolbak
734;2020-04-20 14:10:18+00:00;Det var ikke det han sagde. Men at de kunne være et af flere scenarier.;1252238164518977541;@karemolbak
735;2020-04-20 14:09:13+00:00;Hej Pil. Jeg kritiserer timingen og det tvivlsomme indhold. Det drejer sig om et usikkert estimat, som pt. gør mere skade end gavn at formidle. De fleste overholder anbefalingerne og har forstået situationens alvor. Myndighederne bør være varsomme med at skabe fremtidsangst.;1252237890936909825;@karemolbak
736;2020-04-20 14:07:27+00:00;"En jeg kender mente det kunne have modsat effekt. At folk siger; så kan det være lige meget, nu socialiserer vi bare og tager Coronaen på kinden, som BOJO sagde";1252237445590142976;@karemolbak
737;2020-04-20 14:00:47+00:00;Med respekt, Abir. (Som altid når jeg kommenterer på dine gode Tweets) - Hvis det er en sandhed, er det så måden at det leveres at du kritiserer? Uden at kunne sammenligne 1:1 så taler man i USA om t.o.m. 2022 (Via CNN) - En ny virkelighed som vi skal lære?;1252235770242297856;@karemolbak
738;2020-04-20 13:59:20+00:00;Det var så heller ikke hans besked. Han fremlagde det som ét muligt scenarie af mange;1252235403748245508;@karemolbak
739;2020-04-20 13:55:35+00:00;Din udlægning: “Nu kan vi ikke gøre andet end at sidde derhjemme et år” stemmer ikke overens med indholdet af artiklen. #covid19 har medført frustrerende tiltag. Men den bliver ikke bedre af at kaste med øgenavne. Ny situation. Positivt at @KareMolbak deler sin indsigt.;1252234459581054978;@karemolbak
740;2020-04-20 13:49:14+00:00;"Kære @KareMolbak. Din besked om udsigt til social afstand i op til ét år var chokerende. Flere lider af afsavn, hudsult &amp; social isolation. Din udmelding kan påvirke det mentale &amp; psykiske helbred. Pas på med de dystre, usikre prognoser. De virker unødigt demoraliserende. #dkpol";1252232860838158342;@karemolbak
741;2020-04-20 13:45:00+00:00;Helt enig, jeg har selv set mine 81 og 84-årige forældre regelmæssigt sammen med min 8-årige datter. På gåture i skoven og i mine forældres have. Naturligvis med passende afstand og håndsprit.;1252231796898492419;@karemolbak
742;2018-11-15 11:49:50+00:00;They could have been so much more.;1063036348603527168;@karemolbak
743;2020-04-20 13:35:50+00:00;Kære @KareMolbak Hvordan kan du vide at kønssygdomme er faldet, når folk ikke har haft nogen steder at blive testet? P.S. skulle spørge fra en ven! #COVID19dk #sundpol;1252229490974982149;@karemolbak
744;2020-04-20 13:33:10+00:00;Mølbak har været forbi MF og fået skæld ud;1252228819026493440;@karemolbak
745;2020-04-20 13:32:25+00:00;Siger han ikke bare, at citatet er trukket skarp op? Fx fra andre medier, som ikke tager hans forbehold med.;1252228629452341254;@karemolbak
746;2020-04-20 13:32:15+00:00;Vi skal holde fysisk afstand, ikke social afstand! Har lige været til 90 års fødselsdag på vejen, udendørs med håndsprit, portvin og chokolade. Det var en rørt 90 årig, der tog imod sine gæster.;1252228588935319555;@karemolbak
747;2020-04-20 13:25:50+00:00;Er citaterne ikke modstridende? Eller misforstår jeg noget?;1252226975793467392;@karemolbak
748;2020-04-20 13:24:56+00:00;Det er mange scenarier for #coronavirus udviklingen. Foreningsidrætten kan bidrage med, at vi på den lange bane i fællesskab kan holde modet oppe og samtidig håndtere de vigtige forholdsregler, der bryder smittekæder @KareMolbak @SSTbrostrom @Heunicke @DIFidraet #dkpol;1252226748709605380;@karemolbak
749;2020-04-20 13:23:57+00:00;Argh “måneder eller år” ctr “mindst et år”. Ikke nogen diskrepans;1252226501237518337;@karemolbak
750;2020-04-20 13:23:26+00:00;Enig! Det er sgu da Mølbak der ikke har tænkt sig om. Ikke jer der har vinklet forkert!;1252226368034742272;@karemolbak
751;2020-04-20 13:22:14+00:00;"""Det kan altså vare måneder eller år, før danskerne kan leve livet som før coronakrisen. Det siger Kåre Mølbak."" ""Vi skal undgå håndtryk, kram og kindkys og store forsamlinger i mindst et år, siger Kåre Mølbak"" I første citat kan det vare måneder. Næste citat mindst et år.";1252226065985990657;@karemolbak
752;2020-04-20 13:19:52+00:00;Han er seriøst den bedste. Tænk, at han reddede mig fra at sidde på min flade og vente på mailsvar.;1252225470759940096;@karemolbak
753;2020-04-20 13:18:55+00:00;Se bare, man kan altid regne med @KristofferMiles !;1252225231713943554;@karemolbak
754;2020-04-20 13:17:19+00:00;Hej Henrik. Alle citater er godkendt af @KareMolbak, og jeg står i hvert fald selv inde for vinklingen af historien. Bh. Christian, journalisten bag historien;1252224830763655169;@karemolbak
755;2020-04-20 13:12:32+00:00;Jounalister forstår virkelig ikke at @KareMolbak ikke har en krystalkugle hvor han kan se hvordan virus udvikler sig.;1252223627619155968;@karemolbak
756;2020-04-20 13:02:34+00:00;@SSTbrostrom og @KareMolbak er altså med afstand de to største sheriffer i 2020;1252221119605637122;@karemolbak
757;2018-11-15 11:49:50+00:00;They could have been so much more.;1063036348603527168;@karemolbak
758;2020-04-20 12:57:04+00:00;Desværre ikke, men min kollega @KristofferMiles er derinde. Måske han ofrer sig for holdet, hvis de ikke vil forholde sig mere konkret til #1årgate.;1252219733350514695;@karemolbak
759;2020-04-20 12:56:02+00:00;Er du med til pressemøde nu for at stille det her spørgsmål?;1252219473957998592;@karemolbak
760;2020-04-20 12:54:04+00:00;Klar fordel at være gift;1252218977650180099;@karemolbak
761;2020-04-20 12:54:02+00:00;Dont worry, nu siger @Heunicke, at de selvfølgelig ikke kan give en dato.;1252218970318483456;@karemolbak
762;2020-04-20 12:53:29+00:00;Før det sagde Mette “meget længe” eller sådan noget, så som ikke det er same-same;1252218833689075719;@karemolbak
763;2020-04-20 12:36:52+00:00;Bare gå efter en sexpartner med 2 meter lange arme, så der stadig kan sikres behørig afstand ved handjobs.;1252214652043476993;@karemolbak
764;2020-04-20 12:36:12+00:00;Som sædvanligt: hvad sker der, hvis det så viser sig, at geniet @KareMolbak tog fejl? Det er helt risikofrit at skræmme folk og skade landet.;1252214484762066946;@karemolbak
765;2020-04-20 12:07:45+00:00;Hvad er 1 års gate?;1252207325315846144;@karemolbak
766;2020-04-20 12:05:31+00:00;Det vil faktisk sige, at man kun må have sex med folk i sin nære omgangskreds? Potentielt akavet.;1252206762217922560;@karemolbak
767;2020-04-20 12:04:23+00:00;Ser du det her @BjarkeCharlie?;1252206475214303232;@karemolbak
768;2020-04-20 12:03:54+00:00;Men var det før eller efter #1årgate;1252206355362045953;@karemolbak
769;2020-04-20 12:02:23+00:00;Det håber jeg. Ellers føler jeg mig altså lidt cock blocket. Jeg var ikke klar!;1252205974817067008;@karemolbak
770;2020-04-20 12:01:20+00:00;Der er en Q&A! Jeg hørte @SSTbrostrom himself svare på det i radioen. Jeg husker ikke præcis hvad han sagde andet end at jeg elskede ham en smule mere bagefter. (Noget med at sex er sundt... og han svarede på spørgsmål om bollevenner også);1252205709237911555;@karemolbak
771;2020-04-20 12:01:00+00:00;Måske er det ligesom med legende børn. Få legekammerater, de samme legekammerater og gerne udenfor? @SSTbrostrom? @SSI_dk? @Spolitik?;1252205625758699522;@karemolbak
772;2020-04-20 11:59:46+00:00;Godt spørgsmål, tilføjer det straks til spørgeplanen;1252205316541952002;@karemolbak
773;2020-04-20 11:59:06+00:00;Og hvad nu hvis man finder en fast bolleven nu. Må man det? Jeg var altså ikke gelt klar, da Mette sagde “NU”.;1252205146269982720;@karemolbak
774;2020-04-20 10:40:35+00:00;Det er jeg enig i. Og mange økonomer gør allerede god gavn i sundhedsvæsenet og er en del af modellering og analyser. Men respekter nu både økonomer og lægers fagkundskaber og analyseevner;1252185386144739329;@karemolbak
775;2020-04-20 10:03:37+00:00;Hvis hun er på plejehjem. Så, skulle der blive åbnet for feks udendørs besøg med god afstand.;1252176084864548864;@karemolbak
776;2020-04-20 09:56:46+00:00;At arbejde med statistik, tal, modellering, strategi og kommunikationen af det er en dominerende del af både uddannelse og job for en meget stor del af økonomer. I denne situation kan I få afgang til de allerbedste af dem. Ring til dem og bed dem lægge de kvantitative strategier.;1252174362309951488;@karemolbak
777;2020-04-20 09:51:58+00:00;Og hvis vi nu får et politisk kulturskifte, hvor vi klart skelner mellem hvad der er faglige vurderinger og hvad der er politiske valg, ville vi være nået langt. F.x. kunne man se på om man kan have et mere fleksibelt boligmarked, så folk ikke bliver lukket inde i for små hjem;1252173152844763136;@karemolbak
778;2020-04-20 09:45:25+00:00;Prøv fx og sammenhold pensum i statistik på medicinstudiet med pensum i statistik på KU polit. og AU econ. Yderligere evidence: Forskningsprojekter på medicin trækker typisk på bioanalytikernes statistiske kompetence. Økonomerne har eget subfield kaldet econometrics.;1252171504969814017;@karemolbak
779;2020-04-20 09:41:09+00:00;Jo. Som jeg har skrevet andetsteds. Hans vurdering er en faglig vurdering. Vi har brug for den og andre faglige vurderinger. Og så må vi tage nogle politiske valg på den baggrund;1252170431504752640;@karemolbak
780;2020-04-20 09:35:59+00:00;Hvilken betydning får @KareMolbak s udmelding for hjælpepakker til kulturen? Åbning af resten af landet? Betyder det konkret, at det hedder max. 10 forsamlet i et år? Restauranter mm forbliver lukket? Storcentre? Efterskoler? Højskoler?;1252169130683367427;@karemolbak
781;2020-04-20 09:21:13+00:00;Man må vel kunne forlange, at de journalister, der render rundt og mener en masse, i det mindste har sat sig ind i det, de mener noget om. @KareMolbak er epidemiolog og giver os indblik i virus. Måske i skulle starte med at lytte og forstå istedet for at råbe #dkmedier;1252165413636583425;@karemolbak
782;2020-04-20 09:20:33+00:00;Forhåbentlig arbejdes der i døgndrift på at løse det problem som åbenbart er verdensomspændende.;1252165245658968067;@karemolbak
783;2020-04-20 09:16:49+00:00;Ja men det må vi så finde en løsning på.;1252164306432598017;@karemolbak
784;2018-12-03 14:51:27+00:00;The worst foreign signings in Premier League history!;1069605034357338113;@karemolbak
785;2020-04-20 09:16:08+00:00;Fordi vi stadig ikke har masker nok? Er mit gæt.;1252164135799971846;@karemolbak
786;2020-04-20 09:03:47+00:00;"Altså: selvfølgelig er der dygtige læger og økonomer. Også til statistik. Men hvor er grundlaget for ""økonomer er bare bedre til tal, statistik og stategi"" - lidt vidtløftigt";1252161025513791493;@karemolbak
787;2020-04-20 08:59:12+00:00;Med værnemidler som maske og afstand / håndvask og sprit så kan man godt ses. Det relevante spørgsmål er hvorfor vi ikke gør så personalet på plejehjem har masker på.;1252159873862766592;@karemolbak
788;2020-04-20 08:35:05+00:00;Jeg forstår godt at det er en forfærdelig situation for jer. Men hvis din mor bliver smittet risikerer hun at smitte personalet og så kan de tage smitten med rundt til alle de andre beboere på plejehjemmet. Men jeg håber der findes en løsning ;1252153803593469955;@karemolbak
789;2020-04-20 08:26:52+00:00;Mon @KareMolbak’s udtalelse om et års social distance i kombination med erfaringerne fra Norge, bliver den milepæl, der gør at vi langt om længe kan få en åben, oplyst og civiliseret debat om afvejningen af de forskelige hensyn? #dkpol;1252151737164738561;@karemolbak
790;2020-04-20 07:54:14+00:00;A/ Lad de ældre selv bestemme om de vil have besøg. Mange har ikke langt igen og tager gerne chancen, de vil herfra med et knus. B/ Test pårørende lige inden besøg og for hvert besøg. Få nu gang i de test! @Heunicke @Spolitik @SSTbrostrom @KareMolbak #dkpol #COVID19dk;1252143526093246466;@karemolbak
791;2020-04-20 07:37:40+00:00;Men vi skal skam være fysiske - bare på afstand.;1252139356732690432;@karemolbak
792;2020-04-20 07:34:14+00:00;Men jeg tænker, at vi bliver nød til at udfordre præmissen over tid. Og undersøge, hvad der sker med os, hvis vi ikke er fysiske i så lang tid.;1252138492014067714;@karemolbak
793;2020-04-20 07:00:51+00:00;Man vil altid kunne finde nogle læger, der er bedre til statistik end nogle økonomer. Det er et ‘anecdotal evidence’ argument. Argumentation baseret på viden om statistik identicerer mønstre, der er relevant for nationale politiske beslutninger.;1252130091464884224;@karemolbak
794;2020-04-20 06:54:50+00:00;Jeg kender altså ikke økonomer, der ser sådan på menneskeliv. Det er en slem stråmand.;1252128574565482496;@karemolbak
795;2020-04-20 06:08:31+00:00;Få børnebørn og oldebørn til at ringe ofte. Meget gerne med Skype.;1252116921316773893;@karemolbak
796;2020-04-20 05:59:30+00:00;"Økonomerne skal også begynde at forstå at sundhed er mere kompliceret end ""produktion af menneskeliv"" Og så kan jeg som økonom godt fastslå, at rigtig mange læger er ret gode til statistik. Og der også findes økonomer der ikke er ret gode på det felt";1252114651158056966;@karemolbak
797;2020-04-20 05:53:50+00:00;Vi skal ikke holde social afstand, som @KareMolbak siger. Vi skal holde fysisk afstand. Kæmpe forskel. #corona;1252113224901820419;@karemolbak
798;2020-04-20 05:15:44+00:00;Det er jo priværdigt at nogen siger sandheden.;1252103634265014272;@karemolbak
799;2020-04-20 04:59:24+00:00;Jeg synes i og for sig, at Mølbaks udmelding er temmelig uansvarlig. Han betinger også sit udsagn af en række ubesvarede spørgsmål om virus, så reelt siger han ikke, at vi skal regne med 1 år mere . Han siger måske;1252099525373841408;@karemolbak
800;2020-04-20 04:40:57+00:00;Fantastisk med “Kåre uden spin” ... han er klart bedst :) #LetsBeReal;1252094881021022208;@karemolbak
801;2020-04-20 03:07:21+00:00;Lægerne skal begynde at lytte til økonomerne. Økonomer er bare bedre til tal, statistik og strategi. Det er der brug for nu. Det har der længe været brug for. @Lone_Frank @TomJensen1966 @MereteKonnerup @Leif_VP @ProfJLundgren @SSTbrostrom @KareMolbak @QvortrupHenrik @MartinCEPOS;1252071327843995649;@karemolbak
802;2020-04-19 23:37:03+00:00;Skulle både min mor og jeg dø af corona-infektion, har vi i det mindste fået taget en ordentlig afsked med hinanden. Det tæller mere for både hende og mig. Jeg ville dø med total ro i sjælen. Det ville jeg ikke uden den rigtige afsked.;1252018403596009473;@karemolbak
803;2020-04-19 23:26:11+00:00;Til gengæld hørte jeg tal fra Irland, over halvdelen af deres coronarelaterede dødsfald er plejehjemsbeboere. Det samme gælder de områder i USA, hvor der er lavet optællinger. Over halvdelen af alle dødsfald. Det er værd at overveje.;1252015667324366848;@karemolbak
804;2020-04-19 22:43:59+00:00;Hvis hun bor på plejehjem kan det vel ikke lade sig gøre?;1252005050538438659;@karemolbak
805;2019-01-01 13:22:53+00:00;Not all of these wonderkids turned out to be 'the next superstar' ;1080091997111812097;@karemolbak
806;2020-04-19 22:31:48+00:00;holde dig selv i karantæne i ti dage inden besøg.;1252001982438690816;@karemolbak
807;2020-04-19 22:24:41+00:00;Hvis hun er 96 så ville jeg nok drikke kaffe i haven med afstand. Men med en afklaring om det var en risiko.;1252000191810592771;@karemolbak
808;2020-04-19 22:16:06+00:00;Kære @KareMolbak Hvad skal jeg gøre i forhold til min 96årige mor, som allerede er dybt fortvivlet over ikke at kunne møde børn, børnebørn og oldebørn, hvis afstandtagen skal vare yderligere et år? Det kan blive hendes psykiske død.;1251998031488135169;@karemolbak
809;2020-04-19 21:38:42+00:00;@regeringDK kaster i hundredevis af milliarder omkring sig i øjeblikket. Hvorfor er vi nu 2 måneder inde i epidemien stadig ikke igang med aggressiv testning af ALLE som WHO har anbefalet fra start. ??? @KareMolbak;1251988618920505345;@karemolbak
810;2020-04-19 20:39:25+00:00;Total umulighed at holde afstand et år tror bare vi må få delt nogle masker ud og testet noget mere. @KareMolbak ingen dårlige nyheder igen på en søndag , lad os få dem om mandagen. ;1251973699990958080;@karemolbak
811;2020-04-19 19:27:13+00:00;Tror nogle gange jeg misforstår like-funktionen - er det 5 dybt asociale mennesker der har liket dette opslag?? Det bliver også et rungende nej tak her fra @KareMolbak;1251955530895101953;@karemolbak
812;2020-04-19 10:37:30+00:00;Undervurderer vi R0 og dermed smittestigning ved genåbning? @ssi_dd og @KareMolbak tager kloge forbehold for effekten af vedtagen genåbning. Dog tages R0 på 2,5 for givet med henvisning til bl.a. Imperial College. Men IC har efter metaanalyse justeret R0 til 3,28. #covid19dk 1/4;1251822222483828737;@karemolbak
813;2020-04-19 07:59:13+00:00;Jeg ved ikke, hvad resten af artiklen byder på, men spørgsmålet er helt centralt. @mortensode @SSTbrostrom @MereteKonnerup @mvinaes @MartinCEPOS @OleToftSundhed @LarsIgum @PerLarsenC @PaulaLarrain1 @KareMolbak @MichaelSvarer @DalgaardCarl @JuulMona @hansersej @dyrby;1251782391410184192;@karemolbak
814;2020-04-18 08:27:32+00:00;Lidt som når @SSI_dk og @KareMolbak tamper parametre ind i en legetøjs SIR/SEIR model, når disse egentlig er stotastiske variable med en ukendt fordelingsfunktion #COVID19 #GarbageInGarbageOut;1251427126789767168;@karemolbak
815;2020-04-18 07:48:55+00:00;"KLAR forskeranbefaling af ansigtsmasker mod corona: ""We recommend adoption of public cloth mask wearing as an effective form of source control, in conjunction with existing strategies."" Hører i efter, @SSTSundhed @SSTbrostrom @SSI_dk @KareMolbak ??? ";1251417409321304065;@karemolbak
816;2020-04-17 21:02:18+00:00;Sålænge vi ikke grundlæggende ændrer strategi som i aggressiv testning, smitteopsporing og brug af karantæne, så kan han kalde det hvad han vil. Det er stadig de facto flokimmunitetsstrategi;1251254683081023489;@karemolbak
817;2020-04-17 18:41:54+00:00;Øv @KareMolbak - du kunne da godt lige have udeladt ‘Idræts-, fritids- og foreningsliv’ ... #sammenhverforsig #COVID2019dk #coronavirusdk;1251219352298426378;@karemolbak
818;2020-04-17 12:46:29+00:00;"Singapore har ikke lukket noget op. Så definition er vel underordnet. Måske har landet ikke lukket hurtigt nok ned. Singapore er blot endnu et eksempel på at epidemien er drevet af enkelt begivenheder, som @KareMolbak udtrykte det. &gt;1000 cases i et arbejder kollegie.";1251129907595358210;@karemolbak
819;2020-04-17 12:21:21+00:00;Respekt for @KareMolbak - ingen kender bedre end modellens ejer usikkerheden og risikoen: Hvor mangelfulde data vi har om smitten, hvor lidt vi ved om hvordan befolkningen reagerer og hvor lidt der skal til for at tippe R over 1 og vælte læsset.;1251123584380125190;@karemolbak
820;2018-11-15 11:49:50+00:00;They could have been so much more.;1063036348603527168;@karemolbak
821;2020-04-17 07:36:05+00:00;Har svært ved at forstå den fortsatte tiltro til befolkningens sociale distancering. Slut-marts sås tegn på nedadgående compliance jf. grafen her (fra https://hope-project.au.dk/#/coronaCrisisInDK#coronaCrisis_3_da_md) og @KareMolbak advarer jo også om ændret adfærd pga overoptimisme... ;1251051792290496512;@karemolbak
822;2020-04-17 07:36:01+00:00;Det står i ssi's daglige rapport;1251051777807593472;@karemolbak
823;2020-04-17 06:01:33+00:00;@KareMolbak tror du virkelig at den dag i åbner for små caféer etc, at de bliver pakket med kunder? Tror du virkelig at det er en risiko for Danmark? Alt imens at rigtig mange mister deres levebrød, taber deres opsparing og går konkurs pga dine råd! Vågn da lige op!;1251028001766232064;@karemolbak
824;2020-04-17 05:46:32+00:00;‘Når man får en brev fra cheflægen Kåre Mølbak, så hører man efter’ (Morten Østergaard i @P1Morgen) - ‘grunden til at vi er hvor vi er, er at vi hár gjort som han har sagt’ #COVID19 #dkmedier #dksund @KareMolbak @oestergaard;1251024222127865856;@karemolbak
825;2020-04-16 20:02:28+00:00;Muligvis kapacitet eller ligeså vigtigt forsyningssikkerhed - hjælper ikke vi brænder alt krudtet af og kommer til at mangle på den mellemlange bane - men come on...;1250877237555015683;@karemolbak
826;2020-04-16 18:37:34+00:00;@KareMolbak #efterskole eleverne græder og mister måske allermest i denne Coronakrise - de mister en del af deres ungdom, som de aldrig vil kunne få erstattet. De fleste efterskoleelever vil være interesserede i at gå i en slags karantæne sammen på efterskolen skoleåret ud.;1250855872621948940;@karemolbak
827;2020-04-16 17:22:17+00:00;Jeg tænker, at sportsforeninger kan åbne op i en vis udstrækning.;1250836928829800449;@karemolbak
828;2020-04-16 16:43:01+00:00;Ja, det er mit indtryk at rigtig mange allerede er begyndt at slække rigtig meget på anvisningerne - jeg håber, at det er nogle relativt få, meget synlige folk, der er tale om, så det ikke løber løbsk..;1250827043438198785;@karemolbak
829;2020-04-16 16:13:31+00:00;Man kan godt frygte en opblusning af Covid19, når at man begynder at løsne op.....;1250819623131455490;@karemolbak
830;2020-04-16 16:04:41+00:00;Der er ikke restriktioner om 2 meter mellem folk nu. Der er restriktioner om, at man ikke være samlet mere end 10 personer. Dette løber til 10. Maj. 2 meters afstand er selvfølgelig fortsat muligt blandt fremmede.;1250817397541556226;@karemolbak
831;2020-04-16 15:59:13+00:00;... Det er træls:(;1250816021822345216;@karemolbak
832;2020-04-16 15:54:58+00:00;Kære @KareMolbak, er det rigtigt forstået at #SocialAfstand ikke er helt så vigtigt når #DronningMargrethe fylder år? #COVID19dk;1250814954426576897;@karemolbak
833;2020-04-16 15:42:24+00:00;Jeg tjekkede dem. Det er stadig dem fra 25 marts der gælder. Man kan også sige, at hvis man melder at alle der godter lidt skal testes (optimalt) så har vi måske ikke kapacitet nok nu, og derfor venter man. Det er den optimistiske tolkning.;1250811789849382912;@karemolbak
834;2020-04-16 15:33:58+00:00;Den er ganske vist 1 måned gammel, og vi er blevet klogere. Men det forekommer mig at være en god analyse af muligheder og præsentation af det, man nu kalder hammer and dance strategi. Det er typisk gode fysikere, der har disse analytiske evner.;1250809670207488000;@karemolbak
835;2020-04-16 15:19:51+00:00;Det er de seneste retningslinjer jeg har set - men de kan være ændret. Man kan kontakte læge ved milde symptomer men det et vel ikke ensbetydende med test. Gravide samt partnere kan testes ved milde symptomer;1250806117074112512;@karemolbak
836;2020-04-16 15:12:34+00:00;Sorry, det gør vi slet ikke. Hvad blev der egentlig af de mere lempelige kriterier? Aktuelle vejledning siger stadig at det er moderat til svær samt milde sympt hos høj risiko personer. Nu forstår jeg hvad I mener. Det virker utilstrækkeligt.;1250804283882250241;@karemolbak
837;2020-04-16 14:59:45+00:00;Tester vi ikke snue nu?;1250801056327577601;@karemolbak
838;2020-04-16 14:57:50+00:00;Jo kriterier bliver mere lempelige men som jeg forstår er det stadig symptom baseret. Vi har kapacitet, men pipelinen til at udnytte den er ikke tydelig e.g hvad med befolkningsscreening og hvordan fanger vi asymptomatiske..;1250800576784486402;@karemolbak
839;2020-04-16 14:55:27+00:00;Du har sikkert ret. Vi må se. Jeg er fortsat bare meget tilfreds så længe man har droppet ideen om pandemic cleansing, eller hvad det mest passende kan kaldes.;1250799973408681984;@karemolbak
840;2020-04-16 14:51:56+00:00;En cost/benefit på den form for smitteopsporing, som Norge nu indfører, taler næppe til fordel for, at man ikke skal gøre det. Alternativet kan jo være, at vi må lukke ned igen, når vi udfordres. Og det bliver vi.;1250799088477536256;@karemolbak
841;2019-01-01 13:22:53+00:00;Not all of these wonderkids turned out to be 'the next superstar' ;1080091997111812097;@karemolbak
842;2020-04-16 14:46:39+00:00;Ja det er jeg sådan set enig i. Det er klart lettere at gøre der her nu, hvor smittespredningen er lav.;1250797758899982339;@karemolbak
843;2020-04-16 14:46:34+00:00;Gør man ikke det? Vi har da nogle meget lempelige testkriterier nu, og en uudnyttet testkapacitet der står klar. Eller har jeg misforstået noget?;1250797739866292224;@karemolbak
844;2020-04-16 14:44:41+00:00;Jeg hæfter mig ved at det meste er formuleret på intentionsniveau fra rapporter og pressemøder. Konkret udrulning og eksekvering udestår stadig. At man vælger at åbne op først uden at kunne følge udvikling mere tæt og proaktivt med test undrer mig;1250797264286736384;@karemolbak
845;2020-04-16 14:37:42+00:00;Håber den har det hele og tillader view uden for Norge;1250795509159211011;@karemolbak
