;date;text;id;key
404;2020-05-09 09:56:05+00:00;@KareMolbak @steennorskov 1: Er #metro, #Stog, #tog, #busser smittecentraler? Og hvis helt eller delvist ja, hvad kan man gøre ved det? 2: Hvorfor kan der ikke organiseres reel #isolation af smittede? De bliver hjemme og smitter familien? (Tomme hotelværelser!) @DRNyheder;1259059560016416768;@karemolbak
405;2020-05-09 09:10:46+00:00;Der findes og udvikles så meget termisk screening udstyr til #COVID19 test i lufthavne, biler og meget mere at det er udforståeligt vi ikke har adaptet Når nu fx Sydkorea bli'r højrost for indsats. @KareMolbak @SSTbrostrom @LMSTSenderovitz @statsmin @Heunicke @SosseRossen;1259048151928967169;@karemolbak
406;2020-05-09 08:46:26+00:00;Google datterselskab har lanceret digital test for #COVID19. Hvad si'r i til det @STPS @KareMolbak @SSTbrostrom @SSTProbst @LMSTSenderovitz @VangstedMarie https://www.thejakartapost.com/life/2020/03/17/googles-verily-launches-digital-covid-19-screening-test-in-california.html #dkpol #dkmedier;1259042029880958976;@karemolbak
407;2020-05-08 17:40:39+00:00;2 eller 10 meter for #COVID19? Hvis du undrer dig så er smitteafstand fra 2 til 10 små dråber og indendørs. Og ingen af disse notabiliteter har modsagt herinde: @STPS_DK @KareMolbak @SSTbrostrom @SSTProbst @LMSTSenderovitz @VangstedMarie #dkpol #dkmedier https://sciencedirect.com/science/articl;1258814082309898240;@karemolbak
408;2019-10-17 23:25:54+00:00;English is the most spoken language in the world. Can you guess what No. 2 is?;1184973844001542144;@karemolbak
409;2020-05-07 17:55:26+00:00;Nu giver det mening, at @KareMolbak ikke var inviteret med. Det dér vidensbaserede er til besvær, når der skal laves politik. Man savner Merkel. #covid19dk #dkpol;1258455413193932800;@karemolbak
410;2020-05-07 14:51:21+00:00;Der gambles i høj grad med smittefaren!;1258409090231013376;@karemolbak
411;2020-05-07 11:57:22+00:00;Jeg kan fejlhuske detaljer, men: 60 personer til korprøve, alt afsprittet, håndhygiejne OK, ingen med symptomer. 45 smittet, 2 døde. Her er den:;1258365306008940545;@karemolbak
412;2020-05-07 11:51:19+00:00;- jeg blev overrasket en del gange af artiklen men du har langt mere indsigt end jeg Peter og har aldrig hørt om Seattle-historien. Blev betænkelig for restauranter med 10 meter smitten - det eneste sted hvor mundbind vil være utænkeligt ;1258363780909719552;@karemolbak
413;2020-05-07 11:43:19+00:00;Ingen ny information i artiklen, så vidt jeg lige kan se? Aerosol-vinklen har vel været vendt en del gange siden kor-historien i Seattle. Går ud fra at det indgår i løbende overvejelser.;1258361767765381120;@karemolbak
414;2020-05-07 09:06:02+00:00;#Genåbning Danmarks totale mangel på håndholdt scanning (mindes med gru Milano-flyet) er en af mine kæpheste, så tillader mig at gentage dette tweet - synes er lidt vigtigt, i al fald til debat #dkpol #dkmedier @KareMolbak @SSTbrostrom @statsmin @SosseRossen;1258322187179773952;@karemolbak
415;2020-05-07 08:21:59+00:00;#Genåbning Artikel virker velunderbygget. 10 meter for små dråber smitte foruroliger. Håber @statsmin bevarer forsigtighed. @STPS_DK @KareMolbak @SSTbrostrom @SSTProbst @LMSTSenderovitz @VangstedMarie @SosseRossen @Heunicke #Covid19 #dkpol #dkmedier https://www.sciencedirect.com/science/article/pii/S016041202031254X;1258311101470707712;@karemolbak
416;2020-05-06 23:35:24+00:00;Er luftbåren #COVID19 spredning en fare? Læser der er bevis for at en betydelig infektionsvej i indemiljøer er de små dråber som kan bevæge sig op til 10 m. fra smittet person. Er det en risiko i restauranter @KareMolbak og @SSTbrostrom? https://www.sciencedirect.com/science/article/pii/S016041202031254X #dkpol #dkmedier;1258178583702441985;@karemolbak
417;2020-05-06 22:28:59+00:00;Er det ikke helt naturligt at det er ekspertgruppens leder der fremlægger ekspertgruppens anbefalinger mens @KareMolbak fremlægger @SSI_dk anbefalinger? Ikke så meget #Hokuspokus dér imho #dkpol #dkmedier;1258161869396852737;@karemolbak
418;2020-05-06 21:47:45+00:00;- eller en stor spiseskefuld levertran (evt. Møllers med citronsmag) hver dag ;1258151492403544071;@karemolbak
419;2020-05-06 19:59:42+00:00;Det er nok også formålsløst at begynde at diskutere nu, da det jo var en ny situation for alle.... Og det sidste er vi bestemt enige om, til jeg så læser ting som disse. https://www.dr.dk/nyheder/politik/radikale-haev-graensen-paa-forsamlinger-til-25-eller-50-personer Og her begynder lommevirologien så for mig..;1258124301158490113;@karemolbak
420;2020-05-06 19:56:19+00:00;Hvis du med overdreven optimisme mener, at jeg opfordrede til ikke at gå i panik men følge udviklingen, så ja - det mener jeg stadig. Håndteringen fra @SSTbrostrom og @KareMolbak fra starten er grunden til, at vi står godt i dag.;1258123448926208000;@karemolbak
421;2020-05-06 18:57:19+00:00;Er du sikker på, at det ikke er fordi de her indonesiske forskere tilfældigvis har et stort lager af D3 til rådighed? En ugentlig dåse røget torskelever i olie gør underværker ;1258108602130345986;@karemolbak
422;2020-05-06 14:26:13+00:00;Først sender @regeringDK @KareMolbak og @SSTbrostrom i huen med politiske beslutninger, så udtaler @Statsmin bagefter der sker på baggrund af ekspertviden ... Og #dkmedier æder det råt #dkpol;1258040377619156992;@karemolbak
423;2020-05-06 14:16:39+00:00;- jeg tror aldrig debatten ville blive kvalificeret Dorthe... den ville køre et par dage på et højt niveau men ville så hurtigt blive udvandet af #dkpol og andre lægfolk uden forstand på den slags - det ville være synd og bibringe danskerne en masse forvirring og uro. #dkmedier;1258037968473919489;@karemolbak
424;2020-05-06 13:14:03+00:00;- jeg tror åbenhed vil bringe forvirring og uro. Især når der mangler evidens på så mange områder. Og se nu bare hvordan forslag fra #COVIDpartierne til genåbning stritter i alle retninger. Og nu vil @oestergaard have større grupper. Der gambles med smittefaren #dkpol #dkmedier;1258022215997677570;@karemolbak
425;2020-05-06 13:09:56+00:00;- det ville ligne dig dårligt at spille fornærmet Dorthe ;1258021176812634112;@karemolbak
426;2020-05-06 13:06:55+00:00;Har noget jeg skal have gjort, så 'stilheden' er ikke fornærmet :-D;1258020420281929728;@karemolbak
427;2018-11-15 11:49:50+00:00;They could have been so much more.;1063036348603527168;@karemolbak
428;2020-05-06 13:06:10+00:00;Jeg deler din irritation over ren profilering,når den ikke er konstruktiv. Jeg tror som sagt bare, at vi når længere med åbenhed og den konstruktive kritik vi opnår ved åbenheden. De 'røde hold' er at foretrække. Også selvom man kan være dybt uenig ind i mellem.;1258020231705956359;@karemolbak
429;2020-05-06 13:03:49+00:00;Jeg forstår inderligt godt man ikke vil kaste viden i grams al den stund der kan sættes små og måske store spørgsmålstegn ved evidensen. Glem ikke det er en helt ny og ukendt smitte der ikke opfører sig som andre og at mange beslutninger må tages med konduite. #dkpol #dkmedier;1258019640518815745;@karemolbak
430;2020-05-06 13:02:09+00:00;.... fremfor at magten lukker sig om sig selv. De sparer sig selv for støj på linien, men de mister den kvalificerende debat om, hvorvidt beregningsmodellen af smittetrykket er god nok. Det er jo den eller de modeller, der er basis for, hvad der kan åbne hvornår.;1258019220484427776;@karemolbak
431;2020-05-06 12:59:10+00:00;Og det er jo kvalificerede mennesker, der under tidligere pandemier har været en del af del vidensudveksling, de nu efterspørger. Så det er mere en nervøsitet ved at skulle kunne svare på kritiske spørgsmål. Og det er så her jeg mener vi er bedst tjent med uenigheden og kritikken;1258018469850857473;@karemolbak
432;2020-05-06 12:56:30+00:00;De blev udelukket fra en viden, som de skal skabe ny viden ud fra. Det skal jo ikke kun gå op i systemet med vidensdeling også ned eller ud om man vil. Og det er her jeg kan se et stort problem. Man er ikke så nervøs med at dele viden i Tyskland fx. Heller ikke til befolkningen.;1258017799546515456;@karemolbak
433;2020-05-06 12:51:15+00:00;"Enig. Men jeg er 100% sikker på at @ProfJLundgren, @IdaDonkin og @prof_ostde samt andre videnskapaciteter ikke bli'r afvist af fx @KareMolbak hvis de mener de har noget at bidrage med. Hvis man spreder viden vil man nok opleve at ""mange kokke fordærver maden"". #dkpol #dkmedier";1258016477866856448;@karemolbak
434;2020-05-06 12:27:12+00:00;Kl 8 … smittetrykket er stigende Kl 12 … #covid19dk er ved at dø ud det sejler for @SSTbrostrom @SSTSundhed @SSI_dk @KareMolbak De lærer desværre af @regeringDK #dkpol;1258010424353710085;@karemolbak
435;2020-05-06 12:13:50+00:00;1000 tak Mette - ja, D3 hører til de fedtopløselige vitaminer som vi skal passe på (jeg ta'r også levertran) mens kroppen selv optager det den har behov for af de vandopløselige vitaminer og skiller sig af med resten via urinen https://www.med24.dk/fedtoploeselige-vs-vandoploeselige-vitaminer-kender-du-forskellen;1258007062505836544;@karemolbak
436;2020-05-06 12:05:30+00:00;For meget D vitamin kan også gøre dig syg. Hilsen datteren af en levertran-elskende årgang 1940.;1258004965202825218;@karemolbak
437;2020-05-06 11:42:43+00:00;"#COVID19 ""medicin"". Har netop hørt indonesiske forskere har påvist at de som har rette niveau af D3 vitaminer kommer sig hurtigere. Som vitaminfreak er jeg glad for de 52 vitaminpiller og markante overdosis jeg har taget i over 40 år #dkpol #dkmedier @KareMolbak @SSTbrostrom";1257999231350177792;@karemolbak
438;2020-05-06 10:30:03+00:00;@KareMolbak er magten steget dig til hovedet #corona holder Danmark lukket;1257980941294845952;@karemolbak
439;2020-05-06 10:10:55+00:00;Bemærk forskellen til de bedste (70-79 årige);1257976128356200449;@karemolbak
440;2020-05-06 10:04:25+00:00;Men hvorfor? Og hvilke unge? Mine børnebørn opfører sig eksemplarisk selvom det slider på dem. Vi har ikke brug for #fordomme #coronaudskamning #udskamning #dkpol SSI skal lægge materialet frem og regne på det. Og lade etnologer og sociologer komme på banen #dkpol;1257974490346160128;@karemolbak
441;2020-05-06 09:38:21+00:00;Professorer undrer sig kraftigt over, hvorfor Kåre Mølbak sendte notat @KareMolbak og @SSTbrostrom er @regeringDK logrende skødehunde. Det er ren politiskmbestilling #dkpol #covid19dk;1257967933290156037;@karemolbak
442;2018-11-15 11:49:50+00:00;They could have been so much more.;1063036348603527168;@karemolbak
443;2020-05-06 08:56:31+00:00;Dem Madsen citerer (kronikken i Pol), har en respektfuld kritik af Mølbak og hans hold. De er ikke “trætte” af noget. De bidrager til at vi kommer videre, hvad @KareMolbak sikkert anerkender fra sin i ø ikke altid nemme position. Er vi trætte af @pomaEB og hans ansvarsfri tale?;1257957404421038080;@karemolbak
444;2020-05-06 06:50:20+00:00;Til gengæld har han ret, tallene viser at det er de unge, der er dårligst til at passe på.;1257925650909929472;@karemolbak
445;2020-05-06 06:44:20+00:00;En ting er givet: Kåre Mølbak er en elendig sociolog. Vi skal tilbage til forrige årtusinde for at finde nogen der mener at en hel ungdomsårgang opfører sig på samme vis @KareMolbak #dkpol #blivveddinlæst;1257924140151050240;@karemolbak
446;2020-05-05 20:52:34+00:00;Eksperters mål om #FlokImmunitet med @COVID19 er utopi. Indrøm dog vi nok aldrig når de ønskede 60% (3,5 mio. smittede). Blandt dem vil også være mange unge sunde som kan blive meget syge og risikere invaliderende senskader. Drop det #dkpol #dkmedier @KareMolbak @SSTbrostrom;1257775216828309505;@karemolbak
447;2020-05-05 20:25:36+00:00;@KareMolbak er altså ikke politiker @KristiansenMk... #JustSaying ;1257768428716335106;@karemolbak
448;2020-05-05 19:37:47+00:00;Bare nu I har fået de rigtige tal med jer ... @KareMolbak er vist fornyeligt blevet opdateret ... hilsen #efterskoleeleverne;1257756395501424642;@karemolbak
449;2020-05-05 14:38:17+00:00;- glæder mig til at se hvad han siger her - link virker - skal lige ha' sendt et argh-brev til Udbetaling Danmark ;1257681026572324864;@karemolbak
450;2020-05-05 14:33:49+00:00;- det er ham du kan opleve live i Deadline - se fra ca,. 10 minutter inde;1257679898556149771;@karemolbak
451;2020-05-05 14:28:21+00:00;https://youtu.be/gAk7aX5hksU Håber link virker. Eksperten er professor Woo-Ju Kim. Det er lødigt og nøgternt, og jeg kan ikke anbefale det nok.;1257678525856956416;@karemolbak
452;2020-05-05 14:24:47+00:00;well, ham her anses for en af verdens førende på pandemier ;1257677625423810560;@karemolbak
453;2020-05-05 14:23:40+00:00;Og så en tur på Jærgers;1257677345542090752;@karemolbak
454;2020-05-05 14:21:12+00:00;Nej desværre, men jeg vil da tjekke det ud, nu hvor du anbefaler det. Så for et stykke tid en virkelig dygtig sydkoreansk ekspert forklare alt muligt basalt om corona. Det var nok den mest givende halve time om corona, man kunne finde på det tidspunkt. Måske er den samme...;1257676727020654600;@karemolbak
455;2020-05-05 14:18:07+00:00;2 Tyskland har nok været inspireret af dem et langt stykke hen ad vejen, og de har undgået de høje dødstal, man har set i mange andre europæiske lande. Også selvom de hurtigt fik coronatilfælde og i visse områder havde udbredt smitte.;1257675949572870144;@karemolbak
456;2020-05-05 14:17:43+00:00;- så du den sydkoreanske ekspert i går i deadline? https://www.dr.dk/drtv/se/deadline_-hvad-ved-vi-om-haandteringen-af-covid_19_183794;1257675847705726977;@karemolbak
457;2020-05-05 14:15:05+00:00;Ja der er jo store økonomiske interesser i genåbning. Jeg ville bare ønske, at man ikke så det at redde liv som modsætning til at redde økonomien. Sydkorea, Singapore Taiwan har kunnet holde åbent, mens de bruger mundbind, håndsprit, afstand og virkelig meget testning. Tyskland;1257675184846315521;@karemolbak
458;2020-05-05 14:12:10+00:00;- savner dem lidt - billige smøger og altid fest og glæde ombord ;1257674452302811137;@karemolbak
459;2020-05-05 14:08:53+00:00;Ja havne sejladsen på flyvebådene var jo næsten den halve tid fra København af;1257673625097961472;@karemolbak
460;2020-05-05 14:06:47+00:00;- husker det godt Per ;1257673098448515072;@karemolbak
461;2020-05-05 13:57:33+00:00;Det er regel ryttere, har arbejdet sammen med en del dygtige.Vis i husker flyve bådene, reglerne var først spiritus når man var ude af hanen, dk besætning betjening når trodserne var taget, Sk besætning der måtte kunderne smaske med gøre kæber indtil man var ude i af havnen i Kbh;1257670771855548417;@karemolbak
462;2020-05-05 13:51:22+00:00;aha, det vidste jeg ikke Dorthe - måske vi skulle se mere til Tysklands håndtering af Covid19 - men nu har Merkel jo fået problemer med delstaternes genåbning ;1257669216825679874;@karemolbak
463;2020-05-05 13:42:20+00:00;Hun har faktisk en doktorgrad i kvantekemi, så hun er godt videnskabeligt funderet g er ikke bange for at gå i dybden. Hun er blevet lidt berømt for at forklare smittetryk på en enkel og pædagogisk måde, men alligevel videnskabeligt uden spin, bare facts :-);1257666945454931973;@karemolbak
464;2020-05-05 13:31:30+00:00;Merkel omsætter jo som Mette blot hvad de får at vide fra folk som Mølbæk og Brostrøm som slet ikke har samme træning i eller evne til at tale til folkets hjerter og hjerner ;1257664215940300805;@karemolbak
465;2020-05-05 13:09:34+00:00;Er faktisk ikke så glad for Brostrøm og Mølbak. Selvom jeg er glad for, at Mølbak har råbt vagt i gevær ift at forsamles på Islands Brygge bl a. Jeg ville gerne have klar info som den Angela Merkel fx står for. Men man har jo lov at håbe :-);1257658698673070081;@karemolbak
466;2020-05-05 13:04:34+00:00;bekræfter uanset hvad vi har et godt firkløver i Frederiksen-Heunicke-Brostrøm-Mølbæk ;1257657441782816768;@karemolbak
467;2020-05-05 12:11:17+00:00;Men de har 3 gange så mange døde i Sverige som i DK. Sverige ca 21 pr 100.000, Dk ca 7 pr 100.000 Vi har ikke de store tyndt befolkede områder, hvir folk kan holde sig fra hinanden. Og i Stockholm er det slemt...;1257644029262659584;@karemolbak
468;2020-05-05 10:53:44+00:00;- svært at sige Dorthe... men i virkeligheden kunne vi jo bare opstille en strategi for #DKGenåbner hvis målsætning i første omgang var at kopiere dem - dvs nå samme niveau som Sverige. I betragtning af at WHO roser strategien vel ikke så tosset #dkpol #dkmedier @SosseRossen;1257624515821146112;@karemolbak
469;2019-01-01 14:40:41+00:00;So. Much. Silverware. These 10 clubs have dominated Europe's top 5 leagues.;1080111576320016385;@karemolbak
470;2020-05-05 10:42:45+00:00;"Dumdristig #Covid19 oplukningstrategi. Antal indlæggelser og døde er et ""tyndt"" grundlag. Mørketallet for symptomfrie er måske 100-200.000. Omfattende tests eneste rigtige. Henviser til egne tweets i marts og https://altinget.dk/artikel/overlaege-regeringens-coronastrategi-mangler-fokus-paa-epidemiens-motor?SNSubscribed=true&amp;ref=newsletter&amp;refid=fredag-morgen-13032020&amp;utm_campaign=altingetdk%20Altinget.dk&amp;utm_medium%09=e-mail&amp;utm_source=nyhedsbrev #dkpol #dkmedier @KareMolbak @SSTbrostrom";1257621749044334593;@karemolbak
471;2020-05-05 10:41:02+00:00;Men desværre virker det som om de er meget inspirerede af Sverige. Jeg tror regeringen er meget intersseret i, hvordan man kan have så stor opbakning i Sverige (70%), og alligevel have åbent overalt. Sverige har meget tyndtbefolket land. Det er det der forsinker en katadtrofe.;1257621319388147718;@karemolbak
472;2020-05-05 10:31:02+00:00;#SmitteStopAPP - der findes allerede et alternativ til den bebudede app fra @DKsundhed og @Heunicke - det påstås den er bedre til persondata-sikkerhed og til at opspore #COVID19-smitten Her: https://bureaubiz.dk/klumme/forblaendet-af-corona-data/ #dkpol #dkmedier @KareMolbak @SSTbrostrom;1257618801908224001;@karemolbak
473;2020-05-05 09:41:14+00:00;For at sige det kort: Er overbevist om det var blevet en katastrofe hvis @statsmin, @SSTbrostrom og @KareMolbak havde tacklet #COVID19 som Sverige. #dkpol #dkmedier;1257606269759885314;@karemolbak
474;2020-05-05 09:24:43+00:00;Får Sverige succes med sin #Covid19-politik er det formentlig stærkt medvirkende at svenskerne er lettere at adfærdsregulere end andre folkeslag. Er jo flasket op med regulerings- og forbudspolitik. Tænker jeg @KareMolbak @SSTbrostrom #dkpol #dkmedier;1257602112034349056;@karemolbak
475;2020-05-05 05:50:57+00:00;Tænk hvis samme fokus var på finde den optimale epidemistrategi. Ved erhverv og økonomi bliver der kastet milliarder. Nedsat ekspertgrupper, udvalg og undersøgeler. Epidemistrategi ...? lad os se hvad tallene siger i næste uge og så ellers høre hvad @KareMolbak siger. #COVID19dk;1257548314897195010;@karemolbak
476;2020-05-04 10:59:14+00:00;HELT ÆRLIG Kan vi stole på de tal og vurderinger, som sendes ud ?? Jeg begynder at tro, at @KareMolbak har noget personligt imod unge mennesker. TAK til @efterskolerne og @jacobmark_sf;1257263512499425280;@karemolbak
477;2020-05-04 04:25:47+00:00;https://www.ugeavisen-soenderborg.dk/soenderborg/Bladene-er-stoppet-med-at-danse/artikel/448223 Lad nu de unge leve deres liv. @Heunicke @KareMolbak #dkpol @MettePrime;1257164496424009730;@karemolbak
478;2020-05-03 20:40:04+00:00;Tilgaengelighed boer ogsaa gaelde eksempelvis data om overdoedelighed fra EUROMOMO, som Kaare Moelbak er projekt-leder for: https://www.euromomo.eu/about-us/contact/ Tak @mortenhelveg @karmel80 @SSI_dk @KareMolbak;1257047292621787137;@karemolbak
479;2020-05-03 18:52:54+00:00;Jeg var oprigtigt bange for om jeg ville miste forbindelsen til de trendsætterne typer, da vi for et par dage siden flyttede fra kbh til Humlebæk. Men nu har min svigerinde lige set @KareMolbak rundt om hjørnet fra hjemmet, og jeg er mere rolig.;1257020326279602176;@karemolbak
480;2020-05-03 10:05:11+00:00;"Helt enig i, at positiv kommunikation i øjenhøjde som oftest er at foretrække. Bare komisk, at alle der ellers har travlt med at brokke sig over umulige teenagere nu mener, at sætningen: ""de skal nok tænke sig bedre om"" er urimelig udskamning.";1256887521268633602;@karemolbak
481;2020-05-03 09:44:31+00:00;Han har ret. Jeg har selv lagt mærke til, når jeg har handlet de sidste halvanden måned, at det især er de unge 16-20-årige, der STADIG fjoller rundt og ikke holder afstand til folk omkring dem. De unge tager ikke situationen alvorligt nok. Opdragende forældre efterlyses.;1256882319488679936;@karemolbak
482;2020-05-02 18:29:41+00:00;Da var det noget af en stor omgang vrøvl som du kommer ud med @KareMolbak Jeg tror vi unge er en af de aldersgrupper som lider allermest af alle de her begrænsninger vi har under corona tiden. Vi har ikke det samme sociale liv som vi havde før. Vi sidder og får den dårligste--;1256652094670585858;@karemolbak
483;2020-05-02 15:18:06+00:00;Hvordan? Det er som om @KareMolbak ikke kan se det for sig. Jeg håber I lykkes med at overbevise @regeringDK med jeres saglige argumenter ;1256603882010087424;@karemolbak
484;2020-05-02 14:58:46+00:00;Hvad siger @efterskolerne til det? Er medlemsskolerne klar til at tage forsvarligt imod eleverne. Vi har hørt at @skolelederOrg er bekymrede.;1256599017041117185;@karemolbak
485;2020-05-02 14:33:29+00:00;Her er det @me_marco, der skal have kreditten for regnearket. Men tror heatmap er brugt for lidt i formidling af mange samtidige bevægelser. Jeg prøvede mig også med en større brug af heatmap her for nyligt:;1256592654789476356;@karemolbak
486;2020-05-02 14:26:47+00:00;Fremragende Excel arbejde!;1256590967429349376;@karemolbak
487;2020-05-02 14:15:22+00:00;Andel af positive falder i alle aldersgrupper - også blandt unge. Men absolut antal stiger. Nok i højere grad fordi man tester mange flere, end at sygdommen spredes mere end tidligere: https://twitter.com/me_marco/status/1256580551940681729?s=20;1256588091793575937;@karemolbak
488;2020-05-02 13:22:39+00:00;Selv hvis relativt flere testes positiv blandt de unge er det vel også okay når du det netop er denne gruppe der er mere sammen efter genåbningen. Skolen smitter jo mere end teenagehulen derhjemme...;1256574828724789248;@karemolbak
489;2020-05-02 13:21:01+00:00;Jeg tænkte præcis det samme. Flere tests giver alt andet lige flere positive tests. Spørgsmålet er så bl.a. om der er relativt flere positive tests blandt de unge end de andre aldersgrupper.;1256574415665496065;@karemolbak
490;2019-01-01 13:22:53+00:00;Not all of these wonderkids turned out to be 'the next superstar' ;1080091997111812097;@karemolbak
491;2020-05-02 12:59:44+00:00;Vanvittigt. Uansvarligt. Men ikke overraskende.;1256569058033430528;@karemolbak
492;2020-05-02 12:09:01+00:00;Vi har siden torsdag forsøgt at få @KareMolbak til at svare på, om grundlaget for konklusionen dels ikke er for tyndt - og om det kan skyldes at flere unge bliver testet. Desværre uden held. #dkpol;1256556294967906304;@karemolbak
493;2020-05-01 20:13:34+00:00;@Statsmin @KareMolbak @SSI_dk @folketinget @SSTbrostrom @JakobEllemann Føler I jer som helte? Det bliver kortvarigt. Historien vil huske 'ledelsen' under corona-krisen som danmarkshistoriens største fiasko. STOP GALSKABEN. HVAD VENTER I PÅ?? LUK NU OP!;1256315847854833666;@karemolbak
494;2020-05-01 18:27:27+00:00;@KareMolbak hvad har Danmarks børn og unge gjort dig? Du ødelægger deres liv og ændrer dine analyser, så de passer i din og Mettes agenda. De gør alt du ber’ om og alligevel udskammer du dem. 4 ud af 30.000 efterskoleelever er smittet iflg. din egen statistik. Høj risiko? Hvorfor;1256289142977290240;@karemolbak
495;2020-05-01 17:07:21+00:00;De bliver ikke uretmæssigt udskammet. Deres forekomst er fordoblet. De testes stort set lige så ofte positiv som andre grupper. De testede bare ikke så ofte pga. 'asymptomatisk smitte'. Problemet er tendensen. Hvis den fortsætter er de snart den mest smittede gruppe.;1256268988193083395;@karemolbak
496;2020-05-01 16:08:04+00:00;Kan det være rigtig at politikerne er sure fordi @KareMolbak siger sandheden om smitterisiko og adfærd . I er klar over unge mennesker bedst ændre adfærd ved , man fortæller dem grunden til det. Mens de voksne nok skal have bøder før de forstår beskeden.;1256254065870360578;@karemolbak
497;2020-05-01 15:39:39+00:00;Den norske regering/sundhedsminister har en noget anden imødekommen retorik i forhold til ungdommen.....tror det er den rette vej;1256246918222577665;@karemolbak
498;2020-05-01 14:21:34+00:00;Men der er noget helt galt - de unge bliver uretmæssigt udskammet for hældningen på kurven er ikke højere for de 10-19 årige? Det må @KareMolbak forklare? ;1256227264938852353;@karemolbak
499;2020-05-01 13:30:36+00:00;Dr. David Lapides taler med Dr. Thomas Oxley om stroke/slagtilfælde som kan være en afledt effekt af / optræde i forbindelse med #COVID19 hos unge/yngre voksne. https://twitter.com/GreenJournal/status/1255993092479606785?s=20 Hvad mener @KareMolbak og @SSTbrostrom om det? #dkpol #ulighedisundhed @Blixt22 @AdsbolAdsbl;1256214439877062656;@karemolbak
500;2020-05-01 11:27:42+00:00;Pak nu ikke de unge ind i vat og bomuld. Mølbak fortæller dem jo bare at det er vigtigt hvad de gør, og i de unges indbyrdes dialog kan @KareMolbak s - respektfulde! - indspark måske hjælpe dem der gerne vil tage det alvorligt.;1256183510295097346;@karemolbak
501;2020-05-01 11:02:04+00:00;Præcis. Men kritikken er jo på ren kommunikation og ikke faglighed. Det er valget af måden at tale til de unge på der bliver kritiseret. Det kan virkelig ikke hidse mig op at en ældre lægefaglig person giver en klassisk opsang til ungdommen.;1256177060197937157;@karemolbak
502;2020-05-01 10:56:30+00:00;Fordi det risikerer at forvirre. Men svær balance. For embedsmændene skal jo sige, hvad de mener ud fra deres faglighed og ikke ud fra politiske hensyn. Det er jo hele pointen med det uafhængige embedsværk...;1256175658587303936;@karemolbak
