,date,text
197,22.07.2020,"Det var ikke kun statsminister Mette Frederiksen, repræsentanter fra Grønland og Færøerne samt udenrigsminister Jeppe Kofod, der mødtes med USA’s udenrigsminister, Mike Pompeo, onsdag. Også Anders Fogh Rasmussen, fhv. statsminister og Nato "
198,22.07.2020, om økonomi og mindre om menneskerettigheder. Mikkel Vedby Rasmussen peger især på statsminister Mette Frederiksens (S) skarpe udmeldinger for nylig om beskyttelsen af danske telenetværk mod andre stater. Meldingen blev set som en klar afvisning 
199,22.07.2020," kongeriget Køb af Grønland ikke drøftet Pompeos besøg finder sted knap et år efter, at præsident Donald Trump skulle have besøgt Danmark, men det blev aflyst, efter striden om Trumps forsøg på at købe Grønland og statsminister Mette Frederiksens "
200,22.07.2020," har mistet livet, til dels fordi medlemslandene i en misforstået suverænitets navn, ikke Bruxelles, afviser et fælles europæisk sundhedsapparat. Analyse: Mette Frederiksen gjorde som de andre – og tog, hvad hun kunne få Næsten fire måneder er gået "
201,22.07.2020,"USA's udenrigsminister, Mike Pompeo, gæster onsdag Danmark, hvor han mødes med både statsminister Mette Frederiksen (S) og udenrigsminister Jeppe Kofod (S). Og det er en vigtig samarbejdspartner, som den amerikanske repræsentant besøger "
202,22.07.2020," fra TV2 News. Pompeo er kommet til Danmark for at mødes med både statsminister Mette Frederiksen (S) og udenrigsminister Jeppe Kofod (S). Det er blandt andet amerikanske interesser i Arktis, forholdet til Kina og situationen i Hong Kong "
203,22.07.2020," støttepartier for den socialdemokratiske etpartiregering under Mette Frederiksen (S). De Radikales retsordfører Kristian Hegaard kalder på Twitter plakaten for ""et lavmål"". - Det undrer mig noget, dette her og kommer bag på mig. Det er ikke noget "
204,22.07.2020," interesseorganisationer med forskellige vurderinger af aftalen. Mens statsminister Mette Frederiksen hæftede sig ved, at EU aldrig har »haft et så grønt budget«, lød der mere kritiske toner fra andre partier. »Selv om jeg ser lidt træt ud, så er der grund "
205,22.07.2020," har været og er geopolitisk afgørende. Sidste sommer gik der dog skår i samarbejdet, da USA's præsident, Donald Trump, luftede tanker om at købe Grønland af Danmark. Det blev skarpt afvist af statsmister Mette Frederiksen (S), der kaldte det en absurd diskussion "
206,22.07.2020," endegyldigt være udbedret. Pompeo mødes med statsminister Mette Frederiksen på Marienborg og spiser frokost med udenrigsminister Jeppe Kofod, som har inviteret sine kolleger fra Færøerne og Grønland med til mødet. Dermed er tonen også slået an for "
207,22.07.2020, De seneste seks dage har antallet af nye smittede med coronavirus i USA været rekordhøjt med over 60.000 nye tilfælde om dagen. Særligt de sydlige og vestlige delstater er ramt af virusset. Analyse: Mette Frederiksen gjorde som de andre – og tog 
208,21.07.2020," af coronavirussen og brexit. Den risiko for kinesiske reaktioner kan statsminister Mette Frederiksen og Jeppe Kofod meget vel have med i baghovedet, når de onsdag har hver sit møde med Pompeo. Fra dansk side har man udadtil ikke lagt megen vægt på Kina "
209,21.07.2020," kan Mette Frederiksen også håbe at høste langtidsholdbare point. Hvad de færreste derimod husker fra 2013, er, at Danmark ud over en rabat også fik et mindre EU-budget ud af forhandlingen. Men det var kun rabatten, der blev husket. På samme "
210,21.07.2020,"Onsdag lander USA's udenrigsminister Mike Pompeo i Danmark for at mødes med statsminister Mette Frederiksen og udenrigsminister Jeppe Kofod. Et af emnerne kommer til at være samarbejdet om arktis, og derfor forberedte Jeppe Kofod "
211,21.07.2020," og deres meningsfællers diskriminerende retorik. Da den nuværende statsminister, Mette Frederiksen, var socialordfører for Socialdemokratiet, mente hun, i 2009, at tosprogede forældre skulle tvinges til sende deres børn i vuggestue, og at myndighederne "
212,21.07.2020, fra USA. Efter besøget i London rejser Pompeo videre til Danmark. Onsdag skal han mødes med statsminister Mette Frederiksen (S) og derpå til arbejdsfrokost med udenrigsminister Jeppe Kofod (S). Her ventes arktiske forhold at stå højt 
213,21.07.2020,", der for mange har gjort et stort indtryk. Læs et overblik over, hvad der bliver skrevet, her: Statsminister Mette Frederiksen (S): - Det var med stor sorg, jeg modtog beskeden om Lone Dybkjærs død. Lone har været en markant politiker og stor inspirator for mange "
214,21.07.2020,". Det er meget tilfredsstillende, at det lykkedes at blive enige, og det slår på ingen måde skår i glæden, at der undervejs var mange hårde opgør, som også statsminister Mette Frederiksen på Danmarks vegne var en del af. Naturligvis ser 27 stater forskelligt "
215,21.07.2020,"BRUXELLES Det holdt lidt hårdt, men da solen begyndte at vise sig over topmødets femte dag, lød budskabet »Deal!« endelig på EU-formand Charles Michels Twitter-profil. Statsminister Mette Frederiksen mødte kort efter danske medier "
216,21.07.2020," det ikke problemstillingen, siger han. Statsminister Mette Frederiksen (S) er tilsyneladende ikke enig i kritikken af det grønne fokus. Da topmødet sluttede tidligt tirsdag morgen, kaldte hun det ""en rigtig, rigtig god aftale for Europa og en rigtig, rigtig god "
217,21.07.2020," er rigtigt. Men det skal være ret og rimeligt. Det har jeg sagt hele tiden. Og derfor er der nu kæmpet en rabat hjem til Danmark, som er næsten tre gange så stor som den der var der hidtil,« siger statsminister Mette Frederiksen. Den stigning "
218,21.07.2020," anbefaling Da Danmark blev lukket ned i midten af marts, forklarede statsminister Mette Frederiksen på et pressemøde, at det skete på »myndighedernes anbefaling«. Statsministeren og sundheds- og ældreministeren har gentagne gange henvist til "
219,21.07.2020,", vil cirka hver femte kvinde født i 1988 være barnløs, når hun runder 45 år. Berlingske: Tre gange flere finder Mette Frederiksen (S) bedre egnet som statsminister efter næste valg end Jakob Ellemann-Jensen (V), viser en Gallup-måling. B "
220,21.07.2020,Efter fem døgns hårde forhandlinger i Bruxelles og en ny EU-budgetaftale for svimlende 1.074 mia. euro vendte statsminister Mette Frederiksen tirsdag hjem til blandede reaktioner. Mens Dansk Folkeparti og Liberal Alliance er kritiske 
221,20.07.2020, af intense forhandlinger natten til mandag. Efter de forhandlinger erklærede den østrigske kansler sig »tilfreds« med udviklingen. Statsminister Mette Frederiksen udtalte sig ikke mandag. En anden central del af spillet handler om 
222,20.07.2020," Johnson og udenrigsminister Raab. Forholdet til Kina og Hongkong ventes at være et blandt flere emner på dagsordenen. Efter to dage i London rejser Pompeo 22. juli til Danmark, hvor han blandt andet skal mødes med statsminister Mette Frederiksen "
223,19.07.2020," indtil videre er blevet i skuffen. Jyllands-Posten har identificeret 50 forslag fra udspillet, som fik titlen ”Retfærdig og realistisk”, og som blev genlanceret under valgkampen. Dengang fastslog S-formand Mette Frederiksen, at udlændingeområdet "
224,19.07.2020," fremlæggelsen af udlændingeplanen. Et år er gået, siden S-formand Mette Frederiksen fik magten til at gennemføre den. Spørgsmålet er, hvordan det er gået. Et opslag i Danmarks Statistik åbenbarer, at den oversete nyhed kun gælder tre kommuner "
225,19.07.2020," acceptere. »Det er et af de steder, hvor jeg mener, at Europa bliver nødt til at stå fast,« siger statsminister Mette Frederiksen. »Det, der for alvor binder os sammen, er de europæiske værdier. Det kan jeg ikke se, at vi kan gå på kompromis med "
226,19.07.2020," at være i kongeriget onsdag, han skal mødes med statsminister Mette Frederiksen, udenrigsminister Jeppe Kofod samt udenrigsministrene for Grønland og Færøerne. Heller ikke Pompeos rejseplan er helt, som den plejer at være. USA’s udenrigsministre "
227,19.07.2020,"-opgøret har buldret. »I går aftes kom det til heldigvis endelig for alvor at handle om værdierne,« siger statsminister Mette Frederiksen søndag formiddag. På bordet ligger et forslag, der vil betyde, at hvis EU Kommissionen vurderer, at retssikkerheden "
228,18.07.2020," og indlagte? En ny undersøgelse bekræfter os i, at vi i bund og grund er et sorgløst folkefærd. Ganske vist rykkede vi sammen i kollektiv frygt og autoritetstro, da Mette Frederiksen lukkede landet ned i marts, men nu er vi tilbage med vanligt humør "
229,18.07.2020," Mette Frederiksen konstatere, at lørdagens forhandlinger gik i hendes retning på to centrale områder, omend udviklingen ikke er voldsom. Det første er rabatten. Danmark, Sverige, Østrig, Holland og Tyskland står til igen i næste budgetperiode "
230,18.07.2020, bidrag på omkring 21 mia. kr. Statsminister Mette Frederiksen har lagt stor politisk vægt på rabatten i forhandlingerne. Den østrigske rabat foreslås samtidig hævet med 50 mio. euro fra det forrige forslag til nu 287 mio. euro. Færre tilskud 
231,18.07.2020,", at hun også selv har deltaget i alle forhandlinger med regeringen om coronakrisen. Hun roser statsminister Mette Frederiksens lederskab under coronakrisen, men mener, at genåbningen af Danmark har været alt for restriktiv, og at de mange støttepakker burde "
232,18.07.2020,", at man ikke er kommet et skridt videre efter 12 timers forhandling. Mette Frederiksen er på jagt efter flere EU-besparelser En diplomat kalder førstedagen af topmødet for ""en spildt dag"". Rutte sagde efter mødet, at han oplevede ""en irritation"" i lokalet "
233,18.07.2020,"På den historiske aften den 11. marts, hvor danskerne fik at vide, at Danmark for at bremse coronavirussen blev lukket stort set helt ned, forklarede statsminister Mette Frederiksen, at det skete på »myndighedernes anbefaling "
234,17.07.2020,"BRUXELLES Det er ikke nok for statsminister Mette Frederiksen, at der for nylig blev skåret 21 mia. euro af det forslag til EU-budget, som hun forhandler om i denne weekend. På forhånd har EU-formand Charles Michel bevæget sig nedad "
235,17.07.2020,", som da coronaepidemien ramte Danmark. Da statsminister Mette Frederiksen lukkede Danmark ned i marts, blev dagligvarebutikker landet over mødt med udfordringer, som ingen af os kunne have forudset. Øget efterspørgsmål, ændrede indkøbsmønstre og et fundamentalt "
236,17.07.2020,". Sådan er det, og det vilde er ikke, at en del af det politiske spektrum i Danmark billiger det. Det er normalt, endda naturligt, og det skorter da heller ikke på eksempler, hvor statsminister Mette Frederiksen har sat lighedstegn mellem coronakrisen "
237,17.07.2020,"BRUXELLES Allerede inden forhandlinger om det nye EU-budget og genopretningsfond er kommet i gang, kan statsminister Mette Frederiksen finde fyldepennen frem og sige ja tak. Det kompromisforslag, som forhandlingerne tager udgangspunkt i "
238,17.07.2020," en økonomisk genopretning i gang. Statsminister Mette Frederiksen (S) er fredag morgen ankommet til Bruxelles, hvor topmødet finder sted. Det er første gang i fem måneder, at stats- og regeringscheferne mødes, og det sker under vanskelige forhold "
239,17.07.2020,"Meget er forandret, når EU's stats- og regeringschefer fredag formiddag indleder forhandlinger om EU's syvårsbudget og en stor genopretningsfond. Efter fem måneder med videomøder på grund af coronakrisen er statsminister Mette Frederiksen "
240,17.07.2020,"Statsminister Mette Frederiksen står før dagens syvårlige EU-budgetforhandlinger i Bruxelles fast på, at Danmark ikke skal give flere penge til EU end højst nødvendigt. »Min holdning er uændret i forhold til budgettet. Det skal pege fremad "
241,17.07.2020,", hvis den samlede pris stiger? Tja – foreløbig kan Mette Frederiksen, der har fået kritik på Christiansborg for at fokusere for ensidigt på rabat, konstatere, at den samlede pris går nedad. I februar foreslog EU-formand Charles Michel et samlet budget på 1 "
242,16.07.2020," Aarhus Universitetshospital, Psykiatrien. Få uger efter, at statsminister Mette Frederiksen den 11. marts lukkede stort set hele samfundet ned, gennemførte forskerne deres første spørgesskemaundersøgelse om psykisk velbefindende blandt et udsnit "
243,16.07.2020,. Berlingske: En udmelding fra Mette Frederiksen (S) udløste i foråret skarpe reaktioner fra den kinesiske techgigant Huawei. Det viser hidtil ukendte breve til danske topdiplomater. B.T.: Efter tre års forlovelse fik statsminister Mette Frederiksen 
244,15.07.2020,", at statsminister Mette Frederiksen for nylig varslede ny lovgivning, der – uden at sætte landenavne på – skal beskytte kritisk dansk infrastruktur som f.eks. telekommunikation mod fjendtlige opkøb. Loven, som bl.a. skal fastlægge, hvilke leverandører "
245,15.07.2020,"Det skulle allerede have været sidste år, at den 55-årige fotograf og filminstruktør Bo Tengberg og statsminister Mette Frederiksen (S) blev gift. Men siden kom både valg, coronavirus og EU-topmøde i vejen. Onsdag blev de to så endeligt "
246,15.07.2020,"USA's udenrigsminister, Mike Pompeo, besøger København onsdag den 22. juli, oplyser Udenrigsministeriet. Her vil han mødes med statsminister Mette Frederiksen (S) på Marienborg og efterfølgende med udenrigsminister Jeppe Kofod (S "
247,15.07.2020,"Onsdag er statsminister Mette Frederiksen (S) og filminstruktøren Bo Tengberg endeligt blevet gift. Det er, mere end et år efter at det oprindeligt var planlagt. Få et overblik over forholdet og de uheldige bryllupsplaner her: * 2014 "
248,15.07.2020,"Efter flere udskydelser blev statsminister Mette Frederiksen (S) onsdag eftermiddag gift med sin kæreste gennem flere år, filminstruktøren Bo Tengberg. Vielsen skete i Magleby Kirke på Møn, hvor Mette Frederiksen og Bo Tengberg "
249,15.07.2020," for Pia Olsen Dyhr i et travlt og hektisk liv. Sygehuset havde – i hvert fald set med spindoktorøjne – været en bedre kulisse for det budskab, som SF’s partiformand nu vil levere til statsminister Mette Frederiksen og finansminister Nicolai "
250,15.07.2020,", forud for at støttepartierne pegede på Mette Frederiksen (S) som statsminister. Uddannelses- og forskningsminister Ane Halsboe-Jørgensen (S) har med ti ture til eller fra fastlandet fløjet næstmest til Jylland. For de øvrige 13 ministre ligger "
251,14.07.2020," Philippe med den indtil for nylig ukendte Jean Castex på posten som premierminister forklarede Macron med, at man ikke kan indlede en ny kurs med det samme hold. Mette Frederiksen upopulær i Sydfrankrig Han forsvarede også sit valg af udnævnelse "
252,14.07.2020," (byrådsmedlem) afsendere af kritikken. Noget, der forbløffer hovedpersonen selv. »Jeg har næsten ingen ord for, hvor hyklerisk Socialdemokratiet er. Mandag sagde både borgmester Jacob Bundsgaard og statsminister Mette Frederiksen, at der skal flere "
253,13.07.2020,"»Uenig med statsministeren« og »for nemt«. Sådan lyder dommen fra flere partiledere i blå blok over det opslag, statsminister Mette Frederiksen mandag lagde på sin Facebook-side, hvori hun kommenterede på de seneste ugers sager om svigt "
254,13.07.2020," fogedforbud mod dokumentarfilmen. Meldingen lød, at han i øjeblikket holder ferie.Udvalgsformand: »Vi skal se Skæring Plejehjem sammenholdt med problemerne på Kongsgården« Landets statsminister, Mette Frederiksen, har mandag dog valgt at kommentere "
255,13.07.2020," nogle sundhedsmæssige konsekvenser, lyder det fra Michael Bang Petersen. Men selv noget så banalt som sociale sammenhænge og en konstant adgang til køleskabet kan påvirke vores madvaner. Og da statsminister Mette Frederiksen (S) i marts lukkede samfundet ned "
256,13.07.2020,"Statsminister Mette Frederiksen skriver på Facebook, at ældreplejen i Danmark blandt andet mangler ressourcer. Det gør statsministeren, efter at billeder fra et plejehjem af behandlingen af en ældre beboer har skabt debat. Billederne "
257,11.07.2020," til »flere moskéer og mere islamisering«. Tak for slangekysset, det var giftigt. Glemt er den romantiske alliance mellem Thulesen Dahl og Mette Frederiksen (S), tilfældigvis indledt netop på det tidspunkt, hvor det stod klart, at fru Frederiksen "
258,11.07.2020," og gerne kritisere de blå venner,« udtalte Venstres gruppesekretær, Erling Bonnesen, til Berlingske i maj, efter at Vermund havde beskyldt Venstre for at bedrive »kynisk spin«, når partiet kritiserede statsminister Mette Frederiksen for at handle "
259,10.07.2020," rigtig godt. Jeg vil ikke udelukke, at vi er nødt til at bede hende om at lukke de belgiske lufthavne, indtil vi har en aftale,« smiler Michel, der selv er belgier. Det er selvfølgelig for sjov. Man kan sikkert ikke spærre Mette Frederiksen "
260,10.07.2020," af det kompromisforslag, som EU-formand Charles Michel har skruet sammen før et ekstraordinært topmøde om en uge. Her skal statsminister Mette Frederiksen forsøge at nå til enighed med de 26 andre stats- og regeringschefer om både budget og genopretningspakke "
261,09.07.2020," om sagen, da efterforskningen stadig ikke er afsluttet. Sørens Papes yderste mål er statsministerposten Der er ingen grund til at bringe Mette Frederiksen i mindretal »bare for at gøre det«, mener K-formand Søren Pape, som undrer sig over Venstres "
262,08.07.2020," vis. Som Mette Frederiksen – ifølge Pape – har gjort det. »Hun har håndteret det godt. Hun gjorde det eneste rigtige på nedlukningen, men jeg synes, hun har været for forsigtig med åbningen. Men jeg har respekt for hendes måde at gøre det på "
263,08.07.2020,", om der skal rejses tiltale. »Han har været efterlyst i mange år, så jeg kan ikke forstå, at det skal tage så lang tid,« siger han. »Øget brutalisering« Velkomsten fra statsminister Mette Frederiksen var kontant, da Ahmed el-Haj returnerede hertil. Hun bad "
264,07.07.2020," efter at statsminister Mette Frederiksen havde lukket landet ned, begyndte telefonerne atter at ringe. Denne gang var det dog afbookinger, som væltede ind. Lige indtil slutningen af april, da landet langsomt åbnede op. Så ville alle pludselig til Bornholm igen "
265,06.07.2020," med andre opgaver,« siger Jesper Fisker, adm. direktør i Kræftens Bekæmpelse. Utilsigtede fald Antallet af henvisninger til pakkeforløb for kræft faldt markant, da statsminister Mette Frederiksen i marts, i uge 11, lukkede Danmark ned. Dette "
266,06.07.2020,", hvor DF egentlig står på klimapolitikken. Og om hengivenheden over for de ældre vælgere rækker så langt, at DF vil hjælpe Mette Frederiksen med at sende ”Arne” på tidlig pension. Partiformand Kristian Thulesen Dahls diagnosticering af partiets "
267,06.07.2020," af de 31 sigtelser rejst i marts og april og altså i de første uger, efter statsminister Mette Frederiksen (S) lukkede Danmark ned. »Det tyder på, at der er blevet mere plads på vejene, og at der er nogen, der bruger det som anledning til at bruge "
268,06.07.2020,Efter en forbigående flirt med konkurrencestaten tilbage i Helle Thorning Schmidts og ikke mindst Bjarne Corydons ”onde” regeringstid fandt Socialdemokratiet med Mette Frederiksen og ikke mindst Henrik Sass Larsen melodien med en kovending 
269,05.07.2020,", og at der ikke findes noget alternativ til åbne grænser, er blevet tilbagevist under coronakrisen.« Fransk undtagelse I Frankrig har landets præsident, Emmanuel Macron, ikke håndteret coronakrisen lige så succesfuldt som f.eks. Mette Frederiksen i København "
270,04.07.2020," vedkommende som kronprins eller kronprinsesse. Det skal man ikke.« Hvorfor egentlig ikke? Det gik da meget godt for Mette Frederiksen? »Det er en måde at slide folk ned på, hvis der er mange år til. Vi har brug for alle kræfter, også yngre. Jeg kan "
271,04.07.2020," katastrofale corona begynder at ligne et gennembrud i retning af et stærkere Europa, grønnere og mere enigt i sit forhold til uberegnelige, ofte aggressive magter som USA, Rusland og Kina. Mette Frederiksen risikerer med sin absurde EU "
272,04.07.2020," Me To Stay” – som vil blive sendt på DR2. Forbud mod store forsamlinger Vi spoler tiden tilbage til mandag den 6. april om aftenen, da statsminister Mette Frederiksen atter gik på talerstolen med meddelelser om coronasituationen: »Til "
273,03.07.2020,", men det er foruroligende, når partilederen ikke selv har et klart idegrundlag at stå på, men dækker sig bag konsultationer med baglandet. Nyrup faldt på det. Jakob Ellemann-Jensen står over for den yngre, men politisk erfarne Mette Frederiksen "
274,02.07.2020,", hvad Venstres politik egentlig er for tiden. Hvad der er den vigtigste forskel på ham og Mette Frederiksen. Hvad Venstre vil gå til valg på. Ellemann betoner den økonomiske ansvarlighed. »Det, der har gjort, at Danmark stod stærkt, da coronaen ramte "
275,02.07.2020," ville formentligt have haft flertal bag sig i alle disse år. Det indså Mette Frederiksen og hendes rådgivere – sikkert for meget længe siden, men man skulle jo bevare grimassen – og ændrede politik på området, da hun blev leder, og derfor ser vi nu DF "
276,01.07.2020," at købe, men heldigvis er de samtidig så velsmagende, at de få, der har råd til dem, stadig køber dem. For Mette Frederiksen og stort set alle øvrige politikere i Folketinget er det ikke godt nok. De vil gerne have, at der er flere, der bruger "
277,01.07.2020," for at træde til som formand for Børnerådet under en regering, der har meldt ud, at børnene skal have et stort politisk fokus. Statsminister Mette Frederiksen (S) har sågar betegnet sig selv som børnenes statsminister. Social- og indenrigsminister "
278,30.06.2020,"Danskerne har set markant mere tv under coronakrisen. Før krisen ramte landet, så danskerne i gennemsnit tv i 2 timer og 19 minutter hver dag. Men da statsminister Mette Frederiksen (S) 11. marts annoncerede en omfattende nedlukning, steg "
279,29.06.2020," end to år efter åbningen – kunne B.T. imidlertid beskrive, at blot 28 personer var registreret som udrejst fra Kærshovedgård. 4. Kan der indgås en hjemsendelsesaftale med Syrien? Statsminister Mette Frederiksen meddelte i februar i år "
280,29.06.2020,", at der er børnehaver og skoler – også i de små byer. Mette Frederiksen om Genforeningen: Glædens dag for hele Danmark »Hvis børnene ikke kommer i dansk skole, er familien tabt for mindretallet. Sproget er vores ømme punkt. Hvis skolen her lukker, forsvinder "
281,28.06.2020,", statsministeren kørte sine pressemøder på. Det kan der komme masser af sjov ud af.« Ulf Pilgaard fortæller, hvordan han i midten af maj så de tidligere spindoktorer Peter Mogensen og Michael Kristiansen endevende Mette Frederiksens krisekommunikation "
282,27.06.2020," blomsterbilleder. Der skulle trods alt stadig danses med coronavirussen på behørig afstand af hinanden. Da statsminister Mette Frederiksen fik ordet, forsøgte hun at trække en streg i sandet i forhold til den aftagende virus. Nu skulle man tilbage "
283,27.06.2020,"Da statsminister Mette Frederiksen tilbage i marts lukkede Danmark ned, var det slut med at besøge fitnesscentre, idrætsklubber og svømmehaller. Med ét blev danskerne tvunget til at tænke ud af boksen, når de skulle have sved på panden "
284,27.06.2020," i det hele er man bekymret for sit gode navn og rygte. Det stod i hvert fald klart, at mine eksempler på Mette Frederiksens ”hammerstrategi” overhovedet ikke stemte med tyskernes billede af Danmark som et overmåde venligt, afslappet land "
285,27.06.2020,"Midt i den varme sommer har to midaldrende, magtfulde mænd af egen drift forladt deres stillinger. Først administrerende direktør Henrik Poulsen fra energikoncernen Ørsted og få dage senere statsminister Mette Frederiksens magtfulde højre "
286,27.06.2020," forsøger hun uden held at grine af, at hun modtog afslaget på ansøgningen om statsborgerskab den dag, da Danmark fejrede 100-året for Genforeningen – og den dag, hvor statsminister Mette Frederiksen besøgte Kruså, 2 km fra Christina Jacobsens hjem "
287,27.06.2020," fået en uduelig leder, som hellere vil flirte med De Radikale end stå skulder ved skulder med den øvrige borgerlige opposition. Til lykke til Mette Frederiksen og det øvrige socialistiske Danmark. En historisk svag borgerlig opposition uden "
288,27.06.2020,", er tæt på uacceptabel, og det kan i værste fald være undergravende for samarbejdet i rigsfællesskabet. Mette Frederiksen sagde i august, at Grønland ikke er dansk, hvorefter regeringen ”glemte” at sætte Færøerne på verdenskortet, til forståelig "
289,26.06.2020,Det har været et uhyre begivenhedsrigt første år med den socialdemokratiske mindretalsregering under Mette Frederiksen. Men der er sket uhyre lidt politisk. Lørdag runder regeringen sin første fødselsdag. Coronapandemien vil få 
290,26.06.2020,"En skør idé. Typisk Trump. Absurd. Præsident Trumps tilbud om at købe Grønland i august sidste år har fået mange ord med på vejen. Det var statsminister Mette Frederiksen, der kaldte det »absurd«. Det udløste en mellemsvær diplomatisk "
291,25.06.2020," kommentar fra Statsministeriet. Det har ikke været muligt for Ritzau at få et interview med statsminister Mette Frederiksen (S) eller få en uddybning af baggrunden for, at Martin Rossen stopper før tid. Portræt: Mette F. mister strategen der hjalp "
292,25.06.2020,", og talrige undersøgelser viser det. Læs mere i JP mener. DAGENS TEGNING: Til grin DAGENS JP-INDLÆG: Vi fik følelsen af at tilhøre et fællesskab, da vi underlagde os samfundssindets isolation »Mette Frederiksen meddelte med stor myndighed, at store "
