;date;text;id;key
621;2020-04-20 18:21:03+00:00;På seneste pressemøde sagde Kåre Mølbak, at det kun var eet af mange mulige scenarier, men i pressen er worst case scenario desværre tit det der fokuseres på/flest clicks;1252301265805234186;Kåre Mølbak
622;2020-04-20 18:04:27+00:00;#Iran Latest #News in Brief - April 18, 2020 - NCRI https://www.ncr-iran.org/en/news/latest-news-in-brief/latest-news-in-brief-april-18-2020/#.Xpu8uddu-9g.twitter #IranUprising #Coronavirus #IranRegimeChange .@USADARFARSI .@VOAIran #KhameneiVirus Jimin #Coronadk #COVID19dk Denmark #dkpol #dkmedier #COVIDー19 Spanien #skolechat Kåre Mølbak;1252297090753069058;Kåre Mølbak
623;2020-04-20 18:03:05+00:00;"#Iran #CoronaVirus ""For Khamenei &amp; Rouhani, the lives &amp; well-being of the people are worthl... https://youtu.be/yPM5KAhVgCQ via @YouTube Jimin #Coronadk #COVID19dk Denmark #dkpol #dkmedier #COVIDー19 Spanien #skolechat Kåre Mølbak";1252296747851931649;Kåre Mølbak
624;2020-04-20 17:57:17+00:00;#MEK Resistance Units call for ouster of Khamenei as main cause of #Iran’s #COVID_19 crisis #coronavirus #IranProtests #IranRegimeChange #FreeIran2020 Jimin #Coronadk #COVID19dk Denmark #dkpol #dkmedier #COVIDー19 Spanien #skolechat Kåre Mølbak @dwnews;1252295284576616448;Kåre Mølbak
625;2020-04-20 17:50:12+00:00;#Coronavirus Crisis in #Iran, Regime's Fear of People's Uprising #IranProtests #IranregimeChange #FreeIran2020 #KhameneiVirus #Covid_19 #IranCoVidTruth .@who @COE Jimin #Coronadk #COVID19dk Denmark #dkpol #dkmedier #COVIDー19 Spanien #skolechat Kåre Mølbak ;1252293501963907075;Kåre Mølbak
626;2020-04-20 17:42:01+00:00;Er du sikker på, at det ikke var avisen, der spidsvinklede en vurdering fra Kåre Mølbak? Det mener han vist selv.;1252291444523532289;Kåre Mølbak
627;2020-04-20 17:39:20+00:00;#IranCovidtruth: Worrying Situation of Political Prisoners in #Iran https://mek-iran.com/2020/04/19/mek-iran-worrying-situation-of-political-prisoners-in-iran/ #MEK #coronavirus #COVID19 @USAdarFarsi.@UNHumanRights Jimin #Coronadk #COVID19dk Denmark #dkpol #dkmedier #COVIDー19 Spanien #skolechat Kåre Mølbak Danske Bank;1252290769232302080;Kåre Mølbak
628;2020-04-20 17:38:32+00:00;– Vi ved dybest set ikke, hvad fremtiden bringer. Det kan være, at corona udvikler sig som en almindelig forkølelse. Det kan være, den udvikler sig til en lidt halvlam fætter, der ikke giver så meget sygdom. KÅRE MØLBAK, FAGLIG DIREKTØR I STATENS SERUM INSTITUT;1252290566345437186;Kåre Mølbak
629;2020-04-20 17:38:09+00:00;Jamen det vi faktisk gerne vil se er Ulf Pilgaard som Kåre Mølbak, så hesten stopper faktisk ikke her.;1252290469977079810;Kåre Mølbak
630;2018-11-15 11:49:50+00:00;They could have been so much more.;1063036348603527168;Kåre Mølbak
631;2020-04-20 17:35:02+00:00;#Iran to face widespread protests once virus threat recedes https://arabnews.com/node/1661541#.XpxpICBDqOM.twitter @NCRIUS @Iran_Policy #IranProtests Jimin #Coronadk #COVID19dk Denmark #dkpol #dkmedier #COVIDー19 Spanien #skolechat Kåre Mølbak #CoronaVirus Brostrøm;1252289686430781441;Kåre Mølbak
632;2020-04-20 17:32:21+00:00;– Vi ved dybest set ikke, hvad fremtiden bringer. Det kan være, at corona udvikler sig som en almindelig forkølelse. Det kan være, den udvikler sig til en lidt halvlam fætter, der ikke giver så meget sygdom. KÅRE MØLBAK, FAGLIG DIREKTØR I STATENS SERUM INSTITUT;1252289013203062792;Kåre Mølbak
633;2020-04-20 17:32:01+00:00;– Vi ved dybest set ikke, hvad fremtiden bringer. Det kan være, at corona udvikler sig som en almindelig forkølelse. Det kan være, den udvikler sig til en lidt halvlam fætter, der ikke giver så meget sygdom. KÅRE MØLBAK, FAGLIG DIREKTØR I STATENS SERUM INSTITUT;1252288929690193920;Kåre Mølbak
634;2020-04-20 17:31:21+00:00;– Vi ved dybest set ikke, hvad fremtiden bringer. Det kan være, at corona udvikler sig som en almindelig forkølelse. Det kan være, den udvikler sig til en lidt halvlam fætter, der ikke giver så meget sygdom. KÅRE MØLBAK, FAGLIG DIREKTØR I STATENS SERUM INSTITUT;1252288760403955712;Kåre Mølbak
635;2020-04-20 17:30:49+00:00;Har lige set @espersendf i Aftenshowet eller hvad det nu hedder på DR1. Jeg synes også, det var en trist melding fra Kåre Mølbak. Men Espersen går for langt, når han siger, at Mølbak ikke kan være det bekendt. Og at man skal passe på, hvad man siger ... Tænk at det kommer fra DF?;1252288626827898881;Kåre Mølbak
636;2020-04-20 17:30:40+00:00;Berlingske skrev, at Kåre Mølbak udtalte,at der måske var op til 1 år med afstand og kram. Ramaskrig. Nu skriver skriver samme avis, at eksperter i dag udtaler sig om ny stigning i covid på grund af påsken. Er der nogen,som ønsker en Trump åbning med alt hvad det indebærer ?;1252288587330138117;Kåre Mølbak
637;2020-04-20 17:13:59+00:00;@espersendf er ikke rigtig klog. Dronningen må sige sit sludder og roses for det. Kåre Mølbak må ikke. Forskellen er dronningen ikke ved, hvad hunnsnakker om. KM ved hvad han taler om. DU sku’ holde din mund. #dkmedier #dkpol;1252284390153076739;Kåre Mølbak
638;2020-04-20 17:09:32+00:00;Fuldstændig , Enig . Kåre Mølbak , siger det ligeud .... Kunne være rart Hvis SST og Søren Brostrøm , også var mere direkte, fremfor beklagelser og komplicerede indviklede retningslinier . Måske de også skulle have meldt ud , at manglen på værnemidler afspejlede sig i retningsl.;1252283270840102920;Kåre Mølbak
639;2020-04-20 17:01:45+00:00;Vi har brug for visionær ledelse, der tænker langsigtet. Nogen der ikke accepterer langvarig fysisk afstand eller 10.000+ døde. Kåre Mølbak har først accepteret det sidste og senest det første.;1252281310577659909;Kåre Mølbak
640;2020-04-20 16:25:04+00:00;Er det ikke en overfortolkning af det som Kåre Mølbak siger? Den underliggende præmis virker til at være at det er på de præmisser vi kender i dag. Men det er jo ikke givet. Der kan jo ske forbedringer via værnemidler, test for smitte og test for antistoffer m.v. ;1252272080130838528;Kåre Mølbak
641;2020-04-20 16:23:15+00:00;Kåre Mølbak vinder nok ingen kommunikationspriser lige med det samme - og han har sikkert også lavet fejl. Men behandlingen af hans citat er vel et meget fint eksempel på hvorfor politikere oftest svare i floskler og ikke-svar. Den træning har KM så bare ikke. (1/2);1252271622536540163;Kåre Mølbak
642;2020-04-20 15:21:54+00:00;Jeg tror Kåre Mølbak bør anskaffe sig en kommunikationsmedarbejder. I hvert fald midlertidigt.;1252256181990629378;Kåre Mølbak
643;2020-04-20 14:44:43+00:00;Kåre Mølbak taler over sig ved hvert interview med pressen. Han er guld værd for journalisterne- knap så meget for regeringen og spindoktorerne. Det er simpelthen bare ikke stringent kommunikation!;1252246824934674435;Kåre Mølbak
644;2020-04-20 14:24:21+00:00;@DanskDf1995 mener Kaare Mølbak kommer med løse påstande og sætter danskernes støtte til kampen mod corona over styr. Hvor er det trist at @DanskDf1995 resolut skal sprede sådanne påstande.;1252241701051252737;Kåre Mølbak
645;2020-04-20 14:06:51+00:00;I morgen vil Kåre Mølbak formentlig anbefale at man holder sig til sexting. ;1252237294163165184;Kåre Mølbak
646;2020-04-20 14:05:05+00:00;Men hvad siger Kåre Mølbak? ;1252236852376944642;Kåre Mølbak
647;2020-04-20 14:04:05+00:00;Kåre Mølbak: Jeg kan godt forstå, at nogen synes, at det er voldsomt og skræmmende at holde fysisk afstand i lang tid ;1252236599854641158;Kåre Mølbak
648;2020-04-20 13:45:18+00:00;Kåre Mølbak angiver ligeledes på pressemødet, at det ikke er R, som de styrer efter, men kapaciteten på intensiv. For to uger siden forventede man mere tryk på intensiv ved R=1,2, end ved de scenarier, der ligger nu her for R=0,8.;1252231874002313218;Kåre Mølbak
649;2020-04-20 13:35:46+00:00;Kåre Mølbak ændrer sjovt nok mening, hver gang han står sammen med en minister på et pressemøde. Bliver han mon banket på plads af regeringen?;1252229472339681281;Kåre Mølbak
650;2020-04-20 13:32:16+00:00;Kåre Mølbak siger, @berlingske har vinklet ham skarpt. Det siger han, selvom han har godkendt dette citat, og selvom hans udtalelser i øvrigt fint flugter med tidligere signaler og udtalelser fra hans internationale kollegaer. Jamen, det skal da nok bidrage til mindre forvirring. https://twitter.com/ChrBirk/status/1252224830763655169;1252228591414214656;Kåre Mølbak
651;2020-04-20 13:22:14+00:00;"""Det kan altså vare måneder eller år, før danskerne kan leve livet som før coronakrisen. Det siger Kåre Mølbak."" ""Vi skal undgå håndtryk, kram og kindkys og store forsamlinger i mindst et år, siger Kåre Mølbak"" I første citat kan det vare måneder. Næste citat mindst et år.";1252226065985990657;Kåre Mølbak
652;2020-04-20 13:20:56+00:00;"Skal jeg forstå svaret på @LarsIgum spørgsmål til Kåre Mølbak, som at SSI i højere grad lægger vægt på risici for at R&gt;1 nu ift. tidligere? R=1,2 var fin for to uger siden. Nu frarådes R=0,8. @mvinaes @coronakamp eller andre? #dkmedier #covid19dk #dkpol";1252225739199479808;Kåre Mølbak
653;2020-04-20 13:18:00+00:00;søren brostrøm: hav al den sex i vil, vi går ind for sex hos sundhedsstyrelsen kåre mølbak: men ingen orgies folket!!!;1252225003313078272;Kåre Mølbak
654;2020-04-20 13:17:29+00:00;»Vi kan jo se, at kønssygdommene er på vej ned« Kåre Mølbak leverer dagens næstbedste citat. Det overgås af @SSTbrostrom »Sex er godt. Sex er sundt. Vi går ind for sex« Aldrig har jeg hørt en læge sige sex så mange gange i en sætning. #dkmedier #dkpol #covid19dk;1252224870982746113;Kåre Mølbak
655;2020-04-20 13:16:16+00:00;Seneste nyt fra Danmark og Verden #nyheder: Seruminstitut: Strategien er fortsat afbødning Danmarks strategi er fortsat en afbødningsstrategi, slår faglig direktør Kåre Mølbak fra Statens Serum Institut fast på et pressemøde efter tvivl i medierne. ;1252224565494890496;Kåre Mølbak
656;2020-04-20 13:16:08+00:00;"Kåre Mølbak om Berlingske citatet om 1 års social afstand: "" - det citat er skåret meget skrapt..."" Så kender vi Berlingskes kreativitet igen, som i andre tvivlsomme tilfælde. #dkmedier #dkpol #COVID2019dk";1252224531068080130;Kåre Mølbak
657;2018-12-03 14:51:27+00:00;The worst foreign signings in Premier League history!;1069605034357338113;Kåre Mølbak
658;2020-04-20 13:15:54+00:00;Godt at Kåre Mølbak får lov at levere den her udenfor betalingsmuren. Han har intet sted udtalt noget så ultimativt som overskrifterne ;1252224475673878530;Kåre Mølbak
659;2020-04-20 13:14:01+00:00;Ny artikel om Corona: Kåre Mølbak: Jeg kan godt forstå, at nogen synes, at det er voldsomt og skræmmende at holde fysisk afstand i lang tid (Politiken) ;1252224001084215297;Kåre Mølbak
660;2020-04-20 13:04:45+00:00;Kåre Mølbak sagde at smitteopsporing og isolation vil være en væsentlig del af den fremtidige strategi.;1252221667922731009;Kåre Mølbak
661;2020-04-20 13:03:40+00:00;Kåre Mølbak: Jeg kan godt forstå, at nogen synes, at det er voldsomt og skræmmende at holde fysisk afstand i lang tid https://politiken.dk/del/OPtiJAAANufw @politiken;1252221395075059712;Kåre Mølbak
662;2020-04-20 12:51:25+00:00;Sagde Kåre Mølbak lige, at man kan blive testet inden man skal på familiebesøg? ;1252218312563580928;Kåre Mølbak
663;2020-04-20 12:50:35+00:00;"Kåre Mølbak: ""Vi ved, at nærhed betyder meget for mange mennesker."" Mmkay. #dkpol";1252218103863353346;Kåre Mølbak
664;2020-04-20 12:38:58+00:00;Der er pressemøde. Kåre Mølbak har vist fået et lille smæk i bagen. :-);1252215177593962502;Kåre Mølbak
665;2020-04-20 12:37:15+00:00;Hvor er Statsminister Mette Frederiksen til dette pressemøde ?? #ZigZag regering @regeringDK efter Kåre Mølbak fra @SSI_dk udtagelser om nedlukning af Danmark de næste års tid #dkpol #COVID19dk #coronavirus;1252214748504109060;Kåre Mølbak
666;2020-04-20 12:32:11+00:00;Hvordan mon Kåre Mølbak vil lyde med et lydtæt mundbind ;1252213472244490240;Kåre Mølbak
667;2020-04-20 12:25:22+00:00;@venstredk Det er fantastisk at se venstres næstformand udtale sig om Kåre Mølbak udtalelse til Berlingske han siger bare hvad han mener og Mette Frederiksen har ikke sagt noget dem der presser på er de borgerlige så kom med jeres eget forslag så vi kan se hvor;1252211759085215744;Kåre Mølbak
668;2020-04-20 11:47:55+00:00;Henrik Qvortrup - spørg endelig Kåre Mølbak hvad han mener med vaccination - det er jo grunden til han siger et år- skal alle borgere i DK vaccineres????? Mage til slingrekurs fra KM ;1252202330977599488;Kåre Mølbak
669;2020-04-20 11:47:47+00:00;"""Når man har så stort et talerør, så skaber det, man siger, ringe i vandet"", siger Esben Marcher, Sekretariatschef i Dansk Live til @jyllandsposten om de seneste udtalelser fra Statens Serum Instituts faglige direktør, Kåre Mølbak: https://bit.ly/3amGgic #dkpol #dkkultur";1252202299205865474;Kåre Mølbak
670;2020-04-20 11:34:02+00:00;Kåre Mølbak: Danskerne skal regne med at holde afstand i mindst et år, http://jyllands-posten.dk:;1252198838334558208;Kåre Mølbak
671;2020-04-20 11:34:02+00:00;Kåre Mølbak: Danskerne skal regne med at holde afstand i mindst et år, http://jyllands-posten.dk:;1252198837042778112;Kåre Mølbak
672;2019-01-01 14:47:18+00:00; Form Experience Potential Here's the top 50 players under the age of 23 in world football.;1080113238535294976;Kåre Mølbak
673;2020-04-20 11:11:56+00:00;Der er usikkerhed og frustration nok i forenings- og idrætsdanmark. Hvilket fagligt grundlag hviler udtalelsen fra Kåre Mølbak sig på. Må vi se. Deltager gerne i fælles dialog med styrelser, foreningsdanmark, herunder bl.a. fitnesscentre og danseskoler. ;1252193276242903040;Kåre Mølbak
674;2020-04-20 11:07:57+00:00;Det er jo helt absurd at tænke restriktioner et år frem. Kåre Mølbak leverer rekommandationer baseret på videnskab. Men de skal jo omsættes i socialpsykologiske, politiske, økonomiske sammenhænge. Lad os nu komme ud over stepperne, vende tilbage til livet, med håndsprit og test.;1252192275096055808;Kåre Mølbak
675;2020-04-20 10:47:53+00:00;Ja, jeg stoler altså også meget mere på videnskabsfolkene i DF end på Kåre Mølbak... Det er underligt, at det kommer fra en tidligere journalist på BT, for det stærkt underresearchet...... #dkmedier #dkpol #covid19dk;1252187224583610370;Kåre Mølbak
676;2020-04-20 10:22:28+00:00;Kåre Mølbak: Danskerne skal regne med social afstand i mindst et år - TV 2 #Hjemmeundervisning individuelt giver #Guvernanter en tilbagevenden. Samtidig vil niveauet løftes da disciplinen vil højnes og et bedre samfundssyn vil komme tilbage. UD EU og FN;1252180828093911043;Kåre Mølbak
677;2020-04-20 09:48:12+00:00;Kåre Mølbak har ikke sagt at først om et år, bliver der åbnet op for alt. Han udtaler at vi er nød til at sænke smittetrykke indtil der kommer en vaccine, under forudsætning af virussen ikke ændre sig.;1252172203573075969;Kåre Mølbak
678;2020-04-20 09:41:12+00:00;Jeg er også helt sikker på Covid-19 er noget Kåre Mølbak og regeringen har skaffet ind over landets grænser,BARE for at få deres 15 sek. Fame,jo mere de kan moppe danskerne,jo bedre har de det. Og danskerne..de er bare utilfredse,“vi må ingenting“..åhh man bliver så træt af brok.;1252170441583742976;Kåre Mølbak
679;2020-04-20 09:03:00+00:00;"Der er meningsdannere her på Twitter der bør rykke direkte tilbage i fængsel og lade rigtige eksperter såsom Kåre Mølbak og andre vurdere denne her lortesituation. Skal vi være kritiske; Ja - Skal vi stille spørgsmål; Ja - Skal vi være konstruktive sammen; Ja og ellers luk røven.";1252160828910063627;Kåre Mølbak
680;2020-04-20 08:41:30+00:00;@simonkollerup Skal vi frygte at Kåre Mølbak har ret i at der ikke kan afholdes større arrangementer det næste års tid? I så fald vil det være rigtig fedt hvis I har alle os der leverer til oplevelsesindustrien i tankerne. Potentielt et helt år uden omsætning er lang tid! #dkpol;1252155420459876352;Kåre Mølbak
681;2020-04-20 08:33:34+00:00;Hvad vil du helst, høre på Kåre Mølbak, eller Donald Frederiksen? @regeringDK;1252153421840420865;Kåre Mølbak
682;2020-04-20 08:32:19+00:00;Kåre Mølbak er videnskabsmand og forholder sig de facts han ser nu og her. Og selvom han kommer med lille forslag (Louisiana) så vil han jo nok være den første til at sige at han ikke kan komme med de bedste løsninger. Men det er der så nok andre der kan ;1252153107611598848;Kåre Mølbak
683;2020-04-20 08:19:08+00:00;Forslag til statsministeren: Indkald til et hurtigt ppressemøde. Emne: Er regeringen enig med Kåre Mølbak? Er tidshorisonten et år? Du har holdt pressemøder om mindre, Mette Frederiksen. #dkpol;1252149788843393024;Kåre Mølbak
684;2020-04-20 08:14:16+00:00;Alle - også Kåre Mølbak - er blevet klogere siden dengang. Heldigvis. For dengang vidste vi næsten intet. Nu ved vi lidt mere, men stadig ikke alt. Det er fair at mene at vores myndigheder ikke skal udtale sig om noget som helst før de er 100% sikre. Så får vi nok ikke meget info;1252148567285866497;Kåre Mølbak
685;2020-04-20 07:59:46+00:00;"Alle de ""virusfornægtere"" der bliver sure og fornærmede på Kåre Mølbak, fordi han udtaler at vi måske bliver nødt til at holde social afstand i et år, de opfører sig fuldstændig som kirken i processen mod Galilei. De nægter at deres verdensbillede kan være forkert.";1252144914982408193;Kåre Mølbak
686;2020-04-20 07:53:18+00:00;Vi skal jo være bange og frustrerede nok til at sige ja tak til vaccination uden at stille spørgsmål. Kåre Mølbak... Er han ikke en del af WHO og dermed også en del af Bill Gates ambitioner om verdensdækkende vaccination? Skulle vi evt. få nogle uafhængige eksperter på banen?;1252143288708194305;Kåre Mølbak
687;2020-04-20 07:49:30+00:00;Ja, rigtig interessant historie som Ekstra Bladet (?) har lavet? »Sådan lyder vurderingen fra Kåre Mølbak, der er faglig direktør på Statens Serum Institut, i et interview med Berlingske«;1252142333690347520;Kåre Mølbak
688;2020-04-20 07:41:07+00:00;Det kan der være gode grunde til. Det virker bare ikke sådan, når der pt. tillades havefester i Nørrebroparken, mens Kåre Mølbak taler om ét års social distance. Det hænger ikke sammen og ledelse savnes. Regeringen kunne passende starte med selv at komme med sine... #dkpol;1252140222621630464;Kåre Mølbak
689;2020-04-20 07:16:04+00:00;Seneste nyt fra Danmark og Verden #nyheder: Kåre Mølbak: Regn med social afstand i mindst et år Der kan gå måneder - eller endda år - før danskere kan levet livet som før coronakrisen. Sådan lyder vurderingen fra Kåre Mølbak, der er faglig direktør på St… ;1252133921116114946;Kåre Mølbak
690;2020-04-20 07:14:20+00:00;Vi kan godt lide eksperter. Medierne citerer disse eksperter i et væk. MEN de skal altså ikke “eksperte” alt for meget for så bliver vi stædige og selvkloge. Så gør vi, hvad vi selv finder klogt og medierne betvivler ekspertisen. #dkpol #COVID19dk #kaaremoelbak;1252133482496692224;Kåre Mølbak
691;2020-04-20 07:07:11+00:00;SÅ klapper hesten lige Kåre Mølbak!;1252131684297867266;Kåre Mølbak
692;2020-04-20 06:49:24+00:00;"Tak..! #dkpol for at sende jeres modige journalister i marken for at dække denne krise... hvad betyder det når Kåre mølbak siger at vi måske ikke kan gå i teatret efter koncerter i næsten et år. Når man kan få en""sød lille tiger""på armen... ";1252127206228271108;Kåre Mølbak
693;2019-01-01 13:22:53+00:00;Not all of these wonderkids turned out to be 'the next superstar' ;1080091997111812097;Kåre Mølbak
694;2020-04-20 06:47:07+00:00;Jeg kunne godt tænke mig at høre hvorledes Kåre Mølbak forholder sig til, at der dør 15.000 om året pga rygning. Og vi som samfund stadig accepterer at cigaretter stadig kan købes overalt!;1252126633902907393;Kåre Mølbak
695;2020-04-20 06:46:32+00:00;"Jeg tror, mange fodboldfans kan relatere sig til at ligge på andenpladsen. Uden nogen udsigter til at vinde. Og så tænke: ""Heller aflyse hele lortet end at lade dem vinde"". Ved vi med sikkerhed, at Kåre Mølbak ikke bare er en FCK-fan?";1252126487785943040;Kåre Mølbak
696;2020-04-20 06:27:40+00:00;Vi skal undgå håndtryk, kram og kindkys og store forsamlinger i mindst et år, siger Kåre Mølbak, direktør i Statens Seru... https://www.berlingske.dk/danmark/kaare-moelbak-med-tung-besked-til-de-naerhedshungrende-regn-med-social MINDST 1 ÅR !!!! KÅRE MØLBAK @SSI_dk @SSTSundhed @SSTbrostrom @Heunicke #dkpol #COVID19dk #dkmedier;1252121738193797121;Kåre Mølbak
697;2020-04-20 06:25:01+00:00;Kåre Mølbak: Regn med social afstand i mindst et år, http://ekstrabladet.dk:;1252121073262485507;Kåre Mølbak
698;2020-04-20 06:21:57+00:00;Jeg har den største respekt for Kåre Mølbak. At han forsøger at være klar i mælet. Og at hans referencepunkt i den virkelige verden er Louisiana. Men er det regeringens politik/analyse? Vi er forbi det punkt hvor man bare kommunikerer i øst og vest #dkpol;1252120299698622464;Kåre Mølbak
699;2020-04-20 05:54:01+00:00;Det har længe ligget i kortene, at før vaccinen var her, skulle vi ikke regne med noget, og mange i risikogruppen har for længst erkendt det, så glem hylekoret. // Kåre Mølbak med tung besked til de nærhedshungrende: Regn med social afstand i mindst et år https://www.berlingske.dk/danmark/kaare-moelbak-med-tung-besked-til-de-naerhedshungrende-regn-med-social;1252113269579558912;Kåre Mølbak
700;2020-04-20 05:32:59+00:00;Allerede om to uger er vi fucked. Det behøver man ikke følge ret mange unge på Instagram for at vide. Og Kåre Mølbak taler om social distance i op til et år. På månen, simpelthen. https://www.berlingske.dk/danmark/kaare-moelbak-med-tung-besked-til-de-naerhedshungrende-regn-med-social;1252107976074309633;Kåre Mølbak
701;2020-04-20 05:15:14+00:00;Altså, Kåre Mølbak er måske ikke en gudsbenådet kommunikatør. Men han har jo ret.;1252103512202321928;Kåre Mølbak
702;2020-04-20 05:05:40+00:00;FYSISK kontakt Kåre Mølbak, ikke social kontakt, men fysisk kontakt !!! #COVID19dk;1252101100880224257;Kåre Mølbak
703;2020-04-20 02:56:33+00:00;Det er tydeligt, at Kåre Mølbak ikke var opmærksom på, at det var Ulfs sidste sæson. Som samfund skal vi kunne klare en overdødelighed, når vi skal sige farvel til ikoner som Ulf ;1252068611256193025;Kåre Mølbak
704;2020-04-20 01:03:01+00:00;Kåre Mølbak: Regn med social afstand i mindst et år, http://bt.dk: https://www.bt.dk/content/item/1402952;1252040038310989826;Kåre Mølbak
705;2020-04-19 21:33:02+00:00;Kåre Mølbak med tung besked til de nærhedshungrende: Regn med social afstand i mindst et år, http://berlingske.dk: https://www.berlingske.dk/content/item/1459653;1251987191892410368;Kåre Mølbak
706;2020-04-19 21:33:01+00:00;Kåre Mølbak med tung besked til de nærhedshungrende: Regn med social afstand i mindst et år, http://berlingske.dk: https://www.berlingske.dk/content/item/1459653;1251987190298574853;Kåre Mølbak
707;2020-04-19 21:26:05+00:00;"Ja, måske. Det ved ingen af os vel endnu. Men nu var udgangspunktet i denne debat også, at Kåre Mølbak ""har tabt sutten"". Det er måske lige harsk nok en konklusion på baggrund af at han vurderer anderledes end Anders Tegnell?";1251985445862465539;Kåre Mølbak
708;2020-04-19 20:42:23+00:00;Hvis det var en realistisk og rigtig vej, hvorfor plæderer Kåre Mølbak så ikke for den? Hvad tænker du får ham til at sige noget andet? Jeg spørger oprigtigt.;1251974449013932043;Kåre Mølbak
709;2020-04-19 20:30:59+00:00;Han har tydeligvis fået en virus, det er ikke muligt, at lukke samfundet ned i endnu 12 mdr... Psykiske relaterede sygdomme vil da ihvertfald koste flere Menneskeliv i så fald. Kåre Mølbak: Danskerne skal regne med social afstand i mindst et år http://nyheder.tv2.dk/samfund/2020-04-19-kaare-moelbak-danskerne-skal-regne-med-social-afstand-i-mindst-et-aar;1251971578881028101;Kåre Mølbak
710;2020-04-19 20:18:21+00:00;Forstår virkelig frustrationen. Som jeg hører det, er det dog et slag på tasken. Bliver det realitet, kan jeg ikke tro andet, end at der bliver indført metoder og midler, så de gamle og syge ikke skal sidde alene. Jeg læste måske dit tweet som et angreb på Kåre Mølbak ved en fejl;1251968400810749952;Kåre Mølbak
711;2020-04-19 20:15:29+00:00;.....eller endnu bedre - fyre Kåre Mølbak og ansætte Vibeke Manniche. ;1251967678849449985;Kåre Mølbak
712;2020-04-19 20:01:36+00:00;#dkpol - Kåre Mølbak med tung besked til de nærhedshungrende: Regn med social afstand i mindst et år https://www.berlingske.dk/danmark/kaare-moelbak-med-tung-besked-til-de-naerhedshungrende-regn-med-social, see more http://tweetedtimes.com/ProvoDk?s=tnp;1251964185006739456;Kåre Mølbak
713;2020-04-19 20:00:43+00:00;“Til gengæld kan man jo mødes på andre måder. Eksempelvis via Skype eller på Zoom, som mange gør i dag«, siger Kåre Mølbak til Berlingske.” Jeg har fanget, man skal have respekt for videnskaben og ikke selv spille ekspert, men så lad dog være med at sige alt for tåbelige ting.;1251963962268291072;Kåre Mølbak
714;2018-12-03 14:51:27+00:00;The worst foreign signings in Premier League history!;1069605034357338113;Kåre Mølbak
715;2020-04-19 19:58:50+00:00;'Regn med social afstand i mindst et år.' Det mener Kåre Mølbak, direktør for Statens Serum Institut. Store koncerter, teaterforestillinger, kram, håndtryk og tæt kontakt til andre, skal altså undgås i lang tid fremover. https://www.bt.dk/samfund/kaare-moelbak-regn-med-social-afstand-i-mindst-et-aar;1251963486525173760;Kåre Mølbak
716;2020-04-19 19:50:02+00:00;Kåre Mølbak: Danskerne skal regne med social afstand i mindst et år, http://tv2.dk:;1251961271576072192;Kåre Mølbak
