;date;text;id;key
317;2020-05-28 14:39:32+00:00;Nej Freja de andre partier henviser til Sundhedsmyndigheder vedrørende grænselukning ikke regeringen. Kåre Mølbak var tidligt ude og slå fast at det ikke var en anbefaling.;1266016260913082368;Kåre Mølbak
318;2020-05-27 19:37:23+00:00;Jeg forholder mig faktisk til fakta.! I den E-mail korrespondance - Hvor du nøjes med at læse EB’s overskrift! Påpeger Kåre Mølbak det vigtige i, at social distancering bliver bibeholdt. Så summa summarum. Intet nyt!!;1265728829542133760;Kåre Mølbak
319;2020-05-27 19:12:24+00:00;Hvorfor har du kun “Det vil man ikke politisk” og ikke den fra Kåre Mølbak. “At det er ‘Vigtigt’ at strategien med at holde afstand bibeholdes. Så R ikke bevæger sig op” i dit tweet?;1265722541726928898;Kåre Mølbak
320;2020-05-26 07:42:54+00:00;"Kåre Mølbak var ikke sikker på at det kunne smitte mellem mennesker så sent som midt februar. Det skulle heller ikke komme her til Danmark. Hvis vi havde ventet på ""evidens"" for dette nye virus, så har vi været som Sverige idag.";1265186636108873728;Kåre Mølbak
321;2020-05-25 19:35:32+00:00;Jeg har ikke kunne se Kåre Mølbak uden at tænke på jeres vatpindesnak. Tak for det.;1265003586838237184;Kåre Mølbak
322;2018-11-15 11:49:50+00:00;They could have been so much more.;1063036348603527168;Kåre Mølbak
323;2020-05-25 05:41:12+00:00;ATS: Kåre Mølbak vil erstatte Phillip Faber ;1264793622295334913;Kåre Mølbak
324;2020-05-24 21:11:34+00:00;European monitoring of excess mortality for public health action (EuroMOMO): Kåre Mølbak https://doi.org/10.1093/eurpub/ckt126.113;1264665365415673857;Kåre Mølbak
325;2020-05-24 07:05:32+00:00;Det her er ikke bare sort, det er også sjovt og handler både om forvaltning af forvaltere og et håb om afsked med new public management - evt med hjælp fra Kåre Mølbak og SSI ;1264452457331073025;Kåre Mølbak
326;2020-05-23 22:03:06+00:00;Jeg forstår simpelthen ikke hvorfor Kåre Mølbak ikke tror på en anden bølge? #andenbølge #corona #covid19dk #dkpol;1264315945964777472;Kåre Mølbak
327;2020-05-23 21:01:01+00:00;"»Der er rigtig meget smitte ude i det danske samfund, og der er et kæmpestort mørketal. I de bloddonorundersøgelser, der er lavet, kan man se, at det måske er 70 gange flere, der har haft infektionen, end vi kan se i statistikkerne,« siger Kåre Mølbak til Berlingske."" (Pol, 8/4)";1264300324296196101;Kåre Mølbak
328;2020-05-23 06:58:40+00:00;Vi kan måske holde sygdommen stangen med social afstand og hygiejne, indtil en vaccine er klar. Køber du ikke den melding fra Kåre Mølbak? ;1264088339419992064;Kåre Mølbak
329;2020-05-21 23:11:03+00:00;Politikere til Kåre Mølbak sætter dato på - her er talerne, du skal eller vil rejse.;1263608272357076993;Kåre Mølbak
330;2020-05-20 17:50:08+00:00;Kåre Mølbak er åbenbart en god socialdemokrat.;1263165122354216965;Kåre Mølbak
331;2020-05-20 15:29:20+00:00;Så er der nye brætspil til de kommende fridage ♟ Både udvidelse til et af favoritspillene og et spil hvor man kan frigive sin indre Kaare Mølbak ;1263129690551791616;Kåre Mølbak
332;2020-05-20 14:07:21+00:00;Hvis antistof-tallet konfirmeres af andre undersøgelser, viser det, at Kåre Mølbak’s flok-immunitets-strategi var baseret på helt forkerte estimater #covid19 #dkpol #dkbiz;1263109058883616769;Kåre Mølbak
333;2020-05-20 11:20:04+00:00;Det er ikke så ofte, at @SSI_dk og Kåre Mølbak og Robert Skov (leder af ekspertgruppen bag regnemodellerne) giver interviews. Men lige netop i dag vil jeg meget gerne høre, hvad de siger om de politiske forslag om genåbningen af Danmark.;1263066960138559488;Kåre Mølbak
334;2020-05-20 10:04:02+00:00;Der begynder at komme ting frem resten af Folketinget ikke var informeret om. Regnefejl og ikke mindst at man ikke vil høre på og fremvise hvad flere forskere ønsker. Kåre Mølbak ligger inde med informationer han holder tæt ind til kroppen. Hvorfor ;1263047823425253376;Kåre Mølbak
335;2020-05-20 07:46:55+00:00;Selvom Kåre Mølbak har aflyst muligheden for en ny smittebølge, så fylder risikoen meget hos de selvstændige, og det påvirker den daglige drift. Genåbningen hjælper ikke alene, der er behov for forlængelse af hjælpepakker og kickstart af økonomien https://policywatch.dk/article12155440.ece #dkpol;1263013320644321280;Kåre Mølbak
336;2020-05-20 06:59:49+00:00;Here's the meeting overview, received this from Sundhedsstyrelsen in Denmark. We had Kåre Mølbak attending representing Denmark. https://www.ecdc.europa.eu/sites/default/files/documents/AF60-Sixtieth-meeting-ECDC-Advisory-Forum-18-19-February-2020.pdf;1263001467407020032;Kåre Mølbak
337;2020-05-19 12:55:43+00:00;Vejret: Der er udsigt til regnefejl på udsatte steder, især Statens Serum Institut. Kåre Mølbak vil dog stadig være tør. #ATS #coronadk #dkpol;1262728642188189697;Kåre Mølbak
338;2020-05-19 12:11:51+00:00;Jeg må ærlig tilstå at Kåre Mølbak har mistet alt troværdighed, sådan som han har væltet rundt i fejl og mærkværdige udmeldinger. Det er mental aquaplaning for fuld Gaddafi.;1262717602750763008;Kåre Mølbak
339;2020-05-19 07:38:03+00:00;Det er da mere spøjst at SSI og landets sundhedsminister nedtoner det som en “fejl i en figurtekst” i betragtning af det var et tal, som Kåre Mølbak fremhævede på et pressemøde.;1262648697764098048;Kåre Mølbak
340;2020-05-19 07:05:57+00:00;Håber alle nu ikke farer i flæsket på Kåre Mølbak. Vi stod overfor noget ukendt og der skulle handles hurtigt. Vi skal bruge fejlen til at lære af ikke til at nogen skal i gabestokken. ;1262640620532895746;Kåre Mølbak
341;2020-05-19 06:37:34+00:00;Håber alle nu ikke farer i flæsket på Kåre Mølbak. Vi stod overfor noget ukendt og der skulle handles hurtigt. Vi skal bruge fejlen til at lære af.;1262633477478010881;Kåre Mølbak
342;2020-05-19 06:02:07+00:00;Jeg tænker i hvert fald man må overveje om ledelsen fungerer optimalt - hvorfor er der ikke en arbejdsgang, hvor det her bliver undersøgt. Det virker til Kåre Mølbak bare har makket noget sammen i et word-dokument.;1262624555224502272;Kåre Mølbak
343;2019-01-01 14:47:18+00:00; Form Experience Potential Here's the top 50 players under the age of 23 in world football.;1080113238535294976;Kåre Mølbak
344;2020-05-18 20:01:15+00:00;Er vi stadig imponerede af de danske myndigheders håndtering? Tror ikke Kåre Mølbak og co er på hitlisten hos politikere og eksperter lige nu. ;1262473343464280064;Kåre Mølbak
345;2020-05-18 19:12:27+00:00;Nedlukningen af samfundet næsten halverede smittetrykket, lød det fra SSI's Kåre Mølbak i slutningen af marts. Det var så heller ikke rigtigt. ;1262461064278691842;Kåre Mølbak
346;2020-05-18 17:58:50+00:00;På en personlig note ville jeg gerne fremhæve Kåre Mølbak. Dygtig som bare fanden, men så tilgengæld en elefant i en porcelænsbutik... Garantien med ham er udelukkende at man får sandheden og hele sandheden. Den er ikke pakket ind eller sat pænt op. Men SSI er godt tjent der.;1262442535173136385;Kåre Mølbak
347;2020-05-18 07:54:10+00:00;Vi er jo hverken Søren Brostrøm eller Kaare Mølbak, så når myndighederne siger, det er i orden, så kører vi... ;1262290365597528065;Kåre Mølbak
348;2020-05-18 05:23:38+00:00;Network hub Kåre Mølbak Kåre Mølbak, EuroMOMO Project Leader Professor, Director of Infectious Disease Preparedness Statens Serum Institut, Artillerivej 5 DK-2300 Copenhagen S, Denmark Tel: +45 3268 3157 E-mail: krm@ssi.dk;1262252483386028033;Kåre Mølbak
349;2020-05-16 16:33:32+00:00;Kåre spurgte Søren Brostrøm om han var enig med Kåre Mølbak i hans vurdering af en anden Corona bølge. De to herrer står sammen i spidsen for Sundhedsmyndighederne, så det er vigtigt for danskerne at vide om de har samme anskuelse i dette helt afgørende spørgsmål.;1261696296135667712;Kåre Mølbak
350;2020-05-16 16:23:09+00:00;Men kom til at stille ST til ansvar for ting Kåre Mølbak fra SSI havde udtalt !;1261693682186665987;Kåre Mølbak
351;2020-05-16 13:28:06+00:00;Han glemte: Kåre Mølbak: der er meget lav sandsynlighed for at en krydderbolle for i brand i en brødrister;1261649628841365508;Kåre Mølbak
352;2020-05-16 08:48:35+00:00;Den selv samme journalist har nærmest kørt hetz mod den nuværende regering , Kåre Mølbak og Søren Brostrøm og det lyder nærmest som om han er udsendt af Jakob Ellemann med de komplet latterlige spørgsmål ,hva nu hvis og hvad nu hvis ikke . i stedet for at forholde sig til fakta.;1261579287058157568;Kåre Mølbak
353;2020-05-15 20:57:19+00:00;Poul, du kan se de samme data hos EuroMOMO, hvor Kaare Moelbak er projektleder. https://www.euromomo.eu/graphs-and-maps/ Desvaerre er de bagvedliggende tal heller ikke tilgaengelige i dette tilfaelde. Takket vaere bl.a. MF Stinus Lindgreen er modeller og data fra DK/SSI nu tilgaengelige.;1261400289090981891;Kåre Mølbak
354;2020-05-15 08:29:55+00:00;Man havde egentlig ventet de ville begynde at tælle på knapper tidligere. Problemet er vel mest at beregningerne f.eks skal holde landet fra at måtte lukke ned igen. Nåhja, og at Kåre Mølbak ikke er gud, han kan kun lave så og så mange matematiske modeller pr. uge...;1261212201706291200;Kåre Mølbak
355;2020-05-15 04:08:28+00:00;Det har vaeret i flere medier. Her en tilfaeldig en af slagsen: https://jv.dk/artikel/lande-med-hurtig-coronalukning-er-sluppet-for-overd%C3%B8delighed Til gengaeld er det aergeligt, at tallene fra EuroMOMO, hvor Kaare Moelbak er projektleder, ikke er offentligt tilgaengelige.;1261146402803060736;Kåre Mølbak
356;2020-05-15 04:00:21+00:00;Det gaelder ogsaa EuroMOMO, som Kaare Moelbak er projekt-leder for.;1261144364006477824;Kåre Mølbak
357;2020-05-14 22:15:34+00:00;Kåre Mølbak var personen længst til højre i billedet med en grøn klud om halsen. Hørte du ikke, da han var efter de unge for deres adfærd, når de er alkoholpåvirkede?;1261057593847492609;Kåre Mølbak
358;2019-01-01 14:40:41+00:00;So. Much. Silverware. These 10 clubs have dominated Europe's top 5 leagues.;1080111576320016385;Kåre Mølbak
359;2020-05-14 20:36:32+00:00;"Der er gået totalt unge-bashing i epidemien. Da antallet af smittede unge steg (sammen med antallet af test), klagede Kåre Mølbak over de ""uansvarlige unge"". Data peger imidlertid på at børn/unge smittes af voksne i hjemmet, ikke ved at hænge ud med andre. https://www.sst.dk/-/media/Udgivelser/2020/Corona/Status-og-strategi/COVID-19-11-epidemiuge.ashx?la=da&amp;hash=0491921AA694A65124621654B540615E5A366CA6Status-og-strategi/COVID-19-11-epidemiuge.ashx";1261032670068432896;Kåre Mølbak
360;2020-05-14 20:22:39+00:00;Er Søren Brostrøm og Kåre Mølbak mon ikke under kontrol mere? ;1261029177194676231;Kåre Mølbak
361;2020-05-14 19:02:35+00:00;Kan det passer vi lige har set partileder debat uden at Kåre Mølbak og Søren Bromstrøm blev nævnt en eneste gang? Jeg syntes Ellemann trådte lidt i karakter... Det var godt at se.. Men var der næsten ikke lidt for god stemning? :) Det vil Mette F ihvertfald drage fordel af.....;1261009028882235393;Kåre Mølbak
362;2020-05-14 18:01:06+00:00;Jeg er så forvirret.. hvorfor er Søren Brostrøm og Kåre Mølbak ikke med til statsministerens pressemøde her til aften? #dkpol #coronedebat;1260993555650281479;Kåre Mølbak
363;2020-05-14 16:42:39+00:00;Hørte i eftermiddag @sverigesradioP1 der sendte pressemøde med de svenske sundhedsmyndigheder ... de gjorde det faktisk godt, lige som @SSTbrostrom og Kåre Mølbak #SverigeErIkkeTabtBagEnVogn #coronavirus #sundpol #dkpol;1260973813803757568;Kåre Mølbak
364;2020-05-14 15:45:05+00:00;First up is Nordic Region COVID-19 Update at http://NIS2020.com with: Alma D. Möller – Director of Health, Iceland Directorate of Health Kåre Mølbak – Executive Vice President, Statens Serum Institut, Denmark Svein Harald Øygard – Economist and Crisis Specialist;1260959324555354112;Kåre Mølbak
365;2020-05-14 12:20:02+00:00;Mhm, men det vil Søren Brostrøm og Kåre Mølbak ikke forholde sig til.. eller anbefale. ;1260907725107724289;Kåre Mølbak
366;2020-05-14 06:31:06+00:00;På det seneste store pressemøde i tirsdags roste Kåre Mølbak os og sagde, at »danskerne har været rigtig dygtige.« Men det er naturligvis også let at være dygtig, når man har fået en god opdragelse af sin landsmoder. Fra min klumme i @berlingske #dkpol;1260819910760030208;Kåre Mølbak
367;2020-05-14 04:14:49+00:00;Kom nu med nogle klare retningslinjer. De udmeldinger i kommer med, laves om 2 dage efter. Kåre Mølbak siger et og 3 dage efter er pandemien faktisk væk, og der kommer ikke en ny bølge, okay tænker jeg så. Den måde i håndtere det her på kan i ikke være bekendt!;1260785616293330948;Kåre Mølbak
368;2020-05-13 17:50:00+00:00;Dr. Anthony Fauci, M.D, har nogle virkelig gode pointer her og de eksemplificerer også hvorfor, jeg ikke giver meget for hverken Kåre Mølbak eller Søren Brostrøm... #dkpol #dkmedier #COVID19;1260628375871328258;Kåre Mølbak
369;2020-05-13 14:21:38+00:00;Forvirring om risiko for ny bølge coronaepidemi - Nu forklarer Kåre Mølbak Hvorfor er journalister så uforstående verden er ikke sort og hvid. Hvad med lidt logisk tænkende og spørgende journalister;1260575936736563200;Kåre Mølbak
370;2020-05-13 12:21:21+00:00;De fleste Amikanere kan sagtens finde ud af det. Hvor har du sådan noget sludder fra. Lytte til andre? Overså du jeg skrev tidligere at Kåre Mølbak ikke mener sandsynligheden for en anden bølge, er særlig stor. Dem der er i risikogruppen beskytter forhåbentlig sig selv ;1260545666889252864;Kåre Mølbak
371;2020-05-13 09:21:02+00:00;Kåre Mølbak: - Usandsynligt, at der kommer en anden bølge af corona, http://tv2.dk:;1260500290748518402;Kåre Mølbak
372;2020-05-13 09:21:02+00:00;Kåre Mølbak: - Usandsynligt, at der kommer en anden bølge af corona, http://tv2.dk: https://nyheder.tv2.dk/samfund/2020-05-12-kare-molbak-usandsynligt-at-der-kommer-en-anden-bolge-af-corona;1260500288059977728;Kåre Mølbak
373;2020-05-13 08:58:11+00:00;Jeg tror forresten @SSTbrostrom og Kåre Mølbak @SSI_dk er ved at være modne til frivillig evighedskarantæne fra #dkmedier, når vi er ude på den anden side... #dkpol #dkmedier #dkbiz;1260494538931650565;Kåre Mølbak
374;2020-05-13 08:43:20+00:00;Der er “rent epidemiologisk en betydelig risiko” for 2. bølge, men der vil blive grebet ind. Kåre Mølbak uddyber her sine tilsyneladende skiftende prognoser #sundpol #COVID19dk;1260490799399211009;Kåre Mølbak
375;2020-05-13 08:39:26+00:00;Det bliver så noget svært at forstå når Kåre Mølbak siger det er nærmest usandsynligt at der kommer en bølge nr 2. Sammenlagt med ny teststrategi igen igen, så burde han vel have ret.;1260489819806982144;Kåre Mølbak
376;2020-05-13 07:29:11+00:00;Begrebet risiko er præcist, ligesom Mølbak's analyse af risikoens kontekst er præcis. Det er et analytisk sprog som er præcist og de relevante præmisser er beskrevet og det er også det Kåre Mølbak sagde på mødet i går.;1260472139825721349;Kåre Mølbak
377;2020-05-13 06:39:25+00:00;Kåre Mølbak: »Med den viden, vi har i dag, mener jeg, at det er meget lidt sandsynligt, at vi ser en egentlig anden bølge,« Men eksperter undrer sig over de modstridende meldinger. https://www.berlingske.dk/danmark/statens-serum-institut-saa-betydelig-risiko-for-en-anden-boelge-med-smitte;1260459617567588353;Kåre Mølbak
378;2020-05-13 05:49:57+00:00;Hvordan skal vi kunne stole på Kåre Mølbak og Søren Brostrøm #dkpol Ny melding om ingen anden bølge på bare 6 dage! Zigzag Zigzag kurs @SSTSundhed @SSI_dk Husker Søren Brostrøm udtalelser i januar at Corona Virus ikke rammer Danmark;1260447167841554434;Kåre Mølbak
379;2018-11-15 11:49:50+00:00;They could have been so much more.;1063036348603527168;Kåre Mølbak
380;2020-05-13 05:01:29+00:00;Actually, it's Kåre Mølbak to be accurate... ;1260434970021150720;Kåre Mølbak
381;2020-05-13 04:40:11+00:00;Udfordringen ved at spørge Kaare Mølbak er, at svaret på spørgsmålet afhænger af ugenumret...;1260429610023555072;Kåre Mølbak
382;2020-05-13 00:06:13+00:00;Kåre Mølbak: - Usandsynligt, at der kommer en anden bølge af corona ;1260360664385716224;Kåre Mølbak
383;2020-05-12 19:47:06+00:00;Dagens melding fra Kåre Mølbak er så vild. For seks dage siden skrev han at var sandsynligt med anden bølge nu er det usandsynligt. Partierne besluttede på et grundlag der forsvandt #dkpol #dkmedier | BT Debat - http://www.bt.dk;1260295456300597251;Kåre Mølbak
384;2020-05-12 19:20:10+00:00;Når man stiller spørgsmål til politiske beslutninger. Når man stiller spørgsmål til Kåre Mølbak. Når man ikke lader modparten svare og afbryder konstant. Så er det i min verden mangel på format og dårlig research ift. at stille spørgsmål til modparten, som denne har ansvar for;1260288676812242945;Kåre Mølbak
385;2020-05-12 19:15:07+00:00;Hvordan skal vi kunne stole på Kåre Mølbak og Søren Brostrøm #dkpol Ny melding om ingen anden bølge på bare 6 dage! Zigzag Zigzag kurs @SSTSundhed @SSI_dk Husker Søren Brostrøm udtalelser i januar at Corona Virus ikke rammer Danmark;1260287408769302529;Kåre Mølbak
386;2020-05-12 18:43:24+00:00;Hvis det er det Kåre Mølbak mener, så skal han altså på kommunikations-kursus. Jeg tror faktisk, at han er særdeles kompetent, så det er lidt ærgeligt, at ingen har tillid til ham. Personligt synes jeg selv, at det er ærgeligt, at han ikke offentliggør EUROMOMO-data.;1260279423535927296;Kåre Mølbak
387;2020-05-12 15:46:48+00:00;I marts frarådede Kåre Mølbak denne anbefaling fra WHO ... nu anbefaler han den ... ;1260234982515183616;Kåre Mølbak
388;2020-05-12 15:45:42+00:00;I marts frarådede Kåre Mølbak denne anbefaling fra WHO ... nu anbefaler han den ... https://www.weforum.org/agenda/2020/03/todays-who-briefing-eaa3d34289/;1260234707549200387;Kåre Mølbak
389;2020-05-12 15:04:49+00:00;"""- Nu har vi lært så meget om, hvordan vi skal håndtere smitten. Vi har testkapacitet, vi kan isolere smittede, og læger og sygeplejersker ved mere. Så derfor er det usandsynligt med en egentlig anden bølge, der får store og ødelæggende konsekvenser, siger Kåre Mølbak.""";1260224417742946304;Kåre Mølbak
390;2020-05-12 15:02:32+00:00;Statsministeren: Vi kan ikke sige noget om, hvorvidt der kommer en anden bølge, eller ej. Kåre Mølbak: Hold mine værnemidler..... ;1260223844121481217;Kåre Mølbak
391;2020-05-12 14:03:50+00:00;"Når jeg den spanske syges tre bølger, håber jeg at Kåre Mølbak har ret i at en anden bølge af corona er ""meget usandsynligt"" https://www.cdc.gov/flu/pandemic-resources/1918-commemoration/three-waves.htm";1260209071124295681;Kåre Mølbak
392;2020-05-12 12:48:42+00:00;Højst overraskende ser Kåre Mølbak det ikke længere for sandsynligt, at Danmark oplever en anden bølge af coronaepidemi til efteråret. https://www.bt.dk/samfund/kaare-moelbak-kommer-med-overraskende-udmelding;1260190163243802624;Kåre Mølbak
393;2020-05-12 12:17:21+00:00;hår i suppen. MF og regeringen har klaret denne pandemi godt og da især hvis , som Kåre Mølbak mener, der ikke kommer en anden bølge.;1260182270671020033;Kåre Mølbak
394;2020-05-12 11:20:06+00:00;Det var jo også usandsynligt, at det overhovedet ville komme til Danmark - kan ikke huske, om det var Søren Brostrøm eller kåre Mølbak, der sagde det i starten året.;1260167867057819649;Kåre Mølbak
395;2020-05-12 10:14:14+00:00;Kåre mølbak 27.2.20: https://finans.dk/erhverv/ECE11971663/professor-det-er-min-mavefornemmelse-at-det-ikke-vil-udvikle-sig-slemt-i-danmark/?ctxref=ext Kåre Mølbak nu:https://ekstrabladet.dk/nyheder/samfund/moelbak-om-anden-boelge-meget-usandsynligt/8119029 Så i skal nok forberede jer på smitten breder sig voldsomt den kommende tid #covid19dk;1260151288777576449;Kåre Mølbak
396;2020-05-12 10:11:19+00:00;"hold afstand. Ellers ser vi en risiko for en ""anden bølge"", som man ser i andre lande, siger Kåre Mølbak 14/4-20 ""Ingen lande har indtil videre set en anden bølge... Det er meget usandsynligt at se en anden egentlig bølge siger Kåre Mølbak. 12/5-20";1260150557060317184;Kåre Mølbak
397;2020-05-12 09:54:15+00:00;Da jeg var til pressemøde i Statsministeriet i dag, kørte jeg i elevator op med Kåre Mølbak. Vi var to i en elevator på 1½x 1½ meter. Det tror jeg ikke kan være korrekt. Vi smalltalkede lidt de sekunder på vej op. Det var også ham der svarede på mit spørgsmål.;1260146260545286155;Kåre Mølbak
398;2020-05-12 09:44:30+00:00;For nyligt er 6 dage siden... helt modsatte synspunkt fra Kåre Mølbak på under en uge.;1260143806927773696;Kåre Mølbak
399;2020-05-12 09:42:04+00:00;Hvordan kan nogle stadig udskamme folk, der undrer sig højlydt. Kåre Mølbak 6 maj: “der er en betydelig risiko for, at der kommer en 2. bølge”. Kåre Mølbak 12 maj: “2. bølge er usandsynlig”. #dkpol #dkmedier #COVID19dk;1260143192508416000;Kåre Mølbak
400;2019-01-01 13:22:53+00:00;Not all of these wonderkids turned out to be 'the next superstar' ;1080091997111812097;Kåre Mølbak
401;2020-05-12 09:36:39+00:00;Jeg “elsker” Kåre Mølbak, han virker kompentent, og jeg håber virkelig, at han får/har ret. Fortsæt bare med de gode nyheder .;1260141829271351297;Kåre Mølbak
402;2020-05-12 09:20:06+00:00;“Kaare Mølbak udelukker ikke at der kan komme en mindre stigning i smittetrykket igen” - nej havde I helt ærligt troet han ville det? Du fredsens noget vås at skrive....;1260137664189206528;Kåre Mølbak
403;2020-05-12 09:18:03+00:00;Kåre Mølbak: - Usandsynligt, at der kommer en anden bølge af corona http://nyheder.tv2.dk/samfund/2020-05-12-kare-molbak-usandsynligt-at-der-kommer-en-anden-bolge-af-corona?cid=_soco%3Atw%3A4%3Anews%3A%3A%3A;1260137150613385216;Kåre Mølbak
404;2020-05-12 09:15:18+00:00;Jeg er altså ret vild med Kåre Mølbak. Hver gang han åbner munden må ministrene virkelig ryste i bukserne over hvilke steppebrande han nu får startet ;1260136456363917313;Kåre Mølbak
405;2020-05-12 09:12:09+00:00;"Undskyld mig - men hvad?? ... hold afstand. Ellers ser vi en risiko for en ""anden bølge"", som man ser i andre lande, siger Kåre Mølbak 14/4-20 ""Ingen lande har indtil videre set en anden bølge... Det er meget usandsynligt at se en anden egentlig bølge siger Kåre Mølbak. 12/5-20";1260135663942471680;Kåre Mølbak
406;2020-05-12 08:58:46+00:00;Med ny teststrategi og isolation er det usandsynligt med stor 2.bølge, siger Kåre Mølbak på statsministerens pressemøde.;1260132297426247681;Kåre Mølbak
407;2020-05-12 08:49:30+00:00;Iflg. Kåre Mølbak er det usandsynligt at få får en anden Wuhan virusbølge i Danmark. Ligesom han sagde om den første i øvrigt ..;1260129963757441025;Kåre Mølbak
408;2020-05-12 08:46:50+00:00;Meget usandsynligt med en egentlig 2. bølge. Der vil blive gjort alt for at forebygge og slå den ned, lyder budskabet nu fra @SSI_dk s Kåre Mølbak #Covid_19 #dkpol;1260129293386031106;Kåre Mølbak
409;2020-05-12 08:44:03+00:00;Statsministeren: Vi kan ikke sige om der kommer en anden bølge eller ej. [giver ordet til Kåre Mølbak] Kåre Mølbak: Jeg ser ikke en anden bølge for mig. ;1260128592933072899;Kåre Mølbak
410;2020-05-12 08:21:39+00:00;Kåre Mølbak i Statsministeriet efter dages tavshed. Det er jo i sig selv en nyhed. #dkpol;1260122956493205504;Kåre Mølbak
411;2020-05-11 18:49:53+00:00;Svækker vi vores supervåben? Kåre Mølbak har tidligere advaret om overoptimisme. Hvor tæt vil folk rykke sammen efter den nye anbefaling om 1 meters afstand? #dkpol #COVID19dk;1259918666918920192;Kåre Mølbak
412;2020-05-10 17:38:51+00:00;Se det venter jeg også på at høre. Ikke mindst nu, hvor Kåre Mølbak er blevet parkeret. Han nægtede nok at ændre på fakta så flere kunne komme i skole.;1259538406750683136;Kåre Mølbak
413;2020-05-10 13:35:06+00:00;Imponerende, hvis Kåre Mølbak siger én ting og hans egne ansatte siger noget andet. Har du et link til rapporten?;1259477063750365184;Kåre Mølbak
414;2020-05-10 13:26:51+00:00;Aner det ikke - det eneste jeg siger er, at både Søren Brostrøm og Kåre Mølbak har stået på mange pressemøder og sagt at de først kan se effekten på tallene efter 14 dage efter der er sket ændringer i tiltag.;1259474987787997188;Kåre Mølbak
415;2020-05-10 10:40:56+00:00;Kåre Mølbak fra Staten Serum Institut må i sin tid have vidst, at den valgte strategi ville føre til årelang delvis nedlukning af samfundet. Han oplyste dog først offentligheden om dette, da det var et fait accompli. Det burde pressen have kritiseret. #PRESSELOGEN;1259433231700627464;Kåre Mølbak
416;2020-05-10 08:42:30+00:00;#presselogen Kåre Mølbak fra Staten Serum Institut må i sin tid have vidst, at den valgte strategi ville føre til årelang delvis nedlukning af samfundet. Han oplyste dog først offentligheden om dette, da det var et fait accompli. Det burde pressen have kritiseret.;1259403428033429504;Kåre Mølbak
417;2020-05-09 20:48:42+00:00;Det er jo fordi folk er idioter og læser berlingske eller ekstrabladet i stedet for at lytte efter Kåre Mølbak og Søren Brostrøm... Måske forståeligt nok, men det er så dem der lægger den linje, ind til nu fuldt ud støttet af regeringen.;1259223793924530177;Kåre Mølbak
418;2020-05-09 20:37:49+00:00;Det er entydigt meldt ud af sundhedsstyrelsen, af Kåre Mølbak og af Regeringen i samtlige spørgerunder og under pressemøder. Der er heller INTET modstridende materiale i den retning hos hverken sundhedsstyrelsen, SSI eller på statsministeriet. Det er ca. hvad de kan gøre.;1259221055035584514;Kåre Mølbak
419;2020-05-09 19:16:08+00:00;Det var vist et Kåre Mølbak udtryk - eller pålagt ham - som ikke holder i den videnskabeligt sundhedsøkonomis tjeneste ;1259200499284393987;Kåre Mølbak
