;date;text;id;key
912;2020-04-07 08:14:14+00:00;Regeringen har igår begået et ufatteligt egenrådigt skridt, som med #KåreMølbak synes uansvarligt overfor børnefamilierne. #Mørketallet og smittefaren ligger i den matematik, som statistikken er fodret med. Ordet sandsynligvis lyder ansvarsforflygtigende. Generationen udgør 10%.;1247437514228580352;Kåre Mølbak
913;2020-04-07 07:06:31+00:00;Mette Fredriksen virker snart så træt af Kåre Mølbak, som Donald Trump er af Anthony Fauci #dkpol #COVID19dk #coronadk;1247420473367019526;Kåre Mølbak
914;2020-04-07 06:49:37+00:00;"""Flokimmuniteten er en underliggende biologisk mekanisme, som støtter op om strategien,"" sagde Kåre Mølbak om regeringens strategi. #sundpol #COVID19dk";1247416219491340288;Kåre Mølbak
915;2020-04-07 06:42:47+00:00;Tror de fleste er bekymrede i denne tid, men: »1.800 børn under 10 år er blevet testet, og kun 1,8 procent er fundet positive, mens det svinger 10 til 11 procent for voksne. Derfor har vi ikke så stor bekymring for børn«, sagde Kåre Mølbak.;1247414499998601221;Kåre Mølbak
916;2020-04-07 06:15:04+00:00;Sagde Kåre Mølbak på pressemødet, at det blot var omkring 1% af alle testede børn, der var testet positive for coronavirus?;1247407527362428928;Kåre Mølbak
917;2020-04-07 06:11:15+00:00;»1.800 børn under 10 år er blevet testet, og kun 1,8 procent er fundet positive, mens det svinger 10 til 11 procent for voksne. Derfor har vi ikke så stor bekymring for børn«, sagde Kåre Mølbak.;1247406566271303685;Kåre Mølbak
918;2020-04-07 05:34:41+00:00;"Lodret løgn: På pressemødet mandag slog Kåre Mølbak også fast, at flokimmunitet ""aldrig har været en sundhedsfaglig strategi"" #dkpol";1247397362835873792;Kåre Mølbak
919;2020-04-07 04:25:18+00:00;Jeg synes Kåre Mølbak svarede meget præcist på dette spørgsmål, synes du ikke?;1247379900593553410;Kåre Mølbak
920;2020-04-06 22:22:47+00:00;Jeg hørte Seruminstituttets Kåre Mølbak fortælle om sundhedsmyndighedernes strategi. Det kan umuligt være den ekspert, du henviser til.;1247288670639570951;Kåre Mølbak
921;2020-04-06 21:28:56+00:00;Og det var det jo så efter Kåre Mølbak fik kommunikeret det klart ud ved aftenens pressemøde til masserne. Det var ærlig talt på tide, men bedre sent end aldrig, I guess ;1247275118482636800;Kåre Mølbak
922;2020-04-06 21:26:43+00:00;Det er meldt ud her til aften at flokimmunitet IKKE er en strategi der vil komme i brug. Kåre Mølbak (SSI) gik så langt som at sige at den ikke var sundhedsfagligt velfunderet.;1247274562913517575;Kåre Mølbak
923;2020-04-06 20:51:44+00:00;Kåre Mølbak sagde ellers at 10 % af de testede voksne er smittet. 1% af de testede børn er smittet.;1247265756833812480;Kåre Mølbak
924;2020-04-06 20:38:17+00:00;Så kom planen. I følge Kaare Mølbak er vi nu på R=0,9 med de kommende tiltag håber SSI at fastholde R=1,2 i en måned. Nedenfor simuleres, hvor lang tid den gradvise oplukning kan vare. Forløbet udviser stor følsomhed på R værdien, så vær sød at ramme :-) #COVID2019dk #dkpol;1247262372139581445;Kåre Mølbak
925;2020-04-06 20:37:11+00:00;CORONAVIRUS. Den sundhedsfaglige strategi er at komme på den grønne kurve, så sundhedssystemet ikke knækker over. Det er ikke en strategi, at folk bliver smittet. Det er en strategi, at folk ikke bliver syge, sagde Kåre Mølbak #SSI #Coronavirus #Sundhed #Danmark #dkpol #sundpol;1247262095323869186;Kåre Mølbak
926;2020-04-06 20:34:20+00:00;Årsagen til at der åbnes op for de mindste er som Kåre Mølbak sagde. Børn bliver smittet meget mindre end voksne. Ved test er 11 %af voksne smittet. Børn er smittet meget mindre. (1-2%);1247261381033897986;Kåre Mølbak
927;2020-04-06 20:33:26+00:00;"""Kåre Mølbak slog fast på pressemødet, at regeringens genåbning af landet er baseret på matematiske moduleringsmodeller omkring epidemien"". Ellers noget? #dkpol";1247261151282552838;Kåre Mølbak
928;2019-01-01 14:40:41+00:00;So. Much. Silverware. These 10 clubs have dominated Europe's top 5 leagues.;1080111576320016385;Kåre Mølbak
929;2020-04-06 20:33:09+00:00;"CORONAVIRUS. På pressemødet mandag slog Kåre Mølbak også fast, at flokimmunitet ""aldrig har været en sundhedsfaglig strategi"" https://nyheder.tv2.dk/2020-04-06-mette-frederiksen-vi-har-ikke-en-strategi-i-danmark-der-handler-mod-flokimmunitet #SSI #Coronavirus #COVID19dk #Sundhed #Danmark #dkpol #sundpol #dkmedier";1247261081107603457;Kåre Mølbak
930;2020-04-06 20:26:49+00:00;CORONAVIRUS. SSI's faglige direktør Kåre Mølbak slog fast på pressemødet, at regeringens genåbning af landet er baseret på matematiske moduleringsmodeller omkring epidemien https://ekstrabladet.dk/nyheder/samfund/mette-f.-praesenterer-foerste-fase-af-genaabning/8082257 #SSI #Coronavirus #COVID19 #Sundhed #Danmark #dkpol #sundpol #dkmedier;1247259489809686528;Kåre Mølbak
931;2020-04-06 20:24:17+00:00;Det skarpeste spørgsmål var det allersidste? Hvor mange vil dø, Kåre Mølbak, når man hæver smittespredningen fra 0,9 til 1,2? /10;1247258849360449537;Kåre Mølbak
932;2020-04-06 20:24:09+00:00;Nej det er ikke målet med strategien. Eller ikke et fokuspunkt i hvert fald. Flokimmunitet når vi formentlig lang tid før vha. vaccine uanset, så strategien er som Kåre Mølbak præciserede 1/4 på skrift og nu i dag ved pressemødet i SM. ;1247258814925230080;Kåre Mølbak
933;2020-04-06 20:11:02+00:00;“Af en eller anden årsag” fantastisk beroligende formulering fra Kåre Mølbak, SSI om lav smitteprocent blandt børn. #covid19dk #dkpol #ironikanforekomme;1247255515022987264;Kåre Mølbak
934;2020-04-06 20:04:29+00:00;Ud fra hvad? Der er tilsyneladende mere end 5 gange så lille sandsynlighed for, at de får sygdommen, som der er for alle os andre i følge Kåre Mølbak.;1247253867651387393;Kåre Mølbak
935;2020-04-06 20:04:04+00:00;Kåre Mølbak gav selv udtryk for en stigning på smittetrykket fra 0,9 til 1,2. Det vil nogen nok mene er alt for lavt med det nuværende antal indlagte, men et vist forsigtighedsprincip må være at foretrække imo indtil videre ;1247253763938832390;Kåre Mølbak
936;2020-04-06 19:42:05+00:00;Se om du kan finde pressemødet online. Det var Kaare Mølbak, der sagde det.;1247248228317347849;Kåre Mølbak
937;2020-04-06 19:41:14+00:00;Har du hørt hele konferencen? Fx Kåre Mølbak.;1247248015095717889;Kåre Mølbak
938;2020-04-06 19:38:49+00:00;Strategien herfor blev foklaret af Kåre Mølbak. Og efterfølgende uddybet af Sundhedsministeren.;1247247408603574272;Kåre Mølbak
939;2020-04-06 19:25:25+00:00;Mon Kåre Mølbak og slænget har været i en børnehave for nylig? Børn er fandme klamme.;1247244036563484672;Kåre Mølbak
940;2020-04-06 19:11:51+00:00;Kåre Mølbak og statsministeren er BANGE for brist i kapacitet i Sygehusvæsenet. Tænk de fjolser har ikke ajourført beredskabet og alle sikkerhedsforanstaltninger i tide, grundet de evindelige besparelser, som har affolket og nedlagt både sygehuse, beredskab og personale. Skandale;1247240621804466177;Kåre Mølbak
941;2020-04-06 19:08:55+00:00;Kåre Mølbak er kommet på arbejde i aften ;1247239885087539201;Kåre Mølbak
942;2020-04-06 19:08:07+00:00;#Pressemødet 6. april viser huller i de kloges argumentation. #Flokimmunitet og kynisme med flere døde indtil 60% er smittede eller døde i kapløbet. Journalisterne er begyndt at frygte egne liv. De spørger mere nærgående til både #Statsministeren og #KåreMølbak. ORD balanceres nu;1247239681810599942;Kåre Mølbak
943;2020-04-06 19:05:17+00:00;"Hvorfor bliver journalisterne i spejlsalen ved med at spørge om det samme, og om de ting som allerede er uddybet på pressemødet? ""Er flokimmunitet afledt af den nuværende strategi?"" Ja, det har Kåre Mølbak så lige svaret på... #dkpol";1247238967356989440;Kåre Mølbak
944;2020-04-06 19:03:44+00:00;Når det her er overstået vil jeg gerne byde både Søren Brostrøm og Kåre Mølbak på en iskold Odense Pilsner ;1247238578503143426;Kåre Mølbak
945;2020-04-06 19:02:27+00:00;Jeg tænkte faktisk at både hende og Kåre Mølbak har hostet under dette pressemøde!;1247238255986212864;Kåre Mølbak
946;2020-04-06 18:56:49+00:00;Tænker på om @SSTbrostrom også har klippet Kaare Mølbak #COVID19dk;1247236838416429057;Kåre Mølbak
947;2020-04-06 18:52:14+00:00;Man kan godt få den følelse, at nu bliver vores børn sendt til frontlinjen, som forsøgskaniner i det Kåre Mølbak ikke vil kalde flokimmunitet-strategien. #dkpol #COVID19dk;1247235685116973056;Kåre Mølbak
948;2020-04-06 18:50:28+00:00;@peterfalktoft @EsbenBjerre Hvor er Kåre Mølbak på legende-skalaen? Kan han komme i betragtning til den status?;1247235241435189249;Kåre Mølbak
949;2019-01-01 14:40:41+00:00;So. Much. Silverware. These 10 clubs have dominated Europe's top 5 leagues.;1080111576320016385;Kåre Mølbak
950;2020-04-06 18:50:28+00:00;0,9 sagse Kåre Mølbak lige netop;1247235239149219840;Kåre Mølbak
951;2020-04-06 18:48:33+00:00;Det glæder mig, at en journalist fik stillet så konkret et spørgsmål om strategien på dagens pressemøde, så Kåre Mølbak fik kommunikeret det her budskab klart og tydeligt ud. Det var ærlig talt på tide, så nu bliver det spændende at se, hvordan det bliver modtaget. #dkmedier;1247234756800118790;Kåre Mølbak
952;2020-04-06 18:47:46+00:00;Kåre Mølbak siger at strategien er sundhedsfaglig ansvarlig, forudsat at vi alle tager ansvar. Eftersom at alle ikke tager ansvar, er strategien så uansvarlig? #COVIDー19;1247234559923585024;Kåre Mølbak
953;2020-04-06 18:47:37+00:00;OBMF: Oplysning til Borgerne Om Moralfilosofi. Kåre Mølbak gjorde i sit svar til TV2 brug af dobbelt-effekt princippet: At en handling, der udføres med en bestemt hensigt, typisk også har andre, forudsigelige, ikke-intenderede konsekvenser.;1247234521369542657;Kåre Mølbak
954;2020-04-06 18:39:10+00:00;Kun 1,8 procent af børn testes positivt for covid, mens det er 10 procent for voksne, siger Kåre Mølbak, @SSI_dk. Det er med til at gøre det mere sikkert at sende børn indtil 5. klasse i institutioner nu. Strategien er IKKE flokimunitet, understreger statsministeren. #pressemøde;1247232395885137923;Kåre Mølbak
955;2020-04-06 18:38:59+00:00;Ja. Kaare Mølbak: “de skal vaske legetøjet to gange om dagen etc etc”. Kommer aldrig til at ske i en stor integreret institution som vores imo.;1247232350905405441;Kåre Mølbak
956;2020-04-06 18:38:18+00:00;“Det er en forsvarlig beslutning, men den kræver at alle hører efter og opfører sig ordentligt” - Kåre Mølbak om den delvise genåbning af DK #dkpol #Coronakrise #COVID19dk;1247232178636849152;Kåre Mølbak
957;2020-04-06 18:37:05+00:00;Kåre Mølbak har fået med Mettes hammer #hvadErStrategien;1247231870527590401;Kåre Mølbak
958;2020-04-06 18:37:03+00:00;Hørte jeg lige Kåre Mølbak sige, at flokimmunitet aldrig har været en strategi? #dkmedier #dkpol #covid19dk;1247231866077413377;Kåre Mølbak
959;2020-04-06 18:34:34+00:00;Nu giver Kåre Mølbak da noget der minder om et svar på det ;1247231237229547524;Kåre Mølbak
960;2020-04-06 18:31:31+00:00;Jeg ser det også, fordi Kåre Mølbak og Thorkild Fogde er med. Kåre: “Det her er ikke gætværk, der ligger matematiske beregninger bag.”;1247230469684502529;Kåre Mølbak
961;2020-04-06 18:29:43+00:00;"Kåre Mølbak: ""Det er ikke gætværk, det er matematiske modeller"". Tja.. forskellen er ikke altid så stor.";1247230017970503680;Kåre Mølbak
962;2020-04-06 18:06:54+00:00;Flokimmunitet er ingen strategi, det er et vilkår, basal biologi, som jeg forstår Kaare Mølbak. Men Tyskland mener noget andet. De kæmper med ‘Hammer og dans’. I den sammenhæng følger vi en form for Laissez faire-strategi. #COVID2019dk #dkpol @SSI_dk;1247224275167326216;Kåre Mølbak
963;2020-04-06 14:59:14+00:00;I mange lande (Østrig, DK, Tyskland etc) diskuteres #exitstrategi Kåre Mølbak sidder i ekspertgruppe, der rådgiver Kommissionen, så der kan udarbejdes fælles kriterier på tværs af landene. Referat fra mødet den 30/3 bl.a. om flokimmunitet #eudk @thinkeuropa;1247177047644012545;Kåre Mølbak
964;2019-01-01 13:22:53+00:00;Not all of these wonderkids turned out to be 'the next superstar' ;1080091997111812097;Kåre Mølbak
965;2020-04-06 09:45:03+00:00;Han ved ikke mere end Sundhedsmyndighederne. Han citerer blot Kåre Mølbak - den førende danske kapacitet på området - som har sagt at målet er flokimmunitet. Hvorfor melder regeringen det således ikke ud?;1247097983696547841;Kåre Mølbak
966;2020-04-06 07:31:20+00:00;"Kåre Mølbak: ""I og med at det ikke længere er muligt at inddæmme og bekæmpe virus, er målet med Sundhedsstyrelsens strategi og regeringens politik at hjælpe Danmark gennem denne epidemi, uden at sundhedsvæsenet og samfundet knækker over""";1247064329201094656;Kåre Mølbak
967;2020-04-06 07:29:48+00:00;Jeg forstår ikke hvorfor budskabet fra Kåre Mølbak her ikke er kommunikeret klarere ud, for det besvarer sådan set det spørgsmål som Løkke og mange andre har krævet svar på den seneste tid: ;1247063944734347264;Kåre Mølbak
968;2020-04-05 08:45:56+00:00;Helt centralt er dog, HVORDAN flokimmuniteten skal opbygges. Jeg tror, at debatten ryger af sporet, når folk læser 'flokimmunitet' som 'naturlig immunisering'. Altså som resultatet af et gennemgået smitte/sygdomsforløb, hvor Kåre Mølbak bruger det på mere overordnet plan 1/2;1246720716147474438;Kåre Mølbak
969;2020-04-05 07:48:07+00:00;“Kåre Mølbak er Mette Frederiksens corona-spåmand” er titlen - men det er ikke en særlig god overskrift - pointen er netop, at han er videnskabsmand. ;1246706166769627136;Kåre Mølbak
970;2020-04-05 06:34:36+00:00;Portræt af Kåre, i øjeblikket en mand m stor magt. Og det er derfor super m portræt. Men hvordan kan et seriøst medie skrive et så ensidigt spejder drenge jubel portræt? #dkpol #dkmedier Kåre Mølbak er Mette Frederiksens corona-spåmand https://www.altinget.dk/christiansborg/artikel/kaare-moelbak-er-mette-frederiksens-corona-spaamand#.Xol7GIobAME.twitter;1246687664562200576;Kåre Mølbak
971;2020-04-05 04:44:02+00:00;Nye artikler om Corona: - Kåre Mølbak er Mette Frederiksens corona-spåmand (Altinget) https://www.altinget.dk/artikel/kaare-moelbak-er-mette-frederiksens-corona-spaamand ----- - Anja raser over smittefaren på sygehus: 'Jeg er i chok' (BT) https://www.bt.dk/nyheder/anja-raser-over-smittefaren-paa-sygehus-jeg-er-i-chok -----;1246659840287690760;Kåre Mølbak
972;2020-04-05 04:35:05+00:00;»I og med at det ikke længere er muligt at inddæmme og bekæmpe virus, er målet med Sundhedsstyrelsens strategi og regeringens politik at hjælpe Danmark gennem denne epidemi, uden at sundhedsvæsenet og samfundet knækker over,« skriver Kåre Mølbak i mailen. https://ing.dk/artikel/kaare-moelbak-praeciserer-flokimmunitet-ikke-strategi-uundgaaelig-233871;1246657589699641346;Kåre Mølbak
973;2020-04-04 23:41:15+00:00;"Kåre Mølbak gav nu ellers et ret klart svar 1/4: ""målet med Sundhedsstyrelsens strategi og regeringens politik at hjælpe Danmark gennem denne epidemi, uden at sundhedsvæsenet og samfundet knækker over"" Flokiimunitet logisk endemål, men ikke vigtigt for nu. https://ing.dk/artikel/kaare-moelbak-praeciserer-flokimmunitet-ikke-strategi-uundgaaelig-233871";1246583641750339584;Kåre Mølbak
974;2020-04-04 19:37:40+00:00;Tjo.. som Kåre Mølbak, Corona Lone og alle mulige andre siger: flokimmunitet er ikke en strategi, men et uundgåeligt resultat af en smitsom sygdom.;1246522342018252806;Kåre Mølbak
975;2020-04-04 19:23:11+00:00;Undskyld, men den påstand, som @berlingske også fremturer med i dag, er lidt af en stråmand. Både Kåre Mølbak og @SSTbrostrom har tydeligt sagt, at strategien handler om at opnå flokimmunitet;1246518696425783299;Kåre Mølbak
976;2020-04-04 17:43:31+00:00;Så Kåre Mølbak, går altså ind for flok immunitet! Aha.... Så hvis 60 procent af befolkningen skal smittes, så lad os se på de afsluttede sager d.d. 11 procent døde af de afsluttede sager giver 363000 døde ialt når det er overstået??? ;1246493617029554176;Kåre Mølbak
977;2020-04-04 16:08:25+00:00;#Flokimmunitet koster mange tusinders liv ... STOP op #MetteFrederiksen og følg Sydkorea, Kina WHO TEST og opsporingsstrategien ... 2 danske internationale forskere er lodret uenige med #KåreMølbak Statens Serum Institut. Overført til Tyskland ville 220.000 tyskere dø ;1246469684473606144;Kåre Mølbak
978;2020-04-04 16:00:04+00:00;Den Korte Avis | Nu er Mette Frederiksen nødt til at tage stilling til det spørgsmål, der kan betyde liv eller død for tusindvis af danskere 10.000 danskere vil dø med kontroversiel #Flokimmunitet. #KåreMølbak det er kalkuleret kynisme uden evidens ;1246467583437668355;Kåre Mølbak
979;2020-04-04 12:15:51+00:00;...og Seruminstituttets Kåre Mølbak;1246411154521538560;Kåre Mølbak
980;2020-04-04 03:31:47+00:00;Derfor Kåre Mølbak anbefaler at gennemføre åbningstiltag med måneds mellemrum.;1246279269027807233;Kåre Mølbak
981;2020-04-03 20:34:13+00:00;Det ser desvære ud til, at der ingen forskel er på Anders Tegnell, Kåre Mølbak og tv-læge Geisling. Den hjernedøde flok immunitets strategi, som risikerer at koste 35.000 danskere livet. Målet bør i stedet være at så få som muligt smittes før en en vaccine foreligger.;1246174185480650754;Kåre Mølbak
982;2020-04-03 16:52:27+00:00;Hvis du ser i SSIs seneste prognose figur 7, så topper antal indlagte midt i juli, og kurven er først nede i november, hvor vi så vil frygte anden bølge. Så året er vel tabt, hvis man skal tro Kåre Mølbak. https://files.ssi.dk/Prognose%20for%20epidemiens%20fremtidige%20udvikling%2030032020;1246118375790698500;Kåre Mølbak
983;2020-04-03 14:57:08+00:00;"Kåre 'præciserer'. Mens Tyskland fremlægger præciserede scenarier, svarende til 15.000 døde DK. Hvornår præciserer regeringen? #dkpol #dkmedier Kåre Mølbak præciserer: Flokimmunitet er ikke en strategi – men den er uundgåelig https://ing.dk/artikel/kaare-moelbak-praeciserer-flokimmunitet-ikke-strategi-uundgaaelig-233871?utm_source=twitter&amp;utm_medium=social&amp;utm_content=social_bottom__20200403165350&amp;utm_campaign=socialbuttons via @@ingdk";1246089358073102339;Kåre Mølbak
984;2020-04-03 12:35:04+00:00;Det er bare ikke, hvad Kåre Mølbak og Seruminstituttet mener, jf. de links, jeg lægger frem i bloggen. Myndighedernes og regeringens syn på det er, at ligegyldig hvad skal 60 procent smittes. Det er den strategi, jeg i bloggen forholder mig til. Så ingen fejl :-);1246053606127788032;Kåre Mølbak
985;2020-04-02 21:30:37+00:00;Dagens epidemiindslag: For seks år siden talte vi om ebola i P1 Eksistens, Kåre Mølbak fra Statens seruminstitut, og jeg. http://www.filosoffen.dk/index.php?id=755;1245825992993705984;Kåre Mølbak
986;2020-04-02 19:42:27+00:00;Altså Kåre Mølbak tog ordet 'stikprøvekontrol' i sin mund på et pressemøde dagen før denne her udkom vist, og det er siden nævnt flere gange, ligesom praktisk talt samtlige medier lader til at have været sendt i byen med information om strategien ;1245798771885309952;Kåre Mølbak
987;2020-04-02 18:59:17+00:00;Virkeligheden behøver dog langt fra komme til at svare til det regnestykke. Man kan opbygge flokimmunitet langsommere. Det sænker antallet af smittede pr dag. Kåre Mølbak har sagt, det kan tage 3-4 år. Der er mange andre forbehold til regnestykket - men det er stadig interessant.;1245787909766217729;Kåre Mølbak
988;2020-04-02 16:10:17+00:00;Når man står i midten i en epidemi burde man lytte til så mange eksperter som muligt (samt se hvordan lande som Taiwan/Singapore Sydkorea har håndteret krisen) i stedet for at stole blindt på at Kåre Mølbak er det eneste sandhedsvidne/ekspert der ved hvad vi skal gøre.;1245745376310759425;Kåre Mølbak
989;2020-04-02 14:01:00+00:00;"""Der er meget langt op til den flokimmunitet, Seruminstituttets faglige direktør, Kåre Mølbak, ønsker sig"" Uffe Gardel følger udviklingen #16 [gratis!]: https://www.raeson.dk/2020/uffe-gardel-folger-udviklingen-16-vi-er-utroligt-langt-fra-at-opna-den-flokimmunitet-som-statens-serum-institut-saetter-sin-lid-til/ #dkpol #coronadk #covid19dk @uffegardel";1245712841727860736;Kåre Mølbak
990;2020-04-02 10:06:23+00:00;"Man må forstå, at Kåre Mølbak benægter at #covid-19 kan bekæmpes @ssi.dk. Det på et tidspunkt, hvor landene i Fjernøsten har vist, at det bekæmpelse er mulig. Lad os følge Tysklands eksempel og intensivere bekæmpelsen af covid-19! #dkpol https://ing.dk/artikel/kaare-moelbak-praeciserer-flokimmunitet-ikke-strategi-uundgaaelig-233871?utm_source=twitter&amp;utm_medium=social&amp;utm_content=social_top__20200402115843&amp;utm_campaign=socialbuttons via @@ingdk";1245653800884436993;Kåre Mølbak
991;2018-11-15 11:49:50+00:00;They could have been so much more.;1063036348603527168;Kåre Mølbak
992;2020-04-02 08:42:56+00:00;Kåre Mølbak mener, at WHO, Kina, Sydkorea, Tyskland, UK og USA tager fejl, når de har den ambition, at covid19 skal slås ned med så få ofre som muligt. Og som dansk rådgiver skal han jo nok sørge for, at vi ikke gør det samme. Han minder om Dr. Strangelove https://ing.dk/artikel/kaare-moelbak-praeciserer-flokimmunitet-ikke-strategi-uundgaaelig-233871;1245632799870078979;Kåre Mølbak
993;2020-04-02 08:22:40+00:00;Godt du er ved at være igennem. Og ham Kåre Mølbak - også kaldet Dr. Strangelove - mener, at vi ikke skal kæmpe for at slå det ned.;1245627697453125640;Kåre Mølbak
994;2020-04-02 05:53:05+00:00;De positive effekter er primært reddede liv som følge af mindre pres på sundhedssektoren. Ifølge Kåre Mølbak er de positive effekter af, at færre bliver smittet, små (eller helt fraværende).;1245590052081512449;Kåre Mølbak
995;2020-04-01 18:50:32+00:00;gerne.Mølbak fremstiller du som useriøs, og har fået ansvaret og nu handler stærkt uansvarlig, det er jo ikke rigtigt. Men meningsdanmark, vi ved hvad der er det rigtige. I sidste ende er det politiske beslutninger, Kåre Mølbak har ingen magt, politikerne handler ud fra hans råd.;1245423316791427072;Kåre Mølbak
996;2020-04-01 18:08:41+00:00;Har i dag læst et interview med Kåre Mølbak i Ingeniøren, hvor han siger noget lidt andet. Læs det evt. selv.;1245412787670704136;Kåre Mølbak
997;2020-04-01 17:51:28+00:00;Kåre Mølbak præciserer: Flokimmunitet er ikke en strategi – men den er uundgåelig ;1245408453025320960;Kåre Mølbak
998;2020-04-01 17:39:20+00:00;»Han gør det jo yderst klart, at han simpelthen ikke har forstået, hvad der foregår,« siger forsker Kristian G. Andersen fra Scripps Research i USA om SSIs Kåre Mølbak og hans morbide idé om flokimmunitet ;1245405401887227905;Kåre Mølbak
999;2020-04-01 16:21:32+00:00;Kåre Mølbak præciserer: Flokimmunitet er ikke en strategi – men den er uundgåelig https://ing.dk/233871;1245385819717693441;Kåre Mølbak
1000;2020-04-01 16:20:10+00:00;Selv om Tyskland nu også vil nedkæmpe covid-19, som det er sket i blandt andet Sydkorea, står SSI fast på, at det ikke er realistisk. Men Kåre Mølbak understreger også, at flokimmunitet ikke er en dansk strategi - bare uundgåelig #COVID19dk #COVID2019dk https://ing.dk/artikel/kaare-moelbak-praeciserer-flokimmunitet-ikke-strategi-uundgaaelig-233871;1245385477101948930;Kåre Mølbak
1001;2020-03-31 13:44:19+00:00;Det er Kåre Mølbak ikke helt enig med dig i. Fra interviewet i Politiken. ;1244983866521157632;Kåre Mølbak
1002;2020-03-31 10:41:11+00:00;@MartinCEPOS Jeg håber i læser disse ord fra Kåre Mølbak grundigt før i nu fortsætter jeres full-court press for at få åbnet økonomien snarest muligt Martin. #dkpol #coronadk @JonasHerby @venstredk;1244937779634675713;Kåre Mølbak
1003;2020-03-31 09:07:02+00:00;Det er ikke et kønt syn at se Søren Brostrøm og Kåre Mølbak nyklippet..;1244914087361994752;Kåre Mølbak
1004;2020-03-31 06:47:22+00:00;Kåre Mølbak giver ellers ret klart udtryk for, at de har en plan. Og selvom man lærer nyt om corona, så er det jo en epidemi, der matematisk er som alle andre. Så selvfølgelig kan de modellere den og give kvalificerede bud på gode strategier...;1244878940772106241;Kåre Mølbak
1005;2020-03-31 06:16:27+00:00;"Så du kan heller ikke finde hoved og hale i, hvad myndighedernes strategi er? Læs: ""En stor del af befolkningen skal smittes med covid-19 under den første bølge af epidemien for at undgå, at næste bølge slår for hårdt."", siger Kåre Mølbak fra SSI. ";1244871156957667330;Kåre Mølbak
1006;2019-01-01 14:47:18+00:00; Form Experience Potential Here's the top 50 players under the age of 23 in world football.;1080113238535294976;Kåre Mølbak
1007;2020-03-30 19:56:32+00:00;Uden at gå Søren Brostrøm og Kåre Mølbak i bedene, så handler det vel også om befolkningstæthed. Sverige har dobbelt så mange indbyggere og 10 gange så meget plads. Der er flest smittede i København/Stockholm - også korrigeret for indbyggertal.;1244715153612038146;Kåre Mølbak
1008;2020-03-30 16:31:48+00:00;CORONAVIRUS. Hvis vi i stedet fjerner alle corona-tiltag på én gang efter påske, vil vi opleve en eksplosiv udvikling i epidemien, som man har set de i f.eks. Italien og Spanien, sagde Kåre Mølbak på pressemødet #SSI #Coronavirus #COVID19dk #Sundhed #dkpol #sundpol #dkmedier;1244663627065499656;Kåre Mølbak
1009;2020-03-30 16:25:07+00:00;CORONAVIRUS. SSI's faglige direktør Kåre Mølbak var ikke i tvivl om, at den positive udvikling i coronavirus-epidemien herhjemme skyldes, at der blev reageret tidligt med omfattende tiltag #SSI #Coronavirus #COVID19dk #Sundhed #Danmark #dkpol #sundpol #dkmedier;1244661946256887808;Kåre Mølbak
