;date;text;id;key
0;2020-08-22 09:14:10+00:00;"@SrenKVillemoes Kåre Mølbak... Er den du ska angribe og MF..KM var en ynk.. Komme m uvidensk oplysn.. Ukompetent.. Hans ""tal"" er da for længst kasseret i Sv o N.. Men han fortsætter.. Havde MF trukket vejret.. Så var kurven f nedadgående. D Sv strategi, har jo bevist sin ret..";1297099733618622464;Kåre Mølbak
1;2020-08-19 21:24:09+00:00;Det är Kåre Mølbak som har varit frontfigur för Statens Serum Institut : https://www.ssi.dk/om-ssi/kontakt/medarbejdere/k/kaare-moelbak-krm;1296196278708244480;Kåre Mølbak
2;2020-08-18 18:51:47+00:00;»Den vigtigste forklaring ligger helt klart i, at der bliver testet så meget. Det betyder, at vi finder rigtig mange milde tilfælde,« siger Kåre Mølbak. https://www.berlingske.dk/samfund/derfor-indlaegges-faerre-med-covid-19-paa-landets-sygehuse-trods-mange #dkpol #dkmedier #covid19dk #coronadk;1295795545290739712;Kåre Mølbak
3;2020-08-15 14:34:32+00:00;Mette har aldrig lagt skjul på at regeringen tog en politisk beslutning, efter at have lyttet til div. myndigheder og ikke kun til en gynækolog fra SSI. Kåre Mølbak bl.a. bakkede op om nedlukning.;1294643642074882050;Kåre Mølbak
4;2020-08-15 12:27:53+00:00;Jeg har et vigtigt spørgsmål: hvor var Kåre Mølbak til dagens pressemøde? Jeg føler ikke jeg har opbygget samme tillid til Thyra endnu...;1294611771936968705;Kåre Mølbak
5;2020-08-15 11:43:03+00:00;"Statens Serum Institut glemte at fortælle: Biologisk materiale med DNA fra Corona-test gemmes til efter din død https://www.version2.dk/artikel/statens-serum-institut-glemte-at-fortaelle-biologisk-materiale-med-dna-corona-test-gemmes?utm_source=twitter&amp;utm_medium=social&amp;utm_content=social_top__20200815134016&amp;utm_campaign=socialbuttons via @@version2dk . #COVID19,#SSI,#KåreMølbak,#DKNationaleBiobank,#gemmes10år,#glemtinfo, #ThomasPloug,#biologiskmateriale, #sundhed,#coronadk";1294600487652728835;Kåre Mølbak
6;2020-08-15 08:06:12+00:00;Og spændende hvor kritiske (eller ukritiske) journalisterne er ift. formål, strategi og det aktuelle pres på sundhedsvæsenet. Der er pt. 0 (og det var nul) respiratorer i brug i hele landet, men Kåre Mølbak fortsætter med at køre sit eget paranoia-regime, hvilket Soc.Dem. elsker.;1294545916276473857;Kåre Mølbak
7;2019-01-01 13:22:53+00:00;Not all of these wonderkids turned out to be 'the next superstar' ;1080091997111812097;Kåre Mølbak
8;2020-08-15 06:51:11+00:00;Fin stråmand hvad er dine faglige kvalifikationer? Hun fulgte ikke Søren Brostrøms anbefaling, men derfor kan der jo godt have været andre eksperter der anbefalede det hun gjorde fx Kåre Mølbak;1294527036904673281;Kåre Mølbak
9;2020-08-14 17:01:34+00:00;Det du mener er vel om hun lænede sig mest op af @SSTbrostrom eller @SSI_dk og Kåre Mølbak. Hun valgte sidstnævnte uden navns nævnelse og uden at spille de to ud mod hinanden. Det var faktisk et særdeles klogt træk af Mette F. @Spolitik #dkpol #dkmedier #etikpolitik;1294318257931988992;Kåre Mølbak
10;2020-08-14 12:37:56+00:00;Brostrøm lavede de samme vurderinger som Stegnell i Sv.. I dk der jagter i dygtige mennesker.. Till de dør.. Men Kåre Mølbak.. Den sladretaske.. Han er go. Thomas Larsen vurderer forkert.. Det er MFs inkompetance o mgl på at forstå evidens.. MS vil ha sladder og valgpropaganda.;1294251910556520448;Kåre Mølbak
11;2020-08-13 17:02:53+00:00;@Martin_Geertsen @berlingske lukket munden på Kåre Mølbak og find ud af hvem der får ham til at gå i mediet....;1293956202427285506;Kåre Mølbak
12;2020-08-12 07:44:50+00:00;Det vidste jeg godt du ville sige, men her er jeg altså mere enig med Kåre Mølbak end med dig Stella ;1293453375518973953;Kåre Mølbak
13;2020-08-11 19:40:35+00:00;Kontakttallet på 1,4 som Kaare Mølbak rapporterede i går, var for første gang baseret på antal smittede! Tidligere har kontakttallet været baseret på antal indlagte, og dette tal var 1,1 i går. Usikkerheden på sidstnævnte er stor, men den første kan være biased! #COVID19dk #dkpol;1293271113334755330;Kåre Mølbak
14;2020-08-11 11:48:01+00:00;Coronapandemien slutter først med en vaccine, siger Kåre Mølbak, http://tv2.dk:;1293152188110442497;Kåre Mølbak
15;2020-08-11 11:48:01+00:00;Coronapandemien slutter først med en vaccine, siger Kåre Mølbak, http://tv2.dk: https://nyheder.tv2.dk/samfund/2020-08-10-coronapandemien-slutter-foerst-med-en-vaccine-siger-kaare-moelbak;1293152186810142723;Kåre Mølbak
16;2020-08-11 11:27:08+00:00;#dkmedier #dkpol #COVID19dk I øvrigt så er pandemien slut ifølge Kåre Mølbak https://nyheder.tv2.dk/udland/2020-08-11-rusland-klar-med-vaccine-siger-putin-datter-er-vaccineret https://nyheder.tv2.dk/samfund/2020-08-10-coronapandemien-slutter-foerst-med-en-vaccine-siger-kaare-moelbak;1293146932802498560;Kåre Mølbak
17;2020-08-10 20:34:11+00:00;Covid-19 “Jeg forventer, vi kan holde smitten i arve og nede, så vi kan komme igennem det her efterår og vinteren. Og inde i 2021 får vi så en vaccine, siger Kåre Mølbak.” SÅ ER DET SAGT. Men er det virkelig det vi som danskere ønsker at gå efter ? AT DETTE MÅL HELLIGER MIDLET.;1292922213369360385;Kåre Mølbak
18;2020-08-10 16:47:33+00:00;Coronapandemien slutter først med en vaccine, siger Kåre Mølbak http://nyheder.tv2.dk/samfund/2020-08-10-coronapandemien-slutter-foerst-med-en-vaccine-siger-kaare-moelbak?cid=_soco%3Atw%3A4%3Anews%3A%3A%3A;1292865180108386304;Kåre Mølbak
19;2020-08-10 07:52:37+00:00;Nej... Det er fejl melding fra Kåre Mølbak.. Det handler om at bevare fornuften.. Heunicke og MF, KM og DK medier optræder helt uansvarligt.. De fører Dk lige i grøften...;1292730559291162628;Kåre Mølbak
20;2020-08-10 07:48:03+00:00;Det var da godt i kan begynde at tale sandt... Kåre Mølbak er jo inkompetent.. Siger det MF vil ha.. Det er nemlig ikke antal smittede, men antal indlagte der tæller... Øgning af test skal jo også oplyses.. Det er utroligt at SSI har accep KM fejlagtige sladder udmelding...;1292729410542546944;Kåre Mølbak
21;2020-08-09 20:40:29+00:00;Kåre Mølbak er DK’s bedste mand til at fremme brugen af vacciner. Generelt udtaler han sig kun om helt specifikke positive effekter af vacciner (nedsat udbredelse af visse infektionssygdomme), men udtaler sig aldrig om den uvidenhed vi har om langtidseffekterne af vaccinerne.;1292561412368347136;Kåre Mølbak
22;2020-08-09 16:01:36+00:00;Nej hun er direkte inkompetent. Se hende i Folketingssalen.Det er ynkeligt.. Hun taler til Dks svage. Og omgiver sig m Svage ministre.. Det konstitueret hendes magt. Kontrol.. Kåre Mølbak er hendes skødehund. Hans tal er ynkelig. Dem har vi skrottet f længst i Sv.. Dk styres ikke;1292491225891774469;Kåre Mølbak
23;2020-08-09 10:11:39+00:00;Faktuelt er der styr på Coronaen, fordi regeringen greb resolut ind efter bl.a anbefalinger fra Kåre Mølbak og ikke omvendt . Vi er dog stadig udfordret, men mest fordi de borgerlige partier og en enkelt ihærdig chefredaktør har været fortaler for at få åbnet alt op siden april.;1292403159332200450;Kåre Mølbak
24;2020-08-09 06:10:36+00:00;@JesperBeinov tal ud fra FAKTA, evidens.. MF er en Sladre mask.. Kåre Mølbak også.. Hans tal har vi da skrottet f længst i Sv.. Accepter ham ikke. Han er medløber f S.. Det d tæller er antal nye indl, og på Int.. Døde. Og der sker ingenting jo.. Snak m Stegnell, han er flink..;1292342496870256640;Kåre Mølbak
25;2020-08-08 18:51:33+00:00;@Blixt22 gå på MF... Hun vil gøre det igen igen.. Angrib Kåre Mølbak.. Hans tal er ren opspind. SNAK m Sv exp.. De tal er skrottet for længst.Du ka få det tal du ønsker.. Og MF bruger KM som sladre chatol.. Brostrøm er den rigtige. Gi ham tid at forkl på press k.Han får ikke lov;1292171607096659980;Kåre Mølbak
26;2020-08-08 14:38:22+00:00;B.T. mener: Nu ingen panik. Jeg vil til enhver tid have langt mere tillid til Kåre Mølbak og regeringen, end til alle de blå #dkmedier Der bare vil åbne hovedløst op, for så meget som muligt. #COVID19 #dkpol;1292107893106515970;Kåre Mølbak
27;2020-08-08 13:38:10+00:00;Tak, BT @btdk for at rette et kritisk blik på Kaare Mølbak. Den mand har været en katastrofe for Danmark. #dkpol P.S. Tillykke med @QvortrupHenrik !;1292092743007776768;Kåre Mølbak
28;2019-01-01 14:47:18+00:00; Form Experience Potential Here's the top 50 players under the age of 23 in world football.;1080113238535294976;Kåre Mølbak
29;2020-08-08 11:40:02+00:00;Kåre Mølbak: Nu er der større risiko for, at coronavirus spredes, http://tv2.dk:;1292063013080629254;Kåre Mølbak
30;2020-08-08 11:40:02+00:00;Kåre Mølbak: Nu er der større risiko for, at coronavirus spredes, http://tv2.dk: https://nyheder.tv2.dk/2020-08-07-kaare-moelbak-nu-er-der-stoerre-risiko-for-at-coronavirus-spredes;1292063011738456064;Kåre Mølbak
31;2020-08-08 10:52:26+00:00;"Hold nu afstand, vask hænder og sprit af! Pas på hinanden. “Og der er grund til at være bekymret og grund til at agere, fordi virussen lige nu ""bobler"" i det danske samfund.” Sådan lyder det fra Kåre Mølbak, faglig direktør på Statens Serum Institut, på et pressemøde fredag.";1292051033741565954;Kåre Mølbak
32;2020-08-08 07:24:32+00:00;Kåre Mølbak: Nu er der større risiko for, at coronavirus spredes http://dlvr.it/RdDsK3;1291998716421763072;Kåre Mølbak
33;2020-08-07 20:34:22+00:00;Efter Kåre Mølbak sagde, at en anden bølge er usandsynlig, siger han nu, at der er større risiko for spredning end inden vi lukkede landet ned https://nyheder.tv2.dk/2020-08-07-kaare-moelbak-nu-er-der-stoerre-risiko-for-at-corona-spredes-end-da-danmark-lukkede-ned;1291835094169157635;Kåre Mølbak
34;2020-08-07 20:30:05+00:00;Kåre Mølbak: Nu er der større risiko for at corona spredes, end da Danmark lukkede ned http://nyheder.tv2.dk/2020-08-07-kaare-moelbak-nu-er-der-stoerre-risiko-for-at-corona-spredes-end-da-danmark-lukkede-ned?cid=_soco%3Atw%3A4%3Anews%3A%3A%3A;1291834016316915719;Kåre Mølbak
35;2020-08-07 16:29:21+00:00;Du regner med, at Kåre Mølbak partiet snart overhaler Veganerpartiet i antal indsamlede vælgererklæringer? Hvem ved, sværere ting er formodentlig sket. Og vi ER jo i 2020. ;1291773433655824384;Kåre Mølbak
36;2020-08-07 16:22:21+00:00;Danskere falder i med begge ben for Kåre Mølbak tal.. Dem har vi skrottet for længst i Norge, Sverige... VÅGN OP Danmark...;1291771674338177025;Kåre Mølbak
37;2020-08-07 07:57:47+00:00;“Kåre Mølbak-isme”?... synes, at vi skal stoppe denne Magnus Barsøe-isme og gå efter bolden og ikke manden ;1291644694426984448;Kåre Mølbak
38;2020-08-07 07:00:23+00:00;"Men måske som måleenhed? Som i ""det der, det var to en halv Kåre Mølbak, og fire for den tekniske udførelse.";1291630249344749569;Kåre Mølbak
39;2020-08-07 06:00:32+00:00;"Jeg tror ikke begrebet ""Kåre Mølbak-isme"" nogensinde slår bredt gennem, hverken som journalistisk term eller som betegnelse for en politisk ideologi. ";1291615186139467776;Kåre Mølbak
40;2020-08-06 10:48:22+00:00;Stop Kåre Mølbak-ismen. Ideen om at smittetal er det eneste, der tæller, er absurd. Ja, klart, vi skal bekæmpe virus. Og ja, nedlukningen var klog. Men galskaben må stoppe. Vi skal finde en måde at genåbne livet og bekæmpe virus. Samtidig. #dkpol;1291325234751115264;Kåre Mølbak
41;2020-08-06 06:24:41+00:00;Regeringen vil lytte til Kåre Mølbak: Store dele af fase fire-genåbning hænger i tynd tråd https://jp.dk/d?id=12321476. Hvor er kommentaren fra corona-bezzerwizzerne @pomaEB og @QvortrupHenrik? Eller er de stadig på mandagstræner-holdet?;1291258879645552640;Kåre Mølbak
42;2020-08-06 06:16:48+00:00;@Martin_Geertsen Kåre Mølbak burde fyres.. Kommer m sin sladder uden at snakke m NOGEN.SSI er et laboratorium f beredskab. Det er helt uhørt..SST er eviden.. Dk testudstyr gir falsk pos. Skr de i Norge.. Folk blir ISO unødv. I DK.har en overlæge ven, siger det samme.. 40-50%fejl;1291256892531126273;Kåre Mølbak
43;2020-08-06 06:11:46+00:00;@Blixt22 Kåre Mølbak burde fyres.. Han forvirrer m sit sladder.. Snakker ingen med.. SSI er et laboratorium f beredskab§222.. Få jeres begreber i orden.. Og DK test udstyr er så ringe det gir falsk pos.. Norge skriver om det..;1291255628434989056;Kåre Mølbak
44;2020-08-05 14:36:50+00:00;Søren Brostrøm har ikke taget andet end fejl igennem hele forløbet. Han er da også gynækolog og dermed er hans fagområde slet ikke i nærheden af respiratoriske / kredsløbs-sygdomme. Kåre Mølbak er derimod subject matter expert.;1291020342337646597;Kåre Mølbak
45;2020-08-05 14:23:37+00:00;Kåre Mølbak er en mand med en mission. Statens Serum Institut har en vaccine, de gerne vil sælge snart. Og hvis frygtniveauet falder, er der måske ingen, der vil købe.;1291017016644706304;Kåre Mølbak
46;2020-08-05 08:42:15+00:00;@KareMolbak TAK Kåre Mølbak fordi du passer dit job og offentligt har udtalt din bekymring if m stigende smitte i DK - uden at spørge regeringen om lov først..- !!!!!;1290931109270884353;Kåre Mølbak
47;2020-08-05 08:04:05+00:00;Hvem har øverste ansvar i DK.. Det føles som ren forvirring i DK...I forhold til måden d Sv befolk vejleders.. Kåre Mølbak der udtaler sig uden evidens... GÅ dog på press m. Så vi klart ved hvem der samarb...;1290921505157722115;Kåre Mølbak
48;2020-08-04 18:02:10+00:00;Temmelig uprofessionel måde Kåre Mølbak vælger at meddele sig på.;1290709629253693440;Kåre Mølbak
49;2018-11-15 11:49:50+00:00;They could have been so much more.;1063036348603527168;Kåre Mølbak
50;2020-08-04 17:35:20+00:00;@DRNyheder 18:30 @venstredk s #COVID19 fyrtårn @Martin_Geertsen er i tvivl om, hvorvidt Kaare Mølbak udtaler sig som Privat Kaare eller @SSI_dk Kaare. Derfor har partiet ingen holdning pt til ikke at lukke yderligere op. Virker bekendt et eller andet sted ift @venstredk #dkpol;1290702877728616448;Kåre Mølbak
51;2020-08-04 17:04:03+00:00;Regeringen vil lytte til Kåre Mølbak: Store dele af fase fire-genåbning hænger i tynd tråd http://dlvr.it/Rd03bk;1290695004155830272;Kåre Mølbak
52;2020-08-04 17:04:03+00:00;Regeringen vil lytte til Kåre Mølbak: Store dele af fase fire-genåbning hænger i tynd tråd http://dlvr.it/Rd03Yk;1290695002201288706;Kåre Mølbak
53;2020-08-04 16:32:17+00:00;Kåre Mølbak: Genåbningen bør sættes i bero ;1290687010290663425;Kåre Mølbak
54;2020-08-04 16:06:08+00:00;Det er da fulgt forståeligt ovenpå denne udmelding som Kåre Mølbak pludselig spontant kommer med, før end forhandlingen om fase 4. overhovedet er påbegyndt #dkpol #dkmedier;1290680426533654530;Kåre Mølbak
55;2020-08-04 16:03:41+00:00;Efter stigende smittetryk og udmelding fra Kåre Mølbak vil borgerlige partier have regeringen til forhandlingsbordet nu. @venstredk og @DanskDf1995 opfordrer @Spolitik til at fremrykke de politiske møder om genåbningens fase 4. #dkpol #COVID19dk;1290679813070561280;Kåre Mølbak
56;2020-08-04 15:32:11+00:00;Kåre Mølbak: Genåbningen bør sættes i bero https://politiken.dk/forbrugogliv/sundhedogmotion/art7876205/K%C3%A5re-M%C3%B8lbak-Gen%C3%A5bningen-b%C3%B8r-s%C3%A6ttes-i-bero;1290671885412442113;Kåre Mølbak
57;2020-08-04 14:57:52+00:00;SSI-direktør Kåre Mølbak anbefaler, at genåbning af samfundet sættes på pause efter stigende smittetilfælde #btdk;1290663248170299392;Kåre Mølbak
58;2020-08-04 14:20:20+00:00;Som forudsagt af @peterfalktoft . Kåre Mølbak om genåbningens fase fire: Jeg kan ikke anbefale den sundhedsfagligt ;1290653803235217408;Kåre Mølbak
59;2020-08-04 14:00:06+00:00;"Kåre Mølbak om genåbningens fase fire: Jeg kan ikke anbefale den sundhedsfagligt https://www.reddit.com/r/Denmark/comments/i3iflz/k&#xE5;re_m&#xF8;lbak_om_gen&#xE5;bningens_fase_fire_jeg_kan/ - Via /r/Denmark #Denmark #dknews";1290648711006216194;Kåre Mølbak
60;2020-08-04 13:46:05+00:00;Kåre Mølbak melder til fagbladet Ingeniøren konkret ud. Han kan ikke anbefale en yderligere genåbning af Danmark. ;1290645184481435648;Kåre Mølbak
61;2020-08-04 13:36:08+00:00;Kåre Mølbak om genåbningens fase fire: Jeg kan ikke anbefale den sundhedsfagligt ;1290642678951141377;Kåre Mølbak
62;2020-08-04 13:29:08+00:00;Kåre Mølbak kan ikke anbefale fase 4 af genåbning ;1290640918136193024;Kåre Mølbak
63;2020-08-04 13:28:09+00:00;Kåre Mølbak rådgiver jo ikke dig og mig, men regeringen. Han kan sådan set ikke bestemme noget som helst. Men nu har han meldt ud, mens vi venter på @Heunicke kommer i sadlen igen og fortæller os, hvad han tror og tænker. Vi ved jo @spolitik ikke lytter til sundhedsmyndigheder.;1290640671796269056;Kåre Mølbak
64;2020-08-04 13:27:28+00:00;Kåre Mølbak om genåbningens fase fire: Jeg kan ikke anbefale den sundhedsfagligt ;1290640496914833411;Kåre Mølbak
65;2020-08-04 13:24:19+00:00;Kåre Mølbak kan ikke anbefale fase 4 af genåbning ;1290639703990050818;Kåre Mølbak
66;2020-08-04 13:20:33+00:00;Kåre Mølbak til politikerne: Lad være med at genåbne samfundet mere http://dlvr.it/RczJMM;1290638758732210177;Kåre Mølbak
67;2020-08-04 13:20:21+00:00;Kåre Mølbak kan ikke anbefale fase 4 af genåbning https://ift.tt/2PjUrwy #sydfyn #fynsamtsavis;1290638707633131522;Kåre Mølbak
68;2020-08-04 13:15:03+00:00;Kåre Mølbak til politikerne: Lad være med at genåbne samfundet mere http://dlvr.it/RczHBb;1290637373747806208;Kåre Mølbak
69;2020-08-04 13:08:55+00:00;Kåre Mølbak: Genåbningen bør sættes i bero ;1290635831594618881;Kåre Mølbak
70;2019-01-01 14:47:18+00:00; Form Experience Potential Here's the top 50 players under the age of 23 in world football.;1080113238535294976;Kåre Mølbak
71;2020-08-04 13:08:10+00:00;Kåre Mølbak kan ikke anbefale fjerde fase af genåbningen https://www.tv2lorry.dk/tv2dk/kaare-moelbak-kan-ikke-anbefale-fjerde-fase-af-genaabningen;1290635640380563457;Kåre Mølbak
72;2020-08-04 13:07:14+00:00;Kåre Mølbak kan ikke anbefale fase 4 af genåbning https://ift.tt/31gPOJc;1290635408225771526;Kåre Mølbak
73;2020-08-04 13:04:19+00:00;Kåre Mølbak kan ikke anbefale fase 4 af genåbning https://ift.tt/39SECGq;1290634673685757952;Kåre Mølbak
74;2020-08-04 12:58:01+00:00;Er der de her tal som er årsagen til at vi ikke kan gå ind i fase 4? Gad vide hvilke tal Kåre Mølbak kigger på ;1290633087123169286;Kåre Mølbak
75;2020-08-04 12:55:05+00:00;Kåre Mølbak kan ikke anbefale fase 4 af genåbning https://ift.tt/39YKCNV;1290632348535525376;Kåre Mølbak
76;2020-08-04 12:54:17+00:00;Kåre Mølbak kan ikke anbefale fase 4 af genåbning https://ift.tt/3ka1mX8;1290632147250884608;Kåre Mølbak
77;2020-08-04 12:53:37+00:00;"Hmm. Kåre Mølbak om genåbningens fase fire: Jeg kan ikke anbefale den sundhedsfagligt https://ing.dk/artikel/kaare-moelbak-genaabningens-fase-fire-jeg-kan-ikke-anbefale-sundhedsfagligt-237351?utm_source=twitter&amp;utm_medium=social&amp;utm_content=social_top__20200804145253&amp;utm_campaign=socialbuttons via @@ingdk";1290631978795008001;Kåre Mølbak
78;2020-08-04 12:46:52+00:00;Deep State Alert! Kåre Mølbak anbefaler at standse genåbningen af Danmark ;1290630279879708672;Kåre Mølbak
79;2020-08-04 12:45:27+00:00;Hvorfor har Kåre Mølbak endnu ikke fået mundkurv på? https://ing.dk/artikel/kaare-moelbak-genaabningens-fase-fire-jeg-kan-ikke-anbefale-sundhedsfagligt-237351;1290629925549101056;Kåre Mølbak
80;2020-08-04 12:44:12+00:00;Kåre Mølbak kan ikke anbefale fase 4 af genåbning https://ift.tt/3i3jSPa;1290629608497389569;Kåre Mølbak
81;2020-08-04 12:44:07+00:00;Kåre Mølbak kan ikke anbefale fase 4 af genåbning https://ift.tt/3gshMYP #fyensdk #fyn;1290629587962036227;Kåre Mølbak
82;2020-08-04 12:42:45+00:00;De blå Corona generaler. Venstre (Martin Geertsen) vil have mere genåbnet. Jeg hylder forsigtighedsprincippet, lad os vente. Kåre Mølbak anbefaler at standse genåbningen af Danmark ;1290629246822551552;Kåre Mølbak
83;2020-08-04 12:42:12+00:00;Sådan Kåre Mølbak: Genåbningen skal sættes i bero - http://politiken.dk https://politiken.dk/forbrugogliv/sundhedogmotion/art7876205/K%C3%A5re-M%C3%B8lbak-Gen%C3%A5bningen-skal-s%C3%A6ttes-i-bero;1290629105730428928;Kåre Mølbak
84;2020-08-04 12:41:09+00:00;Kåre Mølbak kan ikke anbefale fase 4 af genåbning ;1290628841573167104;Kåre Mølbak
85;2020-08-04 12:39:03+00:00;Kåre Mølbak er kontinuerligt ude af kontrol... Det ved ALLE! FAKTUM! YES, SIR!;1290628315129303040;Kåre Mølbak
86;2020-08-04 12:38:19+00:00;Genåbningens fase 4 kan ikke sundhedsfagligt anbefales, lyder det fra Kåre Mølbak. Hr. Mølbak er en myndighed (ikke!!), altså anbefaler myndighederne lige nu at vi IKKE (gen)åbner mere i Danmark. #nutagerviossammen;1290628129346727937;Kåre Mølbak
87;2020-08-04 12:37:33+00:00;Kåre Mølbak anbefaler at standse genåbningen af Danmark http://nyheder.tv2.dk/samfund/2020-08-04-kaare-moelbak-anbefaler-at-standse-genaabningen-af-danmark?cid=_soco%3Atw%3A4%3Anews%3A%3A%3A;1290627936127561729;Kåre Mølbak
88;2020-08-04 12:36:06+00:00;Kåre Mølbak kan »ikke sundhedsfagligt anbefale« at genåbne samfundet mere http://dlvr.it/Rcz8Bd;1290627570703056896;Kåre Mølbak
89;2020-08-04 12:30:03+00:00;Kåre Mølbak kan »ikke sundhedsfagligt anbefale« at genåbne samfundet mere http://dlvr.it/Rcz746;1290626049638723584;Kåre Mølbak
90;2020-08-04 12:28:47+00:00;Kåre Mølbak anbefaler at standse genåbningen af Danmark.. Enig - ikke brug for at diskoteker og natklubber bidrager yderligere lige foreløbig! #covid19dk #dkpol;1290625731664510979;Kåre Mølbak
91;2018-11-15 11:49:50+00:00;They could have been so much more.;1063036348603527168;Kåre Mølbak
92;2020-08-04 12:28:47+00:00;of så lytter I sgu @dkpol Kåre Mølbak anbefaler at standse genåbningen af Danmark ;1290625729458208770;Kåre Mølbak
93;2020-08-04 12:27:54+00:00;Kåre Mølbak siger nu til @ingdk, at han ikke kan anbefale, at man går videre med fase 4. Det tæller hovedsageligt nattelivet og uddannelsestilbud under uddannelses- og forskningsministeriet. #dkpol #dkmedier;1290625509525803008;Kåre Mølbak
94;2020-08-04 12:26:46+00:00;Kåre Mølbak anbefaler at standse genåbningen af Danmark: ;1290625221460922373;Kåre Mølbak
95;2020-08-04 12:22:04+00:00;Kåre Mølbak: Jeg kan ikke anbefale fase fire sundhedsfagligt:;1290624040097505281;Kåre Mølbak
96;2020-08-04 12:08:32+00:00;Kåre Mølbak om genåbningens fase fire: Jeg kan ikke anbefale den sundhedsfagligt https://ing.dk/237351;1290620634335076352;Kåre Mølbak
97;2020-08-04 12:03:45+00:00;Nu slår Kåre Mølbak hånden af genåbningens fase fire. Sundhedsfagligt kan han ikke anbefale den, siger han til Ingeniøren. #COVID19dk https://ing.dk/artikel/kaare-moelbak-genaabningens-fase-fire-jeg-kan-ikke-anbefale-sundhedsfagligt-237351;1290619429806645253;Kåre Mølbak
98;2020-08-04 11:52:51+00:00;Epidemien kan komme ud af kontrol: Kåre Mølbak er bekymret over udviklingen ;1290616687369297921;Kåre Mølbak
99;2020-08-04 09:05:38+00:00;Epidemien kan komme ud af kontrol: Kåre Mølbak er bekymret over udviklingen https://www.dr.dk/nyheder/indland/epidemien-kan-komme-ud-af-kontrol-kaare-moelbak-er-bekymret-over-udviklingen;1290574605971841024;Kåre Mølbak
100;2020-08-04 08:16:00+00:00;- Går man i supermarkedet, er det vigtigt at holde to meters afstand til næste kunde, når man står ved kassen. Sprit af, når I går ind, sprit af, når I går ud, sprit af, når I har betalt og har trykket på et tastatur. - Så husk de regler, for jeg ved, at I kan, siger Kåre Mølbak;1290562117414813697;Kåre Mølbak
101;2020-08-04 07:43:30+00:00;Kære Kåre Mølbak. Det er ikke underligt, at der er stor udvikling i corona,en. Som jeg oplever det, er rigtig, rigtig mange ligeglade med afstand og afspritning. Synd at det ikke blev gjort som pligt at bære mundbind i offentlige transport. Folk kan bare ikke finde ud af det.;1290553938530492417;Kåre Mølbak
102;2020-08-04 03:18:34+00:00;Epidemien kan komme ud af kontrol: Kåre Mølbak er bekymret over udviklingen https://www.dr.dk/nyheder/indland/epidemien-kan-komme-ud-af-kontrol-kaare-moelbak-er-bekymret-over-udviklingen;1290487265437732864;Kåre Mølbak
103;2020-08-04 03:17:57+00:00;Epidemien kan komme ud af kontrol: Kåre Mølbak er bekymret over udviklingen https://www.dr.dk/nyheder/indland/epidemien-kan-komme-ud-af-kontrol-kaare-moelbak-er-bekymret-over-udviklingen;1290487109032189955;Kåre Mølbak
104;2020-08-04 00:21:11+00:00;#dkpol - Epidemien kan komme ud af kontrol: Kåre Mølbak er bekymret over udviklingen | Indland | DR https://www.dr.dk/nyheder/indland/epidemien-kan-komme-ud-af-kontrol-kaare-moelbak-er-bekymret-over-udviklingen, see more http://tweetedtimes.com/ProvoDk?s=tnp;1290442622356652035;Kåre Mølbak
105;2020-08-03 21:20:15+00:00;Hvad er det for et ærinde Kåre Mølbak går med sin ufaglice sladder agtig småpluder.. Ingen fakta ingen rådgivning.. Ren trusler... Er det MF det har bestilt tid.. Nu må han stoppes. Han forvirrer..;1290397089638297603;Kåre Mølbak
106;2019-01-01 14:40:41+00:00;So. Much. Silverware. These 10 clubs have dominated Europe's top 5 leagues.;1080111576320016385;Kåre Mølbak
107;2020-08-03 21:04:01+00:00;Epidemien kan komme ud af kontrol: Kåre Mølbak er bekymret over udviklingen, http://dr.dk:;1290393006684733456;Kåre Mølbak
108;2020-08-03 21:04:01+00:00;Epidemien kan komme ud af kontrol: Kåre Mølbak er bekymret over udviklingen, http://dr.dk: https://www.dr.dk/nyheder/indland/epidemien-kan-komme-ud-af-kontrol-kaare-moelbak-er-bekymret-over-udviklingen;1290393005405478917;Kåre Mølbak
109;2020-08-03 20:37:27+00:00;Epidemien kan komme ud af kontrol: Kåre Mølbak er bekymret over udviklingen https://www.dr.dk/nyheder/indland/epidemien-kan-komme-ud-af-kontrol-kaare-moelbak-er-bekymret-over-udviklingen;1290386320444063749;Kåre Mølbak
